PT	AU	BA	BE	GP	AF	BF	CA	TI	SO	SE	BS	LA	DT	CT	CY	CL	SP	HO	DE	ID	AB	C1	RP	EM	RI	OI	FU	FX	CR	NR	TC	Z9	U1	U2	PU	PI	PA	SN	EI	BN	J9	JI	PD	PY	VL	IS	PN	SU	SI	MA	BP	EP	AR	DI	D2	EA	PG	WC	SC	GA	UT	PM	OA	HC	HP	DA
J								A novel method based on deep learning for aligned fingerprints matching	APPLIED INTELLIGENCE										Fingerprint matching; Deep learning; Finger ConvNet; Fast matching method	SINGULAR POINTS; NEURAL-NETWORKS; ALGORITHM	In this study, a novel method based on deep learning for aligned fingerprints matching is proposed. According to the characteristics of fingerprint images, a convolutional network, Finger ConvNet, is designed. In addition, a new joint supervision signal is used to train Finger ConvNet to obtain deep features. Experimental studies are performed on public fingerprint datasets, the ID Card fingerprint dataset and the Ten-Finger Fingerprint Card fingerprint dataset. Furthermore, four performance indicators, the false matching rate (FMR), false non-matching rate (FNMR), equal error rate (EER) and receiver operating characteristic (ROC) curve, are measured. The experimental results demonstrate the effectiveness of the proposed method, which achieved a competitive effect in comparison with conventional fingerprint matching algorithms in fingerprint verification tasks using the FVC2000, FVC2002, and FVC2004 datasets. Moreover, the matching speed of the proposed method was almost 5 times faster than the fastest conventional fingerprint matching algorithms. In addition, it can be used as a fast matching method to filter out many templates with low scores by setting a threshold according to the matching scores and thus accelerate the process in identification tasks.																	0924-669X	1573-7497				FEB	2020	50	2					397	416		10.1007/s10489-019-01530-4													
J								An algorithm for influence maximization in competitive social networks with unwanted users	APPLIED INTELLIGENCE										Influence maximization; Independent Cascade model; Unwanted users	POSITIVE INFLUENCE; DIFFUSION; MODELS	With the rapid development of online social networks, the problem of influence maximization (IM) has attracted tremendous attention motivated by widespread application scenarios. However, there is less research focusing on the information spreading with the existence of some unwanted users. Such problem has a wide range of applications since there always exist conflicts of interest between competing businesses. In this paper, we formally define the problem of influence maximization with limited unwanted users (IML) under the independent cascade model. In order to avoid the time-consuming process of simulating the propagation in the traditional method of influence maximization, we propose a propagation path based strategy to compute the activation probabilities between the node pairs. Based on the activation probability, we define a propagation increment function to avoid simulating the influence spreading process on the candidate seed nodes. To select the optimal seed set, we present a greedy algorithm to sequentially select the nodes which can maximize the influence increment to join the seed set. Experimental results in real social networks have shown that the algorithm proposed not only outperforms the existing methods but also consumes much less computation time.																	0924-669X	1573-7497				FEB	2020	50	2					417	437		10.1007/s10489-019-01506-4													
J								Adaptive graph regularized nonnegative matrix factorization for data representation	APPLIED INTELLIGENCE										Nonnegative matrix factorization; Graph regularization; Manifold learning; Image clustering	FEATURE-SELECTION; PROJECTION	As a classical data representation method, nonnegative matrix factorization (NMF) can well capture the global structure information of the observed data, and it has been successfully applied in many fields. It is generally known that the local manifold structures will have a better effect than the global structures in image recognition and clustering. The local structure information can well be preserved by the neighbor graph in the manifold learning methods. The traditional neighbor graph constructed relies heavily on the original observed data. However, the original data usually contain a lot of noise and outliers in practical application, which results in obtaining inaccurate neighbor graph, and ultimately leads to performance degradation. How to get the ideal local structure information becomes more and more important. By combing the manifold learning into NMF, we propose an adaptive graph regularized nonnegative matrix factorization (AGNMF). In AGNMF, the neighbor graph is obtained by adaptive iteration. Both the global information and the local manifold can be well captured in AGNMF, and the better data representation can be obtained. A large number of experiments on different data sets show that our AGNMF has good clustering ability.																	0924-669X	1573-7497				FEB	2020	50	2					438	447		10.1007/s10489-019-01539-9													
J								Extracting relations of crime rates through fuzzy association rules mining	APPLIED INTELLIGENCE										Crime data mining; Crime rate; Fuzzy association rule; fp-growth	MEMBERSHIP FUNCTIONS; FRAMEWORK; IMPACT; MODEL	Data mining is an important technology to reveal the patterns from crime data. Although there are many researches about this topic, less work models the relations between rates of different kinds of crime. In this paper, an algorithm based on fuzzy association rules (AR) mining is proposed to discover these relations. Two datasets, which are crimes in Chicago from 2012 to 2017 and crimes in NSW from 2008 to 2012, are used for case studies. At first, crime data is preprocessed, where every kind of crime occurring in every district during every month is counted. For a crime in a combination of district and month, the membership function, which is based on hypothesis testing, is designed to evaluate the degree to which its rate is high, normal or low, and the fuzzy transactional dataset is formed. A bridge between fuzzy transactional dataset and binary AR mining algorithm is built, so those mature tools of binary AR mining can be applied to generate fuzzy ARs. In the results of case studies, the strong relations between rates of different crime can be found. There are many interesting and surprise rules, which are worthy to be further studied by domain experts.																	0924-669X	1573-7497				FEB	2020	50	2					448	467		10.1007/s10489-019-01531-3													
J								Novel grey wolf optimization based on modified differential evolution for numerical function optimization	APPLIED INTELLIGENCE										Grey wolf optimization algorithm; Global optimization; Opposition-based learning; Leader moving-rate strategy; Benchmark functions	ARTIFICIAL BEE COLONY; GLOBAL OPTIMIZATION; ALGORITHM; JADE; HERD	Grey wolf optimization algorithm (GWO) is a new swarm intelligence optimization algorithm proposed in recent years. Because of few control parameters and easy implementation, GWO is widely used in many fields. Compared with other common swarm optimization algorithms, it is more suitable for the global optimization problems. Nevertheless, the algorithm still has the shortcoming of low accuracy and slow convergence speed. In this paper, a novel hybrid optimization algorithm named MDE-GWO is proposed. Firstly, a JADE with opposition-based learning strategy algorithm (MDE) is embedded in GWO to enhance the ability of avoiding a local optimum. Notably, by introducing the opposition-based learning strategy, the search ability of the improved algorithm is increased greatly. Additionally, in order to balance the global and local search capabilities and speed up the convergence of the GWO algorithm, a leader moving-rate strategy is put forward. 28 typical benchmark functions are utilized to test the performance of the improved algorithm. The experimental results show that MDE-GWO has stronger advantages in search accuracy, stability and convergence speed in most cases.																	0924-669X	1573-7497				FEB	2020	50	2					468	486		10.1007/s10489-019-01521-5													
J								Feature subset selection combining maximal information entropy and maximal information coefficient	APPLIED INTELLIGENCE										Feature subset selection; BPSO; MIC; SFS	CLASSIFICATION	Feature subset selection is an efficient step to reduce the dimension of data, which remains an active research field in decades. In order to develop highly accurate and fast searching feature subset selection algorithms, a filter feature subset selection method combining maximal information entropy (MIE) and the maximal information coefficient (MIC) is proposed in this paper. First, a new metric mMIE-mMIC is defined to minimize the MIE among features while maximizing the MIC between the features and the class label. The mMIE-mMIC algorithm is designed to evaluate whether a candidate subset is valid for classification. Second, two searching strategies are adopted to identify a suitable solution in the candidate subset space, including the binary particle swarm optimization algorithm (BPSO) and sequential forward selection (SFS). Finally, classification is performed on UCI datasets to validate the performance of our work compared to 9 existing methods. Experimental results show that in most cases, the proposed method behaves equally or better than the other 9 methods in terms of classification accuracy and F1-score.																	0924-669X	1573-7497				FEB	2020	50	2					487	501		10.1007/s10489-019-01537-x													
J								Skill based transfer learning with domain adaptation for continuous reinforcement learning domains	APPLIED INTELLIGENCE										Reinforcement learning; Transfer learning; Domain adaptation	ACQUISITION; FRAMEWORK; ABSTRACTION	Although reinforcement learning is known as an effective machine learning technique, it might perform poorly in complex problems, especially real-world problems, leading to a slow rate of convergence. This issue magnifies when facing continuous domains where the curse of dimensionality is inevitable, and generalization is mostly desired. Transfer learning is a successful technique to remedy such a problem which results in significant improvements in learning performance by providing generalization not only within a task but also across different but related or similar tasks. The critical issue in transfer learning is how to incorporate the knowledge acquired from learning in a different but related task in the past. Domain adaptation is an exciting paradigm that seeks to address this challenge. In this paper, we propose a novel skill based Transfer Learning with Domain Adaptation (TLDA) approach suitable for continuous RL problems. TLDA discovers and learns skills as high-level knowledge from source task and then uses domain adaptation technique to help agent discover state-action mapping as a relation between the source and target tasks. With such mapping, TLDA can adapt source skills and speed up learning on a new target task. The experimental results verify the achievement of an effective transfer learning method for continuous reinforcement learning problems.																	0924-669X	1573-7497				FEB	2020	50	2					502	518		10.1007/s10489-019-01527-z													
J								Optimizing shapelets quality measure for imbalanced time series classification	APPLIED INTELLIGENCE										Imbalanced time series data; Feature selection; Shapelets; Quality measure	SMOTE	Time series classification has been considered as one of the most challenging problems in data mining and is widely used in a broad range of fields. A biased distribution leads to classification on minority time series objects more severe. A commonly taken approach is to extract or select the representative features to retain the structure of a time series object. However, when the data distribution is imbalanced, the traditional features cannot represent time series effectively, especially in multi-class environment. In this paper, Shapelets - a primitive time series mining technology - is applied to extract the most representative subsequences. Especially, we verify that IG (Information Gain) is unsuitable as a shapelet quality measure for imbalanced data sets. Nevertheless, we propose two quality measures for shapelets on imbalanced binary and multi-class problem respectively. Based on extracted shapelet features, we select the diversified top-k shapelets based on new quality measure to represent the top-k best features and achieve this procedure on map-reduce framework. Lastly, two oversampling methods based on shapelet features are proposed to re-balance the binary and multi-class time series data sets. We validated our methods on the benchmark data sets by comparing with the canonical classifiers and the state-of-the-art time series algorithms. It is verified that the proposed algorithms perform more competitive than the compared methods in statistical significance.																	0924-669X	1573-7497				FEB	2020	50	2					519	536		10.1007/s10489-019-01535-z													
J								Multi-criteria decision making in Pythagorean fuzzy environment	APPLIED INTELLIGENCE										Multi-criteria decision making (MCDM); Pythagorean fuzzy number; Interval-valued Pythagorean fuzzy number; Distance measure; Closeness index; Aggregation	HAMACHER AGGREGATION OPERATORS; HESITANT FUZZY; FUNDAMENTAL PROPERTIES; DIVERGENCE MEASURE; MEMBERSHIP GRADES; INFORMATION; MODEL; SETS; UNCERTAINTY; EXTENSION	Pythagorean fuzzy set, initially extended by Yager from intuitionistic fuzzy set, is capable of modeling information with more uncertainties in the process of multi-criteria decision making (MCDM), thus can be used on wider range of conditions. The fuzzy decision analysis of this paper is mainly built upon two expressions in Pythagorean fuzzy environment, named Pythagorean fuzzy number (PFN) and interval-valued Pythagorean fuzzy number (IVPFN), respectively. We initiate a novel axiomatic definition of Pythagorean fuzzy distance measurement, including PFNs and IVPFNs. After that, corresponding theorems are put forward and then proved. Based on the defined distance measurements, the closeness indexes are developed for both expressions, inspired by the idea of technique for order preference by similarity to ideal solution (TOPSIS) approach. After these basic definitions have been established, the hierarchical decision approach is presented to handle MCDM problems under Pythagorean fuzzy environment. To address hierarchical decision issues, the closeness index-based score function is defined to calculate the score of each permutation for the optimal alternative. To determine criterion weights, a new method based on the proposed similarity measure and aggregation operator of PFNs and IVPFNs is presented according to Pythagorean fuzzy information from decision matrix, rather than being provided in advance by decision makers, which can effectively reduce human subjectivity. An experimental case is then conducted to demonstrate the applicability and flexibility of the proposed decision approach. Finally, extension forms of Pythagorean fuzzy decision approach for heterogeneous information are briefly introduced to show its potentials on further applications in other processing fields with information uncertainties.																	0924-669X	1573-7497				FEB	2020	50	2					537	561		10.1007/s10489-019-01532-2													
J								Unsupervised representation learning based on the deep multi-view ensemble learning	APPLIED INTELLIGENCE										Unsupervised feature learning; Deep learning; Ensemble learning; Fusion; Genetic algorithm	ALGORITHM; NETWORKS; MODELS	Deep networks have recently achieved great success in feature learning problem on various computer vision applications. Among different approaches in deep learning, unsupervised methods have attracted a lot of attention particularly to problems with limited training data. However, compared with supervised methods, unsupervised deep learning methods usually suffer from lower accuracy and higher computational time. To deal with these problems, we aim to restrict the number of connections between successive layers while enhancing discriminatory power using a data-driven approach. To this end, we propose a novel deep multi-view ensemble model. The structure of each layer is composed of an ensemble of encoders or decoders and mask operations. The multi-view ensemble of encoders or decoders enable the network to benefit from local complementary information and preserve local characteristics in final generated features, while mask operations determine the connections between successive layers. The experimental results on popular datasets indicate the effectiveness and validity of the method in clustering and classification tasks while the processing time is reduced.																	0924-669X	1573-7497				FEB	2020	50	2					562	581		10.1007/s10489-019-01526-0													
J								Sandpiper optimization algorithm: a novel approach for solving real-life engineering problems	APPLIED INTELLIGENCE										Optimization; Bio-inspired metaheuristic techniques; Machine-learning; Benchmark test problems	PARTICLE SWARM OPTIMIZATION; SPOTTED HYENA OPTIMIZER; DESIGN; MODEL; PERFORMANCE; HOLE	This paper presents a novel bio-inspired algorithm called Sandpiper Optimization Algorithm (SOA) and applies it to solve challenging real-life problems. The main inspiration behind this algorithm is the migration and attacking behaviour of sandpipers. These two steps are modeled and implemented computationally to emphasize intensification and diversification in the search space. The comparison of proposed SOA algorithm is performed with nine competing optimization algorithms over 44 benchmark functions. The analysis of computational complexity and convergence behaviors of the proposed algorithm have been evaluated. Further, SOA algorithm is hybridized with decision tree machine-learning algorithm to solve real-life applications. The experimental results demonstrated that the proposed algorithm is able to solve challenging constrained optimization problems and outperforms the other state-of-the-art optimization algorithms.																	0924-669X	1573-7497				FEB	2020	50	2					582	619		10.1007/s10489-019-01507-3													
J								Exploring duality on ontology debugging	APPLIED INTELLIGENCE										Ontology debugging; MUPS; MCPS; Duality	DIAGNOSIS	Ontology debugging is an important and intractable reasoning task. Minimal unsatisfiability-preserving subset (MUPS) which is a minimal subset of an ontology to debug an unsatisfiable concept, is an important concept in ontology debugging. Hitting set relation between conflict set and diagnosis is essential for computing all conflict sets. And there has been many successful explorations about hitting set duality between conflict set and diagnosis in many fields. So in this paper, we will explore the duality between MUPS and minimal correctness-preserving subset (MCPS) which denotes the minimal diagnosis of a concept to debug unsatisfiable concepts on ontology debugging domain. Then several methods for computing all MUPSes will be devised based on the duality between MUPS and MCPS, meanwhile parallel strategies are also applied to newly proposed methods. And we show, by an empirical evaluation, that performances of different methods on real world ontologies from different domains. And it is proved that it is meaningful to explore duality on ontology debugging, as it really boosts the efficiency when applied to complex ontologies compared to the previous methods.																	0924-669X	1573-7497				FEB	2020	50	2					620	633		10.1007/s10489-019-01528-y													
J								User correlation model for question recommendation in community question answering	APPLIED INTELLIGENCE										Question recommendation; User correlation model; Community question answering		In this paper, we address the problem of question recommendation that automatically recommends a new question to suitable users to answer in community question answering (CQA). The major challenge of question recommendation is the accurate selection of suitable users to answer. Most of the existing approaches attempt to find suitable users in CQA by estimating user's existing capability, user's interest or blending both for the question. However, these methods ignore correlation among users (askers and answerers) in terms of topic preference. In this study, we propose a user correlation model (UCM) to effectively estimate degree of correlation among users in terms of topic preference. Furthermore, we present the UCM-based approach to question recommendation, which provides a mechanism to naturally integrate the correlation between answerer and asker in terms of topic preference with content relevance between the answerer and the question into a unified probabilistic framework. Experiments using real-world data from Stack Overflow show that our UCM-based approach consistently and significantly improves the performance of question recommendation. Hence, our approach can increase question recommendation accuracy in CQA according to utilize the correlation between answerer and asker in terms of topic preference.																	0924-669X	1573-7497				FEB	2020	50	2					634	645		10.1007/s10489-019-01544-y													
J								How corporate social responsibility activities influence employer reputation: The role of social media capability	DECISION SUPPORT SYSTEMS										Corporate social responsibility activities; Social media capability; Employer reputation; Business value of information technology	INFORMATION-TECHNOLOGY; FIRM PERFORMANCE; BUSINESS TRANSFORMATION; INNOVATION PERFORMANCE; COMPETITIVE ADVANTAGE; IMPACT; SYSTEMS; PROFITABILITY; IDENTITY; ATTRACTIVENESS	This study analyzes the relation between the firm's corporate social responsibility (CSR) activities, employer reputation, and social media in the academic conversation on business value of technology. Motivated by the controversy over the function of social media in the firm's generation of value from CSR activities, this study hypothesizes that firms that perform CSR activities may become better employers and that this positive relationship may be stronger when firms leverage social media technologies. We explain this effect of social media by arguing that these social technologies enable higher social visibility and exposure/credibility. We tested our research model with data from 100 organizations in Spain. The results provided two key insights: 1) CSR activities enable firms to build greater employer reputation; and 2) social media capability amplifies the effect of CSR activities on employer reputation. This study contributes to Information Systems and Business Ethics research by arguing theoretically and demonstrating empirically that leveraging a technology such as social media generates business value through maximization of the positive impact of CSR activities on employer reputation of the firm.																	0167-9236	1873-5797				FEB	2020	129								113223	10.1016/j.dss.2019.113223													
J								Multivariate data quality assessment based on rotated factor scores and confidence ellipsoids	DECISION SUPPORT SYSTEMS										Data quality assessment; Decision-making; Multivariate measurement system; Factor analysis; Varimax rotation; Confidence ellipsoid	R-AND-R; INFORMATION QUALITY; OPTIMIZATION; MODEL	This study explores the nature of the correlation in data to estimate the data quality to be used in decision-making processes. The main contribution of this research is the introduction of a new multivariate method based on rotated factor scores by varimax strategy for the repeatability and reproducibility study to effectively identify possible data of poor quality leading to measurement errors. In addition, a new confidence ellipsoid-based decision support method is developed. The efficiency of the proposed method was demonstrated using the metallographic measurements of the geometric characteristics of the resistance spot welding process. To prove the efficiency of the proposed method, it was compared with other consolidated techniques such as the analysis of variance, weighted principal components method, and factor analysis without rotation. Thus, we verified that the proposed method performed better interpretation of the latent information, minimizing the dimensionality of the data, and separating the quality attributes analyzed by clusters. One response group was classified as acceptable, and the other as marginal. These results were verified by the confidence ellipsoids, in which the proposed method obeyed the Bonferroni bilateral limits, outlining the factors which demonstrated superior discriminatory power with non-overlapping ellipsoids avoiding the confounding and favoring the better data quality analysis for multicriteria decision-making. When compared with the other approaches, the proposed method demonstrated more reliable and robust results without such deficiencies as inversion of the groupings, neglection of the variance-covariance structure, and the variability attributed to the data within the measurement system.																	0167-9236	1873-5797				FEB	2020	129								113173	10.1016/j.dss.2019.113173													
