PT	AU	BA	BE	GP	AF	BF	CA	TI	SO	SE	BS	LA	DT	CT	CY	CL	SP	HO	DE	ID	AB	C1	RP	EM	RI	OI	FU	FX	CR	NR	TC	Z9	U1	U2	PU	PI	PA	SN	EI	BN	J9	JI	PD	PY	VL	IS	PN	SU	SI	MA	BP	EP	AR	DI	D2	EA	PG	WC	SC	GA	UT	PM	OA	HC	HP	DA
J								Lagrange modeling and navigation based on quaternion for controlling a micro AUV under perturbations	ROBOTICS AND AUTONOMOUS SYSTEMS										Underwater vehicle; Dynamic model; Lagrange; Quaternions; Adaptive sliding mode control		This paper addresses the modeling of an autonomous underwater vehicle using quaternion formulation for angular position description and Lagrange method to compute the equations of motion. As the four parameters are dependent and generate a constraint, Lagrange multipliers are used with Baumgarte method to solve and stabilize the system. The dynamic model includes underwater effects like added mass and inertia, hydrodynamic damping, buoyancy and propeller forces. Moreover, a quaternion-based line of sight guidance algorithm is derived to avoid any use of trigonometric function and compute directly the orientation error of the underwater vehicle and the desired attitude in terms of quaternions. Motion control is achieved with a quaternion-based adaptive sliding mode controller rejecting model uncertainties and water current. The simulation results, where the vehicle follows a sequence of way-points including vertical diving motion demonstrate that the proposed guidance algorithm and motion control are deeply relevant both in terms of effectiveness and robustness for this particular type of vehicle and orientation formulation. (C) 2019 Elsevier B.V. All rights reserved.																	0921-8890	1872-793X				FEB	2020	124								103408	10.1016/j.robot.2019.103408													
J								Evolution of robust high speed optical-flow-based landing for autonomous MAVs	ROBOTICS AND AUTONOMOUS SYSTEMS										Evolutionary robotics; Bio-inspired landing; Reality gap; High speed flight	STRATEGY	Automatic optimization of robotic behavior has been the long-standing goal of Evolutionary Robotics. Allowing the problem at hand to be solved by automation often leads to novel approaches and new insights. A common problem encountered with this approach is that when this optimization occurs in a simulated environment, the optimized policies are subject to the reality gap when implemented in the real world. This often results in sub-optimal behavior, if it works at all. This paper investigates the automatic optimization of neurocontrollers to perform quick but safe landing maneuvers for a quadrotor micro air vehicle using the divergence of the optical flow field of a downward looking camera. The optimized policies showed that a piece-wise linear control scheme is more effective than the simple linear scheme commonly used, something not yet considered by human designers. Additionally, we show the utility in using abstraction on the input and output of the controller as a tool to improve the robustness of the optimized policies to the reality gap by testing our policies optimized in simulation on real world vehicles. We tested the neurocontrollers using two different methods to generate and process the visual input, one using a conventional CMOS camera and one a dynamic vision sensor, both of which perform significantly differently than the simulated sensor. The use of the abstracted input resulted in near seamless transfer to the real world with the controllers showing high robustness to a clear reality gap. (C) 2019 Elsevier B.V. All rights reserved.																	0921-8890	1872-793X				FEB	2020	124								103380	10.1016/j.robot.2019.103380													
J								RISE-based adaptive control for EICoSI exoskeleton to assist knee joint mobility	ROBOTICS AND AUTONOMOUS SYSTEMS										Adaptive controller; Asymptotic stability; RISE feedback; Knee exoskeleton	NONLINEAR-SYSTEMS; ASYMPTOTIC TRACKING; ROBOT; REHABILITATION; ORTHOSIS; WALKING; DESIGN; ADAPTATION; STROKE	Exoskeleton devices are used to assist joint motion of subjects suffering from mobility deficiencies. Controlling an exoskeleton subjects to high nonlinearities, which are mainly due to the mechanical coupling, external disturbances, parameter uncertainties, and modeling errors. Keeping in view the requirement of a relatively accurate movement tracking while reducing the disturbances effects, there is a need for a robust controller. In this paper, an adaptive RISE (Robust Integral of Sign Error) controller is developed and implemented on the EICoSI (Exoskeleton Intelligently Communicating and Sensitive to Intention) knee exoskeleton. RISE has an advantage over standard controllers that it achieves semi-global asymptotic tracking even in the presence of unstructured disturbances. But to achieve this tracking, high control gains are required. Thus, to limit such high gains, RISE control strategy is combined with an adaptive controller, which has the advantage of improving the tracking performance while reducing the eventual overshoots. The stability of the coupled human/ exoskeleton system is analyzed based on Lyapunov theory and the system has shown semi-global asymptotic stability. The adaptive RISE controller gives better SNR (signal to noise ratio) by 11% and 2% as compared with adaptive and RISE controller respectively. In terms of tracking error, the adaptive RISE controller shows 9% more RMSE than adaptive controller but 41% less when compared with RISE controller Three experimental scenarios are analyzed to validate the proposed controller, namely (i) external disturbances, that could come from the ground during walking; (ii) induced payload, that could come from the resistive/assistive torque from the muscles and (iii) payload with external disturbances. The system is found to be robust and efficient in tracking the reference trajectories while maintaining limited error and high signal to noise ratio. (C) 2019 Elsevier B.V. All rights reserved.																	0921-8890	1872-793X				FEB	2020	124								103354	10.1016/j.robot.2019.103354													
J								Waterline and obstacle detection in images from low-cost autonomous boats for environmental monitoring	ROBOTICS AND AUTONOMOUS SYSTEMS										Water detection; Autonomous surface vessels; Robotic boats; Robot vision; Water quality monitoring		Waterline detection from images taken by cameras mounted on low-cost autonomous surface vehicles (ASVs) is a key process for obtaining a fast obstacle detection. Achieving an accurate waterline prediction is difficult due to the instability of the ASV on which the camera is mounted and the presence of reflections, illumination changes, and waves. In this work, we present a method for waterline and obstacle detection designed for low-cost ASVs employed in environmental monitoring. The proposed approach is made of two steps: (1) a pixel-wise segmentation of the current image is used to generate a binary mask separating water and non-water regions, (2) the mask is analyzed to infer the position of the waterline, which in turn is used for detecting obstacles. Experiments were carried out on two publicly available datasets containing floating obstacles such as buoys, sailing and motor boats, and swans moving near the ASV. Quantitative results show the effectiveness of the proposed approach with 98.8% pixel-wise segmentation accuracy running at 10 frames per second on an embedded GPU board. (C) 2019 Elsevier B.V. All rights reserved.																	0921-8890	1872-793X				FEB	2020	124								103346	10.1016/j.robot.2019.103346													
J								A data-driven approach to probabilistic impedance control for humanoid robots	ROBOTICS AND AUTONOMOUS SYSTEMS										Impedance control; Probabilistic model; Humanoid robot	IMITATION; TASK	This paper presents a novel approach toward synthesizing whole-body motions from visual perception and reaction force for a humanoid robot that maintains a suitable physical interaction with an environment. A behavior containing a whole-body motion, reaction force, and visual perception is encoded into a probabilistic model referred to as a "motion symbol". The humanoid robot selects a motion symbol appropriate to the current situation and computes references for joint angles and reaction forces according to the selected symbol. The robot subsequently modifies these references to satisfy a desired impedance relating the robot whole-body positions and forces. This computation builds visual and physical feedback loops with knowledge about the behaviors, making it possible for a humanoid robot to not only perform human-like motion behaviors similar to training behaviors, but to also physically adapt to the immediate environment. We applies this proposed framework only to controlling the upper-body motion for a humanoid robot. Experiments demonstrate that the proposed method allows a humanoid robot to control its upper-body motion in response to visual perception and reaction forces acting on its hands to achieve five tasks while controlling its lower-body motion for its balance. (C) 2019 The Authors. Published by Elsevier B.V.																	0921-8890	1872-793X				FEB	2020	124								103353	10.1016/j.robot.2019.103353													
J								Representation and classification of whole-body motion integrated with finger motion	ROBOTICS AND AUTONOMOUS SYSTEMS										Motion primitive; Motion classification; Stochastic model	LANGUAGE; PRIMITIVES	This paper presents a novel approach toward representing human whole-body motions with fingers and classification of human motions while performing tasks that require delicate finger movements, such as holding or grasping. Human whole-body motions are recorded using an optical motion capture system that measures positions of markers attached to a performer. Additionally, the performer wears data gloves with strain gauges fixed at the finger joints to measure flexions and extensions. Combining whole-body motion with finger motions forms a representation of integrated motion, which is subsequently encoded into a probabilistic model whose parameters are optimized such that the model most likely generates the training data for the integrated motion. Observations of integrated motion are classified into the relevant probabilistic model with the largest probability of generating the observation. Synchronous measurements of human whole-body and finger motions created a dataset of integrated human motions. We tested our proposed approach on this dataset, thereby demonstrating that representations of whole-body motion integrated with finger motions improved classification of human motions while manipulating objects. (C) 2019 The Authors. Published by Elsevier B.V.																	0921-8890	1872-793X				FEB	2020	124								103378	10.1016/j.robot.2019.103378													
J								Robust mission planning for Autonomous Marine Vehicle fleets	ROBOTICS AND AUTONOMOUS SYSTEMS										Planning Al; Multi-robot systems; Marine robotics	ORIENTEERING PROBLEM; ARCHITECTURE; ALGORITHM	Mission planning for Autonomous Marine Vehicles (AMVs) is non-trivial because significant uncertainty is present when profiling the operating environment, especially for underwater missions. Mission complexity is compounded for each vehicle added to the mission. In practice, fleet operations are formulated as separate temporal problems by the operator and solved using a temporal planner. This paper proposes a planning method that uses energy as the base planning resource instead of time. Unlike temporal planners, energy planners account for physical loads endured by the vehicles. The extent of uncertainty in the vehicle loads is clarified by using the vehicle dynamics model and Monte Carlo simulation on the model parameters. The planning method is a multistage procedure to decompose operator specified task, obstacle, and vehicle data into an energy formulation of the Team Orienteering Problem (TOP) which is then solved using Discrete Strengthened PSO (DStPSO). The DStPSO algorithm has been modified to include a selective swarm size decay method that allows for larger initial swarm sizes to promote early exploration and preserves a percentage of the best performing particles on each iteration to save computational resources. The planner produces near-optimal routes containing feasible trajectories for individual vehicles that maximise tasks completed according to individual vehicle energy constraints. A case-study mission for long-term, large-scale, underwater inspection of a wind turbine array was converted into input data to evaluate the planner. Energy planning presents the opportunity for vehicles to actively monitor the feasibility of their individual plan against their current energy consumption, allowing for advanced reasoning and fault handling to occur in situ without operator assistance. (C) 2019 Elsevier B.V. All rights reserved.																	0921-8890	1872-793X				FEB	2020	124								103404	10.1016/j.robot.2019.103404													
J								A synthetic dataset for Visual SLAM evaluation	ROBOTICS AND AUTONOMOUS SYSTEMS										Synthetic dataset; Computer graphic; Visual SLAM; Algorithm validation; Evaluation criteria	ODOMETRY; VISION	Vision-based self-localization methods are key functionalities for various research topics. Recent research results on related fields have catalyzed several accurate, versatile and reliable real-time Visual SLAM systems suitable for self-localization under a wide variety of environmental preconditions. These methods extend their functionalities from being only a good camera tracker to being able to recursively build up camera's surroundings. The fast development of Visual SLAM research has proposed demands on innovating evaluation methods for Visual SLAM systems. However, retrieving images and ground truth from various kinds of environments, estimating calibration parameters between several sensors and annotating useful labels all require cumbersome human labor and will introduce inevitable errors. In this paper, we propose a method that uses virtually established models to automatically generate photorealistic images with accurate ground truth and several kinds of pixel-level annotations useful for Visual SLAM development and evaluation. We build and render a challenging dataset in low-texture environments with large scale camera movement, multiple moving objects and varying luminance status. We also propose several new evaluation criteria that can fully take advantage of ground truth and annotations from synthetic datasets. Experiments are conducted using the proposed datasets and criteria with several state-of-the-art Visual SLAM methods to demonstrate the functionality of our datasets. (C) 2019 Elsevier B.V. All rights reserved.																	0921-8890	1872-793X				FEB	2020	124								103336	10.1016/j.robot.2019.103336													
J								Disturbance compensation based controller for an indoor blimp robot	ROBOTICS AND AUTONOMOUS SYSTEMS										Blimp robot; Navigation; Estimation; Uncertainty compensation; Robust control	TRAJECTORY TRACKING; PATH-TRACKING; AIRSHIP; SYSTEM	This paper presents the robust controller design for an indoor blimp robot to achieve application such as the surveillance. The commonly used 6 degrees of freedom dynamic model is simplified under reasonable assumptions and decoupled into two independent parts. The blimp simplified horizontal plane movement model is complemented with disturbance terms to ensure the modeling accuracy, then it is transformed to a simpler form for the ease of controller design. Next, the disturbance terms are evaluated by the designed real-time estimator, and the perturbation estimates are compensated in the conceived motion controller for cancellation of the influence of disturbances. The performance and robustness of the disturbance compensation-based controller are verified by both simulations and experiments on the developed blimp robot. Finally, the results prove the feasibility of the blimp robot in indoor surveillance application by stabilizing itself at a fixed position or patrolling along a predefined path. (C) 2019 Elsevier B.V. All rights reserved.																	0921-8890	1872-793X				FEB	2020	124								103402	10.1016/j.robot.2019.103402													
J								A survey of underwater docking guidance systems	ROBOTICS AND AUTONOMOUS SYSTEMS										Autonomous underwater vehicles; Autonomous docking; Universal docking guidance framework	MODEL-PREDICTIVE CONTROL; RECEDING HORIZON CONTROL; TIME TRAJECTORY GENERATION; OPTIMIZATION; VEHICLES; AIRCRAFT; DESIGN; MANAGEMENT; ALGORITHM; DYNAMICS	Autonomous underwater vehicles (AUVs) are increasingly being used for underwater survey and exploration missions. The expanding mission scope for AUVs highlights the need for a long-endurance operational capability, which mainly depends on propulsion system efficiency and battery capacity. The use of submerged docking stations permitting battery recharge and data download/upload offers a means of enabling persistence without compromising propulsion and payload power budgets, while also reducing associated deployment/recovery costs and risks. Autonomous docking with an underwater station is, however, complicated by the presence of currents and obstacles in the water, and by the relative dynamic differences in pose between the dock and the vehicle. A robust docking guidance system is identified as a core and crucial component for ensuring successful AUV docking. This paper presents a detailed literature review summarizing the current state-of-the-art in AUV docking guidance methodologies, identifying their relative merits and shortcomings, and revealing the docking guidance methodologies that seems to be the most prominent. (C) 2019 Elsevier B.V. All rights reserved.																	0921-8890	1872-793X				FEB	2020	124								103382	10.1016/j.robot.2019.103382													
J								Enhancing adaptability with local reactive behaviors for hexapod walking robot via sensory feedback integrated central pattern generator	ROBOTICS AND AUTONOMOUS SYSTEMS										Hexapod walking robot; Legged locomotion; Local reactive behavior; Central pattern generator (CPG)	NEURAL-NETWORKS; LOCOMOTION; CPG; COORDINATION; LEG; POSITION; INSECTS; SYSTEM; GAIT	Local reactive behaviors endow animals the ability to exhibit agile and dexterous performance when traversing challenging terrains. This paper presents a novel locomotion control method based on the central pattern generator (CPG) concept for hexapod walking robot with local reactive behavior to cope with terrain irregularities. Firstly, a two-layered CPG-based single-leg controller is developed to generate the rhythmical movement for each leg executing tripod walking. The Van der Pol oscillator is employed on the high-layer to construct a coupled CPG network which serves as a phase regulator (PR) to produce rhythmic signals with prescribed phase relations amongst neurons. On the low-layer, an auxiliary linear converter (LC) transforms these signals into the desired joint trajectories. Subsequently, by embodying the proprioceptive sensing and external tactile information as the sensory feedback, two typical local reactive mechanisms including the elevator reflex and searching reflex are achieved by virtue of on-line adjusting the coupling scheme of the PR and the coefficients of the LC. A locomotion control framework for hexapod walking robot is further established by combining the single-leg controller with a finite state machine to allocate swing/stance commands for individual joints in dealing with terrain perturbations. The effectiveness of the proposed method has been verified through both virtual model simulation and experiments on a physical hexapod platform. (C) 2019 Elsevier B.V. All rights reserved.																	0921-8890	1872-793X				FEB	2020	124								103401	10.1016/j.robot.2019.103401													
J								Flocking and topology manipulation based on space partitioning	ROBOTICS AND AUTONOMOUS SYSTEMS										Network topology; Space partitioning; Decision-making; Limited ranges	NETWORK TOPOLOGIES; STEALTH	Network topology plays a critical role in enabling a multi-agent system to adapt to environment changes and achieve desired objectives. This paper presents distributed topology manipulation schemes for a group of mobile agents. The agents have limited heterogeneous communication ranges, and connections among them are directional. The topology is established from the overlapping communication ranges. The admissible space is partitioned into enclosed areas by connectivity among the agents based on their communication ranges. Each agent occupies an enclosed area, and its decision-making manipulates the topology by guiding itself to an adjacent enclosed area. Both independent and coordinated decision-making approaches are provided. A guidance algorithm is designed to drive the vehicles to a flexible formation, in which the robustness of the network topology is enhanced. (C) 2019 Elsevier B.V. All rights reserved.																	0921-8890	1872-793X				FEB	2020	124								103328	10.1016/j.robot.2019.103328													
J								Vision-based magnetic actuator positioning for wireless control of microrobots	ROBOTICS AND AUTONOMOUS SYSTEMS											SYSTEM; FIELD; ROBOT	This work is concerned with targeted drug delivery inside the human body using magnetic microrobots. It proposes a vision-based magnetic platform for guiding microrobots in both open-loop/closed-loop schemes. The open-loop scheme can be used for example in the case of the inner ear, where the microrobots cannot be localized in real time. On the other hand, for more accuracy, closed-loop scheme can be used for organs as the human eye since microrobots can be localized using a vision sensor. For both schemes, the platform is designed to compensate for human body movements. It is composed of a new magnetic actuator mounted on a robot end-effector and a hybrid vision system. The latter consists of a camera and two microscopes, while the newly proposed magnetic actuator is built using four permanent magnets. The proposed actuator has been designed to create a local maximum of the magnetic field magnitude in a planar workspace. This results in a convergence point for magnetic microrobots that are in its influence zone, making possible open-loop control with a satisfactory accuracy. The procedures for calibrating each component of the proposed platform are described and validated. Finally, several experiments have been carried out to validate the modeling part and to show the feasibility of the concept. The obtained experimental results show that using such platform, the microrobots guiding can be achieved in open-loop under reasonable perturbations and in closed-loop with an accuracy of 200 mu m. (C) 2019 Elsevier B.V. All rights reserved.																	0921-8890	1872-793X				FEB	2020	124								103366	10.1016/j.robot.2019.103366													
J								Non-aligned double JPEG compression detection based on refined Markov features in QDCT domain	JOURNAL OF REAL-TIME IMAGE PROCESSING										Color image forensics; Non-aligned double JPEG compression detection; Quaternion discrete cosine transform Markov model; Real-time image feature selection	SERVICE RECOMMENDATION; IMAGES	Due to the widespread use of the JPEG format, non-aligned double JPEG (NA-DJPEG) compression is very common in image tampering. Therefore, non-aligned double JPEG compression detection has attracted significant attention in digital forensics in recent years. In most of the previous detection algorithms, grayscale images are used directly, or color images are first converted into grayscale images and then processed. However, it is worth noting that most tampered images are color images. To make full use of the color information in images, a detection algorithm, which uses color images directly, is put forward in this paper. The algorithm based on refined Markov in quaternion discrete cosine transform (QDCT) domain is proposed for NA-DJPEG compression detection. Firstly, color information of a given JPEG image is extracted from blocked images to construct quaternion, and then block image QDCT coefficient matrices, including amplitude and three angles (psi, phi, and theta) can be obtained. Secondly, the refined Markov features are generated from the transition probability matrix in the corresponding refinement process. Our proposed refinement method not only reduces redundant features but also makes the acquired features more efficient in detection. Therefore, the refined Markov features can not only capture the intra-block correlation between block QDCT coefficients but also improve computing efficiency in real-time. Finally, support vector machine (SVM) method is employed for NA-DJPEG compression detection. The experiment results demonstrate that the proposed algorithm not only make use of color information of images, but also can achieve better detection performance with small size images (i.e., 64x64) outperforming state-of-the-art detection methods tested on the same dataset.																	1861-8200	1861-8219				FEB	2020	17	1			SI		7	16		10.1007/s11554-019-00929-z													
