PT	AU	BA	BE	GP	AF	BF	CA	TI	SO	SE	BS	LA	DT	CT	CY	CL	SP	HO	DE	ID	AB	C1	RP	EM	RI	OI	FU	FX	CR	NR	TC	Z9	U1	U2	PU	PI	PA	SN	EI	BN	J9	JI	PD	PY	VL	IS	PN	SU	SI	MA	BP	EP	AR	DI	D2	EA	PG	WC	SC	GA	UT	PM	OA	HC	HP	DA
J								Accuracy of approximation operators during covering evolutions	INTERNATIONAL JOURNAL OF APPROXIMATE REASONING										Covering evolution; Covering-based rough set; Neighborhood operator; Core system; Accuracy of approximation operator	ROUGH SETS; NEIGHBORHOOD OPERATORS	We express our concern over two issues in this paper: one is which characters are foundational for multitudinous covering-based rough models as generalizations of Pawlak's rough sets, i.e., which properties of covering-based rough sets guarantee the consistency of them and Pawlak's over partitions; the other is how to utilize this equivalence in simplifying diverse covering-based approximation operators. We demonstrate that covering-based rough models are equivalent to Pawlak's on partitions if they satisfy granule selection principles, which are weaker than a combination of contraction, extension, monotonicity, addition and granularity. In order to take advantage of their equivalence, we illustrate a method named "covering evolution" to change granules from given coverings to corresponding partitions for covering-based approximation operators. The evolutions can be divided into three steps: at the beginning, coverings are transformed into 1-neighborhood systems based on some quintessential neighborhood operators, then in the middle, more-refined 1-neighborhood systems are built by using "cores" from general topology, and at last, core systems (in fact, partitions) are extracted from these more-refined 1-neighborhood systems. We lay a strong emphasis on the variations in accuracy of six representative covering-based approximation operators during three evolutions, two of which preserve the accuracy of approximation operators. The investigation carried on covering evolutions helps us to establish the corresponding mapping relationship from covering spaces to partition spaces directly, and therefore provides a convenient method for making choice of covering-based approximation operators as they are consistent with the classical Pawlak's rough sets over partitions. (C) 2019 Elsevier Inc. All rights reserved.																	0888-613X	1873-4731				FEB	2020	117						1	14		10.1016/j.ijar.2019.10.012													
J								A bias-variance based heuristic for constructing a hybrid logistic regression-naive Bayes model for classification	INTERNATIONAL JOURNAL OF APPROXIMATE REASONING										Logistic regression; Naive Bayes; Hybrid discriminative-generative model; Bias-variance strategy; Model construction heuristic	VS. GENERATIVE CLASSIFIERS	Discriminative classifiers tend to have lower asymptotic classification errors, while generative classifiers can be more accurate when the training set size is small. In this paper, we examine the construction of hybrid models from categorical data, where we use logistic regression (LR) as a discriminative component, and naive Bayes (NB) as a generative component. We adopt a bias-variance tradeoff based strategy, with the objective of minimizing the sum of these two errors. Specifically, the proposed heuristic consists of functions of training sample size and conditional dependence among features. These functions serve as proxies for model variance and model bias. We implement our method on 25 different classification datasets, and find that the hybrid model does better than pure LR and pure NB. Our proposed method is competitive with random forest. Although the hybrid model fails to beat LASSO in predictive performance, as suggested by the experimental results, the difference appears to be insignificant when the number of features is small. Also, the hybrid model requires less training time than LASSO, which makes it more attractive when the training time is a big concern. (C) 2019 Elsevier Inc. All rights reserved.																	0888-613X	1873-4731				FEB	2020	117						15	28		10.1016/j.ijar.2019.09.007													
J								Discovering causal graphs with cycles and latent confounders: An exact branch-and-bound approach	INTERNATIONAL JOURNAL OF APPROXIMATE REASONING										Graphical models; Structure learning; Causal discovery; Branch and bound; Optimization	BAYESIAN NETWORKS; MODELS	Understanding causal relationships is a central challenge in many research endeavours. Recent research has shown the importance of accounting for feedback (cycles) and latent confounding variables, as they are prominently present in many data analysis settings. However, allowing for cycles and latent confounders makes the structure learning task especially challenging. The constraint-based approach is able to learn causal graphs even over such general search spaces, but to obtain high accuracy, the conflicting (in)dependence information in sample data need to be resolved optimally. In this work, we develop a new practical algorithmic approach to solve this computationally challenging combinatorial optimization problem. While recent advances in exact algorithmic approaches for constraint-based causal discovery build upon off-the-shelf declarative optimization solvers, we propose a first specialized branch-and-bound style exact search algorithm. Our problem-oriented approach enables directly incorporating domain knowledge for developing a wider range of specialized search techniques for the problem, including problem-specific propagators and reasoning rules, and branching heuristics together with linear programming based bounding techniques, as well as directly incorporating different constraints on the search space, such as sparsity and acyclicity constraints. We empirically evaluate our implementation of the approach, showing that it outperforms current state of art in exact constraint-based causal discovery on real-world instances. (C) 2019 Elsevier Inc. All rights reserved.																	0888-613X	1873-4731				FEB	2020	117						29	49		10.1016/j.ijar.2019.10.009													
J								Copulas and fuzzy implications	INTERNATIONAL JOURNAL OF APPROXIMATE REASONING										Copula; Fuzzy implication		We introduce a new method for constructing fuzzy implications based on arbitrary two copulas and some fuzzy implication. Our approach covers two well-known constructions of fuzzy implications based on an arbitrary single copula. We also discuss some properties of the proposed method and provide several interesting examples. (C) 2019 Elsevier Inc. All rights reserved.																	0888-613X	1873-4731				FEB	2020	117						52	59		10.1016/j.ijar.2019.11.006													
J								Preference disaggregation for multiple criteria sorting with partial monotonicity constraints: Application to exposure management of nanomaterials	INTERNATIONAL JOURNAL OF APPROXIMATE REASONING										Multiple criteria sorting; Incomplete information; Preference disaggregation; Non-monotonicity; Nanomaterials; Exposure management	WISE ELICITATION QUESTIONS; ADDITIVE VALUE-FUNCTIONS; ORDINAL REGRESSION; FRAMEWORK; NANOTECHNOLOGY; HEURISTICS; RANKING; SET	We propose a novel approach to multiple criteria sorting incorporating a threshold-based value-driven procedure. The parameters deciding upon the shape of marginal value functions and separating class thresholds are inferred through preference disaggregation from the Decision Maker's incomplete assignment examples and partial requirements on the type of (non-)monotonicity for each marginal value function. These types include standard monotonic shapes, level-monotonic functions, A- and V-types combining increasing and decreasing value trends, and unknown monotonicity constraints. A representative instance of the sorting model compatible with the preference information is constructed by solving a dedicated Mixed-Integer Linear Programming problem. Its complexity is controlled by minimizing the number of changes in monotonicity between all subsequent sub-intervals of marginal value functions. The assignments derived using the constructed representative model are validated against the outcomes of robustness analysis. The proposed method is applied to a real-world problem of exposure management of engineered nanomaterials. We develop a model for predicting precaution level while handling nanomaterials in certain conditions using a respirator. The model captures interrelations between ten accounted evaluation criteria, including both monotonic and non-monotonic criteria, and the recommended class assignment. This makes it suitable for the management of exposure scenarios, which have not been directly judged by the experts. (C) 2019 The Authors. Published by Elsevier Inc.																	0888-613X	1873-4731				FEB	2020	117						60	80		10.1016/j.ijar.2019.11.007													
J								A novel T-S fuzzy particle filtering algorithm based on fuzzy C-regression clustering	INTERNATIONAL JOURNAL OF APPROXIMATE REASONING										T-S fuzzy model; Particle filtering; Fuzzy C-regression clustering	TRACKING; INFORMATION; STATE	In this paper, a novel Takagi-Sugeno (T-S) fuzzy model particle filtering algorithm (TSF-PF) based on fuzzy C-regression clustering is proposed for uncertainty modeling of the target dynamic model with non-Gaussian noise. In the proposed algorithm, a generic semantic framework of the T-S fuzzy model is constructed to incorporate spatial feature information of a target into the particle filter, in which the spatial feature information is characterized by several semantic fuzzy sets. Meanwhile, a fuzzy C-regression clustering method based on correntropy is proposed to adaptively identify the premise parameters of the T-S fuzzy model, which is used to adjust the weight of models, and a Kalman filter is used to identify the consequent parameters. And then an efficient importance density function is constructed by using the proposed T-S fuzzy model, which can efficiently improve the robust and diversity of the sampling particles. Furthermore, in order to improve the real-time performance of the proposed algorithm, two improved T-S fuzzy model particle filtering algorithms are presented. The simulation results show that the tracking performance of the proposed algorithms are better than that of the traditional interacting multiple model (IMM), interacting multiple model unscented Kalman filter (IMMUKF), interacting multiple model particle filter (IMMPF) and interacting multiple model Rao-Blackwellized particle filter (IMMRBPF). Particularly, the proposed algorithms can accurately track the maneuvering target when the moving direction abruptly changes or the prior information of the target dynamic model is inaccuracy. (C) 2019 Elsevier Inc. All rights reserved.																	0888-613X	1873-4731				FEB	2020	117						81	95		10.1016/j.ijar.2019.11.005													
J								Quantitative three-way class-specific attribute reducts based on region preservations	INTERNATIONAL JOURNAL OF APPROXIMATE REASONING										Rough sets; Probabilistic rough sets; Attribute reduction; Class-specific attribute reducts; Three-way decisions	DECISION-MAKING; UNCERTAINTY MEASURES; ROUGH; ENTROPY	Attribute reduction of rough set theory is effective for intelligent information processing, and class-specific attribute reducts are beneficial for pattern recognition and rule reasoning. According to three-way decisions, class-specific reducts already have three-way types (namely, positive, negative, and positive-negative) of qualitative optimization, which adhere to classical rough sets. In terms of region preservations, there are no corresponding three-way types of quantitative optimization that match probabilistic rough sets. Thus, this paper constructs and investigates quantitative three-way class-specific attribute reducts based on region preservations. First, the uncertainty/nonmonotonicity of quantitative region change is revealed, and it naturally induces the reduction criteria of quantitative region preservations. Then, quantitative three-way class-specific reducts are constructed, and their basic properties regarding their necessary conditions, attribute cores, and reduct algorithms are achieved. Furthermore, their interrelation regarding equivalence and strengthening/balance are obtained for consistent and inconsistent decision classes, respectively, and their expansions for qualitative three-way class-specific reducts are proved. Finally, relevant concepts and obtained results are effectively verified by decision tables and data experiments. By virtue of sure region preservations, quantitative three-way class-specific attribute reducts robustly extend the existing qualitative three-way class-specific reducts and facilitate the optimal identification and quantitative reasoning of class-specific patterns. (C) 2019 Elsevier Inc. All rights reserved.																	0888-613X	1873-4731				FEB	2020	117						96	121		10.1016/j.ijar.2019.11.003													
J								Multi-attribute group decision-making method based on multi-granulation weights and three-way decisions	INTERNATIONAL JOURNAL OF APPROXIMATE REASONING										Multi-attribute group decision-making; Interval-valued intuitionistic uncertain; linguistic variable; Multi-granulation weight; Three-way decisions; Risk attitude	THEORETIC ROUGH SETS; LINGUISTIC ASSESSMENT; AGGREGATION OPERATORS; SCIENTOMETRICS; INFORMATION; DEVIATION; CONSENSUS; FUSION	With the increasing complexity of decision-making problems and environment, the integration and fusion of three-way decisions, rough set and multi-attribute group decision-making (MAGDM) have become a major trend in the field of decision analysis. Although many researchers have presented various MAGDM methods under different environments, there are still some imperfections, such as the weight information is not comprehensive or flexible enough, the decision results lack interpretability, and the impact of risk attitude is not fully taken into account. In order to overcome the above shortcomings and improve the scientificity and rationality of decision-making, a novel data-driven MAGDM method under interval-valued intuitionistic uncertain linguistic environment is established based on the idea of multi-granulation and three-way decisions. Our contributions can be identified as follows: (1) The multi-granulation weight mining and fusion methods for experts and attributes are proposed, respectively; (2) The coarse-granulation grading information based on three-way decisions is developed to enhance the interpretability and reference value of decision results; (3) The expected value with risk attitude factor is defined to compare interval-valued intuitionistic uncertain linguistic variables (IVIULVs) and then is used to grade and rank alternatives under different risk attitudes. To illustrate the feasibility and practicality of the proposed method, a case of logistics supplier selection in e-commerce enterprises is demonstrated. Furthermore, the advantages and characteristics of the proposed method are highlighted via detailed comparison and thorough analysis. (C) 2019 Elsevier Inc. All rights reserved.																	0888-613X	1873-4731				FEB	2020	117						122	147		10.1016/j.ijar.2019.11.008													
J								Capturing the Geometry of Object Categories from Video Supervision	IEEE TRANSACTIONS ON PATTERN ANALYSIS AND MACHINE INTELLIGENCE										Three-dimensional displays; Geometry; Shape; Solid modeling; Estimation; Image reconstruction; Training; Monocular pose estimation; monocular depth estimation; point-cloud estimation; geometry reconstruction		We propose an unsupervised method to learn the 3D geometry of object categories by looking around them. Differently from traditional approaches, this method does not require CAD models or manual supervision. Instead, using only video sequences showing object instances from a moving viewpoint, the method learns a deep neural network that can predict several aspects of the 3D geometry of such objects from single images. The network has three components. The first is a Siamese viewpoint factorization network that robustly aligns the input videos and learns to predict the absolute viewpoint of the object from a single image. The second is a depth estimation network that performs monocular depth prediction. The third is a shape completion network that predicts the full 3D shape of the object from the output of the monocular depth prediction module. While the three modules solve very different task, we show that they all benefit significantly from allowing networks to perform probabilistic predictions. This results in a self-assessment mechanism which is crucial for obtaining high quality predictions. Our network achieves state-of-the-art results on viewpoint prediction, depth estimation, and 3D point cloud estimation on public benchmarks.																	0162-8828	1939-3539				FEB	2020	42	2					261	275		10.1109/TPAMI.2018.2871117													
J								Deep Metric Learning with BIER: Boosting Independent Embeddings Robustly	IEEE TRANSACTIONS ON PATTERN ANALYSIS AND MACHINE INTELLIGENCE										Measurement; Training; Boosting; Correlation; Feature extraction; Robustness; Task analysis; Metric learning; deep learning; convolutional neural network		Learning similarity functions between image pairs with deep neural networks yields highly correlated activations of embeddings. In this work, we show how to improve the robustness of such embeddings by exploiting the independence within ensembles. To this end, we divide the last embedding layer of a deep network into an embedding ensemble and formulate the task of training this ensemble as an online gradient boosting problem. Each learner receives a reweighted training sample from the previous learners. Further, we propose two loss functions which increase the diversity in our ensemble. These loss functions can be applied either for weight initialization or during training. Together, our contributions leverage large embedding sizes more effectively by significantly reducing correlation of the embedding and consequently increase retrieval accuracy of the embedding. Our method works with any differentiable loss function and does not introduce any additional parameters during test time. We evaluate our metric learning method on image retrieval tasks and show that it improves over state-of-the-art methods on the CUB-200-2011, Cars-196, Stanford Online Products, In-Shop Clothes Retrieval and VehicleID datasets. Therefore, our findings suggest that by dividing deep networks at the end into several smaller and diverse networks, we can significantly reduce overfitting.																	0162-8828	1939-3539				FEB	2020	42	2					276	290		10.1109/TPAMI.2018.2848925													
J								Distributed Very Large Scale Bundle Adjustment by Global Camera Consensus	IEEE TRANSACTIONS ON PATTERN ANALYSIS AND MACHINE INTELLIGENCE										Cameras; Bundle adjustment; Optimization; Convex functions; Convergence; Merging; Bundle adjustment; structure-from-motion; 3D reconstruction; distributed computing	ALTERNATING DIRECTION METHOD; PROXIMAL POINT ALGORITHM; NONCONVEX; CONVERGENCE	The increasing scale of Structure-from-Motion is fundamentally limited by the conventional optimization framework for the all-in-one global bundle adjustment. In this paper, we propose a distributed approach to coping with this global bundle adjustment for very large scale Structure-from-Motion computation. First, we derive the distributed formulation from the classical optimization algorithm ADMM, Alternating Direction Method of Multipliers, based on the global camera consensus. Then, we analyze the conditions under which the convergence of this distributed optimization would be guaranteed. In particular, we adopt over-relaxation and self-adaption schemes to improve the convergence rate. After that, we propose to split the large scale camera-point visibility graph in order to reduce the communication overheads of the distributed computing. The experiments on both public large scale SfM data-sets and our very large scale aerial photo sets demonstrate that the proposed distributed method clearly outperforms the state-of-the-art method in efficiency and accuracy.																	0162-8828	1939-3539				FEB	2020	42	2					291	303		10.1109/TPAMI.2018.2840719													
J								Globally-Optimal Inlier Set Maximisation for Camera Pose and Correspondence Estimation	IEEE TRANSACTIONS ON PATTERN ANALYSIS AND MACHINE INTELLIGENCE										Cameras; Three-dimensional displays; Robustness; Optimization; Pose estimation; Geometry; Solid modeling; Camera pose estimation; registration; camera calibration; imaging geometry; global optimisation; branch-and-bound	EFFICIENT	Estimating the 6-DoF pose of a camera from a single image relative to a 3D point-set is an important task for many computer vision applications. Perspective-n-point solvers are routinely used for camera pose estimation, but are contingent on the provision of good quality 2D-3D correspondences. However, finding cross-modality correspondences between 2D image points and a 3D point-set is non-trivial, particularly when only geometric information is known. Existing approaches to the simultaneous pose and correspondence problem use local optimisation, and are therefore unlikely to find the optimal solution without a good pose initialisation, or introduce restrictive assumptions. Since a large proportion of outliers and many local optima are common for this problem, we instead propose a robust and globally-optimal inlier set maximisation approach that jointly estimates the optimal camera pose and correspondences. Our approach employs branch-and-bound to search the 6D space of camera poses, guaranteeing global optimality without requiring a pose prior. The geometry of SE(3) is used to find novel upper and lower bounds on the number of inliers and local optimisation is integrated to accelerate convergence. The algorithm outperforms existing approaches on challenging synthetic and real datasets, reliably finding the global optimum, with a GPU implementation greatly reducing runtime.																	0162-8828	1939-3539				FEB	2020	42	2					328	342		10.1109/TPAMI.2018.2848650													
J								Hierarchical Binary CNNs for Landmark Localization with Limited Resources	IEEE TRANSACTIONS ON PATTERN ANALYSIS AND MACHINE INTELLIGENCE										Pose estimation; Computer architecture; Face; Task analysis; Quantization (signal); Neural networks; Training; Binary convolutional neural networks; residual learning; landmark localization; human pose estimation; face alignment	POSE ESTIMATION; FACE ALIGNMENT	Our goal is to design architectures that retain the groundbreaking performance of Convolutional Neural Networks (CNNs) for landmark localization and at the same time are lightweight, compact and suitable for applications with limited computational resources. To this end, we make the following contributions: (a) we are the first to study the effect of neural network binarization on localization tasks, namely human pose estimation and face alignment. We exhaustively evaluate various design choices, identify performance bottlenecks, and more importantly propose multiple orthogonal ways to boost performance. (b) Based on our analysis, we propose a novel hierarchical, parallel and multi-scale residual architecture that yields large performance improvement over the standard bottleneck block while having the same number of parameters, thus bridging the gap between the original network and its binarized counterpart. (c) We perform a large number of ablation studies that shed light on the properties and the performance of the proposed block. (d) We present results for experiments on the most challenging datasets for human pose estimation and face alignment, reporting in many cases state-of-the-art performance. (e) We further provide additional results for the problem of facial part segmentation. Code can be downloaded from https://www.adrianbulat.com/binary-cnn-landmarks.																	0162-8828	1939-3539				FEB	2020	42	2					343	356		10.1109/TPAMI.2018.2866051													
J								Leader-Based Multi-Scale Attention Deep Architecture for Person Re-Identification	IEEE TRANSACTIONS ON PATTERN ANALYSIS AND MACHINE INTELLIGENCE										Feature extraction; Cameras; Task analysis; Computer architecture; Computational modeling; Adaptation models; Clothing; Person re-identification; multi-scale deep learning; self-attention; domain generalization	NETWORK	Person re-identification (re-id) aims to match people across non-overlapping camera views in a public space. This is a challenging problem because the people captured in surveillance videos often wear similar clothing. Consequently, the differences in their appearance are typically subtle and only detectable at particular locations and scales. In this paper, we propose a deep re-id network (MuDeep) that is composed of two novel types of layers - a multi-scale deep learning layer, and a leader-based attention learning layer. Specifically, the former learns deep discriminative feature representations at different scales, while the latter utilizes the information from multiple scales to lead and determine the optimal weightings for each scale. The importance of different spatial locations for extracting discriminative features is learned explicitly via our leader-based attention learning layer. Extensive experiments are carried out to demonstrate that the proposed MuDeep outperforms the state-of-the-art on a number of benchmarks and has a better generalization ability under a domain generalization setting.																	0162-8828	1939-3539				FEB	2020	42	2					371	385		10.1109/TPAMI.2019.2928294													
