PT	AU	BA	BE	GP	AF	BF	CA	TI	SO	SE	BS	LA	DT	CT	CY	CL	SP	HO	DE	ID	AB	C1	RP	EM	RI	OI	FU	FX	CR	NR	TC	Z9	U1	U2	PU	PI	PA	SN	EI	BN	J9	JI	PD	PY	VL	IS	PN	SU	SI	MA	BP	EP	AR	DI	D2	EA	PG	WC	SC	GA	UT	PM	OA	HC	HP	DA
J								Towards Universal Control System for Powered Ankle-Foot Prosthesis: A Simulation Study	INTERNATIONAL JOURNAL OF FUZZY SYSTEMS										Powered ankle-foot; Robotic ankle-foot; Genetic fuzzy rule-based control system; Impedance fuzzy control system; Hierarchical control; system; Adaptive Fuzzy System	GENETIC FUZZY-SYSTEMS; HYBRID ZERO DYNAMICS; WALKING; TAXONOMY; NOISE	In powered ankle-foot prostheses, multilevel hierarchical control systems are usually used with predetermined parameters (tuned during the prosthesis trial). Therefore, control systems cannot adaptively interact with terrains variation where control systems is most effective for ground level walking and less effective for ascending or descending stair/slop. In order to address the control system performance in ever-changing terrains, an adaptive mechanism should be included the control system structure. Here, we present a pilot study to illustrate the applicability of a genetic algorithm-based adaptive fuzzy logic control system. The design method could be divided into two stages: initial knowledge base and membership functions for the genetic pool on the basis of the analysis of biological ankle-foot behaviour. Additionally, the construction of genetic optimization mechanism rules and constraints (fitness function, mutation rats, replacement rate, etc.). Takagi-Sugeno-Kang fuzzy (TSK-fuzzy) inference system is selected because the system structure could depict the character of simple impedance control system. The control system and dynamic model were developed using C code and evaluated using MATLAB/Simulink (2019a).																	1562-2479	2199-3211				JUN	2020	22	4					1299	1313		10.1007/s40815-020-00855-4		APR 2020											
J								Simple, robust and secure data hiding based on CRT feature extraction and closed-loop chaotic encryption system	JOURNAL OF REAL-TIME IMAGE PROCESSING										Robust data hiding; Discrete Tchebichef transform (DTT); Chinese remainder theorem (CRT); Chaotic maps; Secure data hiding	TCHEBICHEF MOMENTS; IMAGE; DCT; SCHEME	Robust data hiding methods are basically used when rightful ownership is intended and/or transmitting channel is prone to noise. In this paper, a robust and secure data hiding method is proposed in Tchebichef domain. For feature extraction, remainders of Tchebichef coefficients are calculated according to Chinese remainder theorem (CRT). Distances of these remainders are utilized as the extracted features. These distances are then modified according to the hidden bits, to complete the embedding process. To reduce the chance of illegal access and increase the security of the proposed method, a closed-loop chaotic encryption system (CLCES) has been introduced. The proposed CLCES requires very little side information and produces extremely sensitive noise-like sequences with high security. Robustness and security of the proposed method have been analyzed. Comparison results with other related methods in the current literature confirm the superiority of the proposed method. Due to its simplicity, the proposed method is a good candidate for real-time data hiding applications.																	1861-8200	1861-8219															10.1007/s11554-020-00971-2		APR 2020											
J								A survey on context awareness in big data analytics for business applications	KNOWLEDGE AND INFORMATION SYSTEMS										Big data; Context awareness; Business applications; Enterprise level systems	SUPPLY CHAIN; SYSTEM; IMPACT; ERP	The concept of context awareness has been in existence since the 1990s. Though initially applied exclusively in computer science, over time it has increasingly been adopted by many different application domains such as business, health and military. Contexts change continuously because of objective reasons, such as economic situation, political matter and social issues. The adoption of big data analytics by businesses is facilitating such change at an even faster rate in much complicated ways. The potential benefits of embedding contextual information into an application are already evidenced by the improved outcomes of the existing context-aware methods in those applications. Since big data is growing very rapidly, context awareness in big data analytics has become more important and timely because of its proven efficiency in big data understanding and preparation, contributing to extracting the more and accurate value of big data. Many surveys have been published on context-based methods such as context modelling and reasoning, workflow adaptations, computational intelligence techniques and mobile ubiquitous systems. However, to our knowledge, no survey of context-aware methods on big data analytics for business applications supported by enterprise level software has been published to date. To bridge this research gap, in this paper first, we present a definition of context, its modelling and evaluation techniques, and highlight the importance of contextual information for big data analytics. Second, the works in three key business application areas that are context-aware and/or exploit big data analytics have been thoroughly reviewed. Finally, the paper concludes by highlighting a number of contemporary research challenges, including issues concerning modelling, managing and applying business contexts to big data analytics.																	0219-1377	0219-3116				SEP	2020	62	9					3387	3415		10.1007/s10115-020-01462-3		APR 2020											
J								Multi-view region-adaptive multi-temporal DMM and RGB action recognition	PATTERN ANALYSIS AND APPLICATIONS										Action recognition; DMM; 3D CNN; Region adaptive	ENSEMBLE	Human action recognition remains an important yet challenging task. This work proposes a novel action recognition system. It uses a novel multi-view region-adaptive multi-resolution-in-time depth motion map (MV-RAMDMM) formulation combined with appearance information. Multi-stream 3D convolutional neural networks (CNNs) are trained on the different views and time resolutions of the region-adaptive depth motion maps. Multiple views are synthesised to enhance the view invariance. The region-adaptive weights, based on localised motion, accentuate and differentiate parts of actions possessing faster motion. Dedicated 3D CNN streams for multi-time resolution appearance information are also included. These help to identify and differentiate between small object interactions. A pre-trained 3D-CNN is used here with fine-tuning for each stream along with multi-class support vector machines. Average score fusion is used on the output. The developed approach is capable of recognising both human action and human-object interaction. Three public-domain data-sets, namely MSR 3D Action, Northwestern UCLA multi-view actions and MSR 3D daily activity, are used to evaluate the proposed solution. The experimental results demonstrate the robustness of this approach compared with state-of-the-art algorithms.																	1433-7541	1433-755X				NOV	2020	23	4					1587	1602		10.1007/s10044-020-00886-5		APR 2020											
J								The fixed set search applied to the power dominating set problem	EXPERT SYSTEMS										combinatorial optimization; dominating set; fixed set search; GRASP; power dominating set		In this article, we focus on solving the power dominating set problem and its connected version. These problems are frequently used for finding optimal placements of phasor measurement units in power systems. We present an improved integer linear program (ILP) for both problems. In addition, a greedy constructive algorithm and a local search are developed. A greedy randomised adaptive search procedure (GRASP) algorithm is created to find near optimal solutions for large scale problem instances. The performance of the GRASP is further enhanced by extending it to the novel fixed set search (FSS) metaheuristic. Our computational results show that the proposed ILP has a significantly lower computational cost than existing ILPs for both versions of the problem. The proposed FSS algorithm manages to find all the optimal solutions that have been acquired using the ILP. In the last group of tests, it is shown that the FSS can significantly outperform the GRASP in both solution quality and computational cost.																	0266-4720	1468-0394														e12559	10.1111/exsy.12559		APR 2020											
J								Multi-scale crowd feature detection using vision sensing and statistical mechanics principles	MACHINE VISION AND APPLICATIONS										Crowd dynamics; Crowd behaviour detection; Multi-scale crowd features; Group detection and tracking; Video analysis; Statistical mechanics	COHERENT MOTIONS; BEHAVIORS; SCENES; MODEL; FLOW	Crowd behaviour analysis using vision has been subject to many different approaches. Multi-purpose crowd descriptors are one of the more recent approaches. These descriptors provide an opportunity to compare and categorize various types of crowds as well as classify their respective behaviours. Nevertheless, the automated calculation of descriptors which are expressed as measurements with accurate interpretation is a challenging problem. In this paper, analogies between human crowds and molecular thermodynamics systems are drawn for the measurement of crowd behaviour. Specifically, a novel descriptor is defined and measured for crowd behaviour at multiple scales. This descriptor uses the concept of Entropy for evaluating the state of crowd disorder. By results, the descriptor Entropy does indeed appear to capture the desired outcome for crowd entropy while utilizing easily detectable image features. Our new approach for machine understanding of crowd behaviour is promising, while it offers new complementary capabilities to the existing crowd descriptors, for example, as will be demonstrated, in the case of spectator crowds. The scope and performance of this descriptor are further discussed in detail in this paper.																	0932-8092	1432-1769				APR 21	2020	31	4							26	10.1007/s00138-020-01075-4													
J								Fuzzy model-based optimal energy control during the electrical discharge machining	NEURAL COMPUTING & APPLICATIONS										EDM; Discharge energy; Material removal rate; Optimal control; MIMO fuzzy system	MATERIAL REMOVAL RATE; SURFACE-ROUGHNESS; ELECTRODE WEAR; TAGUCHI METHOD; EDM PROCESS; OPTIMIZATION; PARAMETERS; LOGIC; EFFICIENCY; WEDM	This research aimed to describe a fuzzy optimal energy control strategy, so the electrical discharge machining (EDM) process can be optimized as a whole. The purpose is to develop a fuzzy logic-based multi-input-multi-output optimal control system to characterize the discharge energy efficiency of the EDM process. Methodology used in this paper is specific experimental design covering final and rough operations. Two controllable parameters were selected, and they were discharge current and pulse duration. The discharge energy and material removal rate were chosen as quality characteristics. The proposed approach uses the concept of fuzzy optimal control which is formulated on the basis of fuzzy logic technology with the use of knowledge-based system control. The finding that resulted in this research is that the effect of the discharge energy developed was observed on the performance of material removal rate. The material removal of the electrical discharge is directly proportional to the amount of the discharge energy applied during the on time of the pulse. The experimental results revealed that the effect of the EDM is increased as electrical discharge input parameters increase, but their interaction is limited and still somewhat unclear. The fuzzy optimal control model provides a highly advantageous option of the EDM input parameters, to achieve the best machining performance: the minimum discharge energy and the maximum material removal rate.																	0941-0643	1433-3058				NOV	2020	32	22			SI		17011	17026		10.1007/s00521-020-04909-4		APR 2020											
J								l(2,p)-norm sequential bilateral 2DPCA: a novel robust technology for underwater image classification and representation	NEURAL COMPUTING & APPLICATIONS										Underwater image analysis; l2; p-norm; Two-dimensional principal component analysis (2DPCA); Sequential bilateral	2-DIMENSIONAL PCA; FACE REPRESENTATION; PROJECTION; L1-NORM	Many recently proposed robust two-dimensional principal component analysis (2DPCA) approaches can suppress the sensitivity to outliers in images to some extent. However, most approaches can neither perfectly minimize the reconstruction error nor use fewer coefficients to conveniently represent image information. To alleviate these deficiencies, we developed a novel robust 2DPCA approach for underwater image analysis, called l(2,p)-sequential bilateral-2DPCA (l(2,p)-SB-2DPCA). The outstanding advantages of l(2,p)-SB-2DPCA are as follows. First, our model uses the l(2,p)-norm as the metric criterion of the objective function, which not only improves the robustness of the algorithm but also preserves the basic properties of 2DPCA. Second, we establish the relationship between the variance of the projection data and the corresponding input data in both the row and column directions, which makes the model achieve good recognition ability while using fewer coefficients and further improves the interpretability of the model. Finally, to obtain the optimal value of l(2,p)-SB-2DPCA, we present an iterative algorithm. The experimental results show that the proposed algorithm achieves the best performance on three underwater datasets and one extended face dataset compared with other robust 2DPCA approaches.																	0941-0643	1433-3058				NOV	2020	32	22			SI		17027	17041		10.1007/s00521-020-04936-1		APR 2020											
J								Deep Q-network-based multi-criteria decision-making framework for virtual simulation environment	NEURAL COMPUTING & APPLICATIONS										Deep learning; Big data; Motivation system; Behavior planning; Nature inspired algorithm		Deep learning improves the realistic expression of virtual simulations specifically to solve multi-criteria decision-making problems, which are generally rely on high-performance artificial intelligence. This study was inspired by the motivation theory and natural life observations. Recently, motivation-based control has been actively studied for realistic expression, but it presents various problems. For instance, it is hard to define the relation among multiple motivations and to select goals based on multiple motivations. Behaviors should generally be practiced to take into account motivations and goals. This paper proposes a deep Q-network (DQN)-based multi-criteria decision-making framework for virtual agents in real time to automatically select goals based on motivations in virtual simulation environments and to plan relevant behaviors to achieve those goals. All motivations are classified according to the five-level Maslow's hierarchy of needs, and the virtual agents train a double DQN by big social data, select optimal goals depending on motivations, and perform behaviors relying on a predefined hierarchical task networks (HTNs). Compared to the state-of-the-art method, the proposed framework is efficient and reduced the average loss from 0.1239 to 0.0491 and increased accuracy from 63.24 to 80.15%. For behavioral performance using predefined HTNs, the number of methods has increased from 35 in the Q network to 1511 in the proposed framework, and the computation time of 10,000 behavior plans reduced from 0.118 to 0.1079 s.																	0941-0643	1433-3058															10.1007/s00521-020-04918-3		APR 2020											
J								Development of optimal water supply plan using integrated fuzzy Delphi and fuzzy ELECTRE III methods-Case study of the Gamasiab basin	EXPERT SYSTEMS										basin; fuzzy Delphi; fuzzy ELECTRE III; group decision-making; optimal water supply; water resources	GROUP DECISION-MAKING; ANALYTIC HIERARCHY PROCESS; MULTICRITERIA APPROACH; CLIMATE-CHANGE; MANAGEMENT; AHP; SELECTION; CRITERIA; RANKING; SYSTEMS	This paper presents a novel method for the development of an optimal water supply plan showcased using data from the Gamasiab basin, located in Kermanshah province, Iran, concerning new dams that are being constructed in this semi-arid region. In this paper, a new group multi-criteria decision-making (MCDM) plan is proposed by combining two MCDM methods based on the fuzzy Delphi and fuzzy ELECTRE III methods that convert the experts' opinions to triangular fuzzy numbers based on the level of uncertainty associated with various quantitative and qualitative criteria. Considering the opinions of four non-stakeholder experts and data analysis using the fuzzy Delphi method, the criteria were evaluated. Then, by analysing the results using the fuzzy ELECTRE III method, the final ranking of scenarios is obtained. A sensitivity analysis was conducted to assess the effect of uncertainty on the performance of the decision-making system in scenarios ranking. The total expense, flood control, reservoir capacity and diversion and water transfer played a significant role in selecting the optimal scenario. Additionally, a hydrologic model was developed to evaluate the performance of the optimal scenario in terms of qualitative criteria. The data indicated that there was a good agreement between the results obtained from the hydrological model and the scenario ranking by the employed method. Altogether, a comparison of the proposed method with other MCDM methods, including fuzzy analytic hierarchy process and fuzzy technique for order preference by simulation of ideal solution, indicated that the results of the employed method matched more closely to the local experts' opinion.																	0266-4720	1468-0394				OCT	2020	37	5			SI				e12568	10.1111/exsy.12568		APR 2020											
J								Real time detection of acoustic anomalies in industrial processes using sequential autoencoders	EXPERT SYSTEMS										acoustic anomaly detection; audio feature extraction; convolutional autoencoder; convolutional long short-term memory autoencoder; industrial processes	NOVELTY DETECTION	Development of intelligent systems with the pursuit of detecting abnormal events in real world and in real time is challenging due to difficult environmental conditions, hardware limitations, and computational algorithmic restrictions. As a result, degradation of detection performance in dynamically changing environments is often encountered. However, in the next-generation factories, an anomaly detection system based on acoustic signals is especially required to quickly detect and interfere with the abnormal events during the industrial processes due to the increased cost of complex equipment and facilities. In this study we propose a real time Acoustic Anomaly Detection (AAD) system with the use of sequence-to-sequence Autoencoder (AE) models in the industrial environments. The proposed processing pipeline makes use of the audio features extracted from the streaming audio signal captured by a single-channel microphone. The reconstruction error generated by the AE model is calculated to measure the degree of abnormality of the sound event. The performance of Convolutional Long Short-Term Memory AE (Conv-LSTMAE) is evaluated and compared with sequential Convolutional AE (CAE) using sounds captured from various industrial manufacturing processes. In the experiments conducted with the real time AAD system, it is shown that the Conv-LSTMAE-based AAD demonstrates better detection performance than CAE model-based AAD under different signal-to-noise ratio conditions of sound events such as explosion, fire and glass breaking.																	0266-4720	1468-0394														e12564	10.1111/exsy.12564		APR 2020											
J								Uncertain location-allocation decisions for a bi-objective two-stage supply chain network design problem with environmental impacts	EXPERT SYSTEMS										environmental impact; fuzzy programming; multi-objective optimization; supply chain network design problem; uncertainty theory	TRANSPORTATION PROBLEM; PROGRAMMING-MODELS; SELECTION	In the cases that the historical data of an uncertain event is not available, belief degree-based uncertainty theory is a useful tool to reflect such uncertainty. This study focuses on uncertain bi-objective supply chain network design problem with cost and environmental impacts under uncertainty. As such network may be designed for the first time in a geographical region, this problem is modelled by the concepts of belief degree-based uncertainty theory. This article is almost the first study on belief degree-based uncertain supply chain network design problem with environmental impacts. Two approaches such as expected value model and chance-constrained model are applied to convert the proposed uncertain problem to its crisp form. The obtained crisp forms are solved by some multi-objective optimization approaches of the literature such as TH, Niroomand, MMNV. A deep computational study with several test problems are performed to study the performance of the crisp models and the solution approaches. According to the results, the obtained crisp formulations are highly sensitive to the changes in the value of the cost parameters. On the other hand, Niroomand and MMNV solution approaches perform better than other solution approaches from the solution quality point of view.																	0266-4720	1468-0394				OCT	2020	37	5			SI				e12558	10.1111/exsy.12558		APR 2020											
J								Modular neural networks for quality of transmission prediction in low-margin optical networks	JOURNAL OF INTELLIGENT MANUFACTURING										Low margin optical networks; Modular neural networks; Optical power management; Quality of transmission	AUTOMATIC MICROSTRUCTURAL CHARACTERIZATION; MODEL; IDENTIFICATION; DESIGN; OUTPUT	It is estimated that the emergence of digital businesses, and growing dynamic traffic demands for Internet applications, including cloud computing and the Internet of Things, will impact the traffic at unprecedented rates. Thus, to cost-efficiently accommodate these challenging requirements, network operators are motivated to maximize the achieved capacity over deployed links, and design more efficient networks capable of handling a wide range of applications, as well as operate more closely to optimality. On the other hand, as the network elements age, nonlinear impairments increases (which can be translated to increasing the network load) and hence, the system margin and maximum achievable rate decrease. Therefore, in order to increase the capacity of optical networks and extend their life time, an accurate physical model is required to estimate the quality of signal and quantify the margin of lightpaths. In this regard, a machine learning (ML) method is proposed based on the modular neural networks to account the cross channel nonlinear effects in estimating noise power and OSNR of lightpaths. For this, the dependence of the contributed nonlinear component of noise power on the transmitted powers as well as the modulation formats of all channels are considered in this data-model. Indeed, this ML-based model provides a useful tool for per-lightpath power management, as a fundamental element for reducing margins. Results of evaluating various proposed modular models show that, in general, all modular models are able to estimate OSNR of lightpaths, with average accuracy of more than 96.6%. However, the proposed MM4 modular model is the model presenting better generalization, being able to correctly estimate OSNR of lightpaths, with average accuracy of 99.2%. Also, MM3 model performs better for partially loaded network scenarios (99.3%).																	0956-5515	1572-8145															10.1007/s10845-020-01576-z		APR 2020											
J								On the Logical Philosophy of Assertive Graphs	JOURNAL OF LOGIC LANGUAGE AND INFORMATION										Assertion; Assertive graphs; Existential graphs; Peirce; Classical vs; non-classical logical graphs; Deep inference; Inferentialism		The logic of assertive graphs (AGs) is a modification of Peirce's logic of existential graphs (EGs), which is intuitionistic and which takes assertions as its explicit object of study. In this paper we extend AGs into a classical graphical logic of assertions (ClAG) whose internal logic is classical. The characteristic feature is that both AGs and ClAG retain deep-inference rules of transformation. Unlike classical EGs, both AGs and ClAG can do so without explicitly introducing polarities of areas in their language. We then compare advantages of these two graphical approaches to the logic of assertions with a reference to a number of topics in philosophy of logic and to their deep-inferential nature of proofs.																	0925-8531	1572-9583				DEC	2020	29	4					375	397		10.1007/s10849-020-09315-6		APR 2020											
J								European option pricing under multifactor uncertain volatility model	SOFT COMPUTING										Uncertainty theory; Liu process; Multifactor model; European option	STOCK MODEL; STOCHASTIC VOLATILITY	This paper presents an uncertain stock model under the multifactor uncertain volatility framework. Based on the uncertainty theory, some closed-form and analytical formulas presented to value a European call and put option under the multifactor uncertain volatility model. Numerical tests are reported to highlight how the proposed model provides interesting results on pricing a European option. Finally, we summarize the theoretical results and some numerical experiments.																	1432-7643	1433-7479				JUN	2020	24	12			SI		8781	8792		10.1007/s00500-020-04919-3		APR 2020											
