PT	AU	BA	BE	GP	AF	BF	CA	TI	SO	SE	BS	LA	DT	CT	CY	CL	SP	HO	DE	ID	AB	C1	RP	EM	RI	OI	FU	FX	CR	NR	TC	Z9	U1	U2	PU	PI	PA	SN	EI	BN	J9	JI	PD	PY	VL	IS	PN	SU	SI	MA	BP	EP	AR	DI	D2	EA	PG	WC	SC	GA	UT	PM	OA	HC	HP	DA
J								Projection multi-birth support vector machinea for multi-classification	APPLIED INTELLIGENCE										Multi-classification; Multi-birth support vector machine; Projection multi-birth support vector machine	IMPROVEMENTS	As an important multi-classification learning tool, multi-birth support vector machine (MBSVM) has been widely studied and applied due to its low computational complexity and good generalization. In this paper, a new multi-birth support vector machine is proposed to handle multi-class classification problem, called projection multi-birth support vector machine (PMBSVM). Specifically, we intend to seek a projection direction w(k) for k-th class, so that the covariance of remaining samples (except the k-th class) is as small as possible, and the samples of k-th class are as far as possible from the mean of the remaining samples. The proposed PMBSVM not only inherits the advantages of MBSVM, but also can find a suitable projection direction for each class so that the sample is separable in the projection space. Additionally, a regularization term is introduced to maximize the margin of different classes in the projected space. Moreover, a recursive PMBSVM algorithm is proposed for generating multiple orthogonal projection directions for each class. Then we extend the proposed approaches to nonlinear situations through kernel technology. Simulation results on benchmark datasets show that the proposed algorithms improve the generalization in most cases.																	0924-669X	1573-7497				OCT	2020	50	10					3040	3056		10.1007/s10489-020-01699-z		APR 2020											
J								Deep spatial-temporal networks for crowd flows prediction by dilated convolutions and region-shifting attention mechanism	APPLIED INTELLIGENCE										Dilated convolution; Region-level attention mechanism; Crowd flows prediction; Spatial-temporal network	NEURAL-NETWORK	Flow prediction at a citywide level is of great significance to traffic management and public safety. Since deep learning has achieved success to deal with complex nonlinear problems, it has drawn increasing attention on making crowd flows prediction through neural networks. Generally, convolutional neural network (CNN) and recurrent neural network (RNN) have been applied to model the spatial-temporal dependency of the city. However, there are still two major challenges in predicting flows. First, it is difficult to train the model with the ability to capture both the nearby and distant spatial dependency by deep local convolutions. Second, daily and weekly patterns in temporal dependency are not strictly periodic for their dynamic temporal shifting in each region. To address these issues, we propose a novel deep learning model which called Local-Dilated Region-Shifting Network (LDRSN). LDRSN combines local convolutions with dilated convolutions to learn the nearby and distant spatial dependency. Furthermore, a new region-level attention mechanism is proposed to model the temporal shifting which varies by region. In the experiments, we compare the proposed method with other state-of-the-art methods in two real-world crowd flows datasets. The Mean Absolute Error (MAE), Mean Absolute Percentage Error (MAPE), Root Mean Square Error (RMSE) were used as the evaluation indexes. The experiment results show the effectiveness of the proposed model.																	0924-669X	1573-7497				OCT	2020	50	10					3057	3070		10.1007/s10489-020-01698-0		APR 2020											
J								Sentiment classification with adversarial learning and attention mechanism	COMPUTATIONAL INTELLIGENCE										adversarial learning; attention mechanism; LSTM network; PU learning problem; sentiment classification		Sentiment classification is a key task in sentiment analysis, reviews mining, and other text mining applications. Various models have been proposed to build sentiment classifiers, but the classification performances of some existing methods are not good enough. Meanwhile, as a subproblem of sentiment classification, positive and unlabeled learning (PU learning) problem widely exists in real-world cases, but it has not been given enough attention. In this article, we aim to solve the two problems in one framework. We first build a model for traditional sentiment classification based on adversarial learning, attention mechanism, and long short-term memory (LSTM) network. We further propose an enhanced adversarial learning method to tackle PU learning problem. We conducted extensive experiments in three real-world datasets. The experimental results demonstrate that our models outperform the compared methods in both traditional sentiment classification problem and PU learning problem. Furthermore, we study the effect of our models on word embedding. Finally, we report and discuss the sensitivity of our models to parameters.																	0824-7935	1467-8640															10.1111/coin.12329		APR 2020											
J								Ontology-based prediction of cochlear implantation outcome using cross-modal plasticity analysis	JOURNAL OF AMBIENT INTELLIGENCE AND HUMANIZED COMPUTING										Cochlear implant; EEG signal; VEP signal; Fuzzy interface system; Ontology; Fuzzy ontology	VISUAL-EVOKED POTENTIALS; AUDITORY-CORTEX; DEAF; REORGANIZATION; DEPRIVATION; INTEGRATION; CORTICES	Cochlear implantation is a surgical procedure by which an electronic medical device, namely a cochlear implant, is fitted to the individual who has the challenge of hearing. It takes the function of the damaged inner ear, the cochlea. The hearing impaired may not benefit from this procedure because of cross-modal plasticity. This work aims to study the implantee's visual modal adaptation by analyzing the visual evoked potential. The proposed methodology analyses the existence of cross-modal reorganization in the auditory cortex of bilateral prelingually deaf children after cochlear implantation using visual evoked potential. Fifty healthy, 50 prelingually, deaf children 50 cochlear implanted were considered as a cohort of the Visual evoked potential. The evoked potential recorded using pattern reversal stimulation. The amplitude and latency of N75, P100, and N145 components show a significant difference in normal, cochlear, and deaf. The early diagnosis of hearing impairment demands the patients and doctors to make a series of decisions for the betterment of the implantee in an accelerated manner through traditional database methodology implemented for making decisions, analyzing, interpreting, processing of data is so difficult in the conventional system. Medical knowledge represented for the computers to analyze the inferred data and to make the decisions. Ontology is the most potent tool to encode medical data semantically. A fuzzy ontology-based decision support system built to predict the cochlear implantation outcome. The ontology created using Protege software tool and the decision taken using Jena and pellet reasoner. A fuzzy-based prediction model designed using a fuzzy interface system to estimate the categories of auditory performance (CAP) test reliable indicators of cochlear implantation success.																	1868-5137	1868-5145															10.1007/s12652-020-02011-0		APR 2020											
J								Statistical-model based voice activity identification for human-elephant conflict mitigation	JOURNAL OF AMBIENT INTELLIGENCE AND HUMANIZED COMPUTING										Human-elephant; Feature extraction; Classification; SVM; PCA; Performance metrics		Human-Elephant conflict has become very common in the forest borders causing phenomenal increase in death of elephants as well as loss of human life. Elephants face a shortage of resources such as food and water, resulting in Human-Elephant Conflict. The presence of elephants can be predicted using elephant voice detection. We propose a machine learning based system for detecting elephant voice and predicting the presence of elephants in the forest border areas. Existing methods for elephant voice detection in literature require large feature data dimensions. In the proposed system, feature extraction methods combined with Principal Component Analysis (PCA) that greatly reduces feature data dimension is proposed to improve the performance metrics of the recorded elephant voice samples. A Support vector machine (SVM) classifier is used for the predictive model in this work. The proposed system is validated using the cross validation method and the performance metrics such as Accuracy, Sensitivity, Specificity, Precision, F1 Score and Computation time are evaluated. It is observed that with the proposed approach the average accuracy is 93.32% and feature data dimension is 1422 compared to an average accuracy of 83.5% obtained and feature data dimension of 18,882 with methods using Mel-Frequency Cepstral Co-efficient (MFCC)																	1868-5137	1868-5145															10.1007/s12652-020-02005-y		APR 2020											
J								Fuzzy fractional coloring of fuzzy graph with its application	JOURNAL OF AMBIENT INTELLIGENCE AND HUMANIZED COMPUTING										Fuzzy graph; Strongly adjacent vertices; Product of fuzzy graph; Fuzzy fractional coloring; Fuzzy fractional clique	COMPLEMENT	In this article, a new idea of fuzzy fractional coloring of fuzzy graph is presented and fuzzy fractional chromatic number is defined. A relationship between fuzzy fractional chromatic number and fuzzy fractional clique number is established. Some properties of fuzzy chromatic number of fuzzy graphs and fuzzy fractional chromatic number of fuzzy graphs are proved and the concept of k-strong adjacent vertices is introduced. Fuzzy chromatic number and fuzzy fractional chromatic number have been calculated on lexicographic product of two fuzzy graphs. Also, fuzzy chromatic number, independence number and fuzzy fractional chromatic number have been investigated on disjoint union of two fuzzy graphs. Lastly, a real life application of fuzzy fractional coloring on fuzzy graph is discussed.																	1868-5137	1868-5145															10.1007/s12652-020-01953-9		APR 2020											
J								Secured segmentation for ICD datasets	JOURNAL OF AMBIENT INTELLIGENCE AND HUMANIZED COMPUTING										Privacy; Accuracy; Dataset; Algorithm		Data publishing can infringe individual privacy. When there is a necessity to extract knowledge from data mining results, there should be a discipline followed by not disclosing individual information. There is an opportunity for the user to interpret specific individual information from data mining results and further misuse the interpreted results, resulting in infringement of privacy. Privacy preserving data publishing research attempts to guarantee accurate results yet preserves privacy of individual information. The proposed Secured Segmentation technique guarantees better accuracy (41.5) and privacy when dealing with record linkage and attribute linkage attacks. Secured Segmentation technique demonstrates K-anonymity to retain privacy when dealing with record linkage attacks. It also demonstrates L-diversity and t-closeness to retain privacy when dealing with attribute linkage attacks.																	1868-5137	1868-5145															10.1007/s12652-020-02009-8		APR 2020											
J								A cooperative coevolutionary method for optimizing random weight networks and its application for medical classification problems	JOURNAL OF AMBIENT INTELLIGENCE AND HUMANIZED COMPUTING										RWN; Random weight network; Particle swarm optimization; PSO; Optimisation; Feature selection; Medical classification	EXTREME LEARNING-MACHINE; PARTICLE SWARM OPTIMIZATION; FEATURE-SELECTION; NEURAL-NETWORKS; ENSEMBLE; MODELS; SCHEME; PSO; ELM	Learning algorithms are mainly used to optimize a performance criterion. Random weight network (RWN) is one of learning algorithms with strong performance that used in wide range of applications. However, the performance of RWN is highly affected by the number of data inputs that is why finding the best input features becomes a necessity when dealing with high dimensional data. In literature, many methods have attempted to determine the optimal subset of features and structure of the RWN separately. In this paper, we propose a cooperative coevolution method based on Particle Swarm Optimisation. The goal of the proposed method is to optimise the structure of the RWN network and simultaneously to find the best subset of features. Three experiments are conducted on thirty medical classification datasets to assess the accuracy of the proposed method. The experimental results showed that reducing the number of features and minimising the complexity of RWN networks causes the high performance of the proposed method which exceeded all other methods in terms of accuracy on most datasets.																	1868-5137	1868-5145															10.1007/s12652-020-01975-3		APR 2020											
J								On evolutionary computation techniques for multi-view triangulation	MACHINE VISION AND APPLICATIONS										Triangulation; Parameter tuning; Evolutionary computation; 3D reconstruction	OPTIMIZATION	Multi-view triangulation is an essential step in recovering three-dimensional structure from a set of images. It is a well-studied problem in computer vision with many suboptimal and optimal methods based on different optimality criteria. In this paper, we assess the ability of evolutionary computation (EC) methods in finding highly accurate solutions to this problem. We use an overlaying Luus-Jaakola optimizer to find good parameter configurations and determine appropriate computational budget for the EC methods. Empirical results on synthetic and real data demonstrate the superior performance of EC methods over existing triangulation methods.																	0932-8092	1432-1769				APR 29	2020	31	4							29	10.1007/s00138-020-01077-2													
J								GAN-Poser: an improvised bidirectional GAN model for human motion prediction	NEURAL COMPUTING & APPLICATIONS										Human motion; GAN; Probability theory; Pose estimation; Sequence model; 3D model	NEURAL-NETWORKS; 3D	A novel method called GAN-Poser has been explored to predict human motion in less time given an input 3D human skeleton sequence based on a generator-discriminator framework. Specifically, rather than using the conventional Euclidean loss, a frame-wise geodesic loss is used for geometrically meaningful and more precise distance measurement. In this paper, we have used a bidirectional GAN framework along with a recursive prediction strategy to avoid mode-collapse and to further regularize the training. To be able to generate multiple probable human-pose sequences conditioned on a given starting sequence, a random extrinsic factor Theta has also been introduced. The discriminator is trained in order to regress the extrinsic factor Theta, which is used alongside with the intrinsic factor (encoded starting pose sequence) to generate a particular pose sequence. In spite of being in a probabilistic framework, the modified discriminator architecture allows predictions of an intermediate part of pose sequence to be used as conditioning for prediction of the latter part of the sequence. This adversarial learning-based model takes into consideration of the stochasticity, and the bidirectional setup provides a new direction to evaluate the prediction quality against a given test sequence. Our resulting novel method, GAN-Poser, achieves superior performance over the state-of-the-art deep learning approaches when evaluated on the standard NTU-RGB-D and Human3.6 M dataset.																	0941-0643	1433-3058				SEP	2020	32	18			SI		14579	14591		10.1007/s00521-020-04941-4		APR 2020											
J								Short-term traffic flow prediction based on improved wavelet neural network	NEURAL COMPUTING & APPLICATIONS										Short-term traffic flow forecasting; Wavelet neural network; Particle swarm algorithm; Improved particle swarm optimization		Due to the characteristics of time-varying traffic and nonlinearity, the short-term traffic flow data are difficult to predict accurately. The purpose of this paper is to improve the short-term traffic flow prediction accuracy through the proposed improved wavelet neural network prediction model and provide basic data and decision support for the intelligent traffic management system. In view of the extremely strong nonlinear processing power, self-organization, self-adaptation and learning ability of wavelet neural network (WNN), this paper uses it as the basic prediction model and uses the particle swarm optimization algorithm for the slow convergence rate and local optimal problem of WNN prediction algorithm. With the advantages of fast convergence, high robustness and strong global search ability, an improved particle swarm optimization algorithm is proposed to optimize the wavelet neural network prediction model. The improved wavelet neural network is used to predict short-term traffic flow. The experimental results show that the proposed algorithm is more efficient than the WNN and PSO-WNN algorithms alone. The prediction results are more stable and more accurate. Compared with the traditional wavelet neural network, the error is reduced by 14.994%.																	0941-0643	1433-3058															10.1007/s00521-020-04932-5		APR 2020											
J								Diagnosis method of ultrasonic elasticity image of peripheral lung cancer based on genetic algorithm	NEURAL COMPUTING & APPLICATIONS										Genetic algorithm; Lung cancer; Ultrasound image; Clinical diagnosis	ENDOBRONCHIAL ULTRASOUND; ELASTOGRAPHY; CONCRETE	The current clinical diagnosis of peripheral lung cancer is affected by many factors, which leads to certain uncertainty in the diagnosis results. In order to improve the clinical diagnosis of peripheral lung cancer, based on genetic algorithm, this study constructs a proprietary model for lung cancer detection and diagnosis, designs corresponding training methods and image processing methods in the model, and outputs clinically identifiable diagnostic images for clinical analysis. In order to study the role of genetic algorithm in clinical diagnosis, a comparative trial was designed to compare the clinical diagnosis results with the HRCT method. The experimental results show that the genetic algorithm based on cross-validation optimization has good clinical results in the diagnosis and analysis of peripheral lung cancer and can provide theoretical reference for subsequent related research.																	0941-0643	1433-3058															10.1007/s00521-020-04957-w		APR 2020											
J								Camera calibration by using weighted differential evolution algorithm: a comparative study with ABC, PSO, COBIDE, DE, CS, GWO, TLBO, MVMO, FOA, LSHADE, ZHANG and BOUGUET	NEURAL COMPUTING & APPLICATIONS										Camera calibration; Weighted differential evolution; 3D point cloud; SfM photogrammetry	SELF-CALIBRATION; OPTIMIZATION ALGORITHM; RECONSTRUCTION	Camera calibration is an avoidable process for computationalvision applications, such as 3D reverse engineering, industrial robot calibration, optic-pattern recognition, simultaneous localization and mapping, autonomous visual-driving and photogrammetric vision. The camera calibration problem is too complex, nonlinear and multimodal. Traditional camera calibration methods using gradient-based optimization often trap to one of the many local solutions available. Accurate computation ability of traditional camera calibration methods is limited since they use gradient-based optimization methods. Since evolutionary computing algorithms can avoid local solutions of numerical problems, they have the potential to accurately compute the required camera calibration parameters for high-precision computationalvision applications. In this paper, the camera calibration parameters are computed by using 11 evolutionary computing algorithms, i.e., WDE, ABC, PSO, COBIDE, DE, CS, GWO, TLBO, MVMO, FOA and LSHADE. In order to make unbiased evaluation of the camera calibration results provided by the related evolutionary computing algorithms, two gradient-based traditional camera calibration methods, i.e., Zhang and Bouguet, have been used in the conducted experiments in this paper. The camera calibration results of the related methods were used to model a 3D physical test scene by using Structure from Motion photogrammetry method. The reference data set of the related 3D physical scene has been captured by using a 3D terrestrial laser scanner. Statistical comparison of the camera calibration results exposed that WDE supplies statistically better results than other comparison algorithms.																	0941-0643	1433-3058															10.1007/s00521-020-04944-1		APR 2020											
J								Autonomic cloud resource provisioning and scheduling using meta-heuristic algorithm	NEURAL COMPUTING & APPLICATIONS										Energy consumption; Resource provisioning; Resource scheduling; Meta-heuristic; Binary PSO	LOAD BALANCING ALGORITHM; GENETIC ALGORITHM; OPTIMIZATION; ENVIRONMENT; STRATEGY; TASKS	We investigate that resource provisioning and scheduling is a prominent problem due to heterogeneity as well as dispersion of cloud resources. Cloud service providers are building more and more datacenters due to demand of high computational power which is a serious threat to environment in terms of energy requirement. To overcome these issues, we need an efficient meta-heuristic technique that allocates applications among the virtual machines fairly and optimizes the quality of services (QoS) parameters to meet the end user objectives. Binary particle swarm optimization (BPSO) is used to solve real-world discrete optimization problems but simple BPSO does not provide optimal solution due to improper behavior of transfer function. To overcome this problem, we have modified transfer function of binary PSO that provides exploration and exploitation capability in better way and optimize various QoS parameters such as makespan time, energy consumption, and execution cost. The computational results demonstrate that modified transfer function-based BPSO algorithm is more efficient and outperform in comparison with other baseline algorithm over various synthetic datasets.																	0941-0643	1433-3058															10.1007/s00521-020-04955-y		APR 2020											
J								Prediction and analysis of PM2.5 in Fuling District of Chongqing by artificial neural network	NEURAL COMPUTING & APPLICATIONS										PM2; 5; Prediction; BP neural network		The meteorological data, measurements of aerosol optical depth (AOD) and PM2.5 concentration from 2016 to 2017 in Fuling District of Chongqing were selected to study their correlation. The back propagation (BP) artificial neural network (ANN) was used to build a PM2.5 prediction model with the meteorological factors as input, and the predicted PM2.5 values were compared with the measured ones. The results show that PM2.5 concentration has a piecewise linear relationship with temperature attributed to diffusion rate and premise conversion rate, a positive correlation with relative humidity, and a significant inverse correlation with wind speed, but no apparent linear relationship with rainfall, although rainfall has a significant purification effect on PM2.5. The similarity in the influence mechanism of AOD and PM2.5 concentration leads to a certain positive correlation between them. The predicted PM2.5 by the BP ANN model shows a similar trend with the measured one, but has some significant differences in numerical values. Therefore, it is feasible to establish BP artificial neural network to predict PM2.5 by using meteorological data.																	0941-0643	1433-3058															10.1007/s00521-020-04962-z		APR 2020											
J								CT image classification based on convolutional neural network	NEURAL COMPUTING & APPLICATIONS										Convolution neural network; Convolution layer; CT image classification; CDBN model	SEGMENTATION	With the rapid development of the Internet, image information is explosively growing. Traditional image classification methods are difficult to deal with huge image data and cannot meet people's requirements on the accuracy and speed of image classification. In recent years, the convolutional neural network (CNN) has been developing rapidly, and it has performed extremely well. The image classification method based on CNN breaks through the bottleneck of traditional image classification methods and becomes the mainstream image classification algorithm at present. CT image classification algorithm is one of the research hot spots in the field of medical image. The purpose of this paper is to apply convolutional neural network to CT image classification, so as to speed up CT image classification and improve the accuracy of CT image classification and so as to reduce the workload of doctors and improve work efficiency. In this paper, CT images are classified by CDBN model. Vector machine SVM is used as the feature classifier of CDBN model to enhance feature transfer and reuse so as to enrich the features. It also suppresses features that are not very useful for current tasks and improves the performance of the model. Using CDBN to classify CT images, several commonly used gray images are compared. Comparing the results of the ordinary gradient algorithm with Adam algorithm, we can get the CDBN model using Adam optimization algorithm. In CT image classification, both accuracy and speed have a good effect. The experimental results show that the training speed of CDBN model of Adam optimization algorithm in CT image classification is 3% faster than that of general gradient algorithm.																	0941-0643	1433-3058															10.1007/s00521-020-04933-4		APR 2020											
