PT	AU	BA	BE	GP	AF	BF	CA	TI	SO	SE	BS	LA	DT	CT	CY	CL	SP	HO	DE	ID	AB	C1	RP	EM	RI	OI	FU	FX	CR	NR	TC	Z9	U1	U2	PU	PI	PA	SN	EI	BN	J9	JI	PD	PY	VL	IS	PN	SU	SI	MA	BP	EP	AR	DI	D2	EA	PG	WC	SC	GA	UT	PM	OA	HC	HP	DA
J								Model-based Control with Interaction Predicting for Human-coupled Lower Exoskeleton Systems	JOURNAL OF INTELLIGENT & ROBOTIC SYSTEMS										Model-based control with interaction predicting; Sensitivity amplification control; Inaccurate dynamic model; Physical human-robot interaction; Strength augmentation; Lower exoskeleton	EXTREMITY; IDENTIFICATION	Sensitivity Amplification Control (SAC) algorithm was first proposed in the augmentation application of the Berkeley Lower Extremity Exoskeleton (BLEEX). Since the SAC algorithm can greatly reduce the complexity of exoskeleton system, it is widely used in human augmentation applications. Nevertheless, the performance of the SAC algorithm depends on the accuracy of dynamic model parameters. In this paper, we propose a novel Model-based control with Interaction Predicting (MIP) strategy to lower dependency on the accurate dynamic model of the exoskeleton. The MIP consists of an interaction predictor and a model-based controller. The interaction predictor can predict motion trajectories of the pilot and substitute for the pilot to drive the exoskeleton through an impedance model. In proposed strategy, the model-based controller not only amplify the forces initiated by the interaction predictor, but more importantly the forces imposed by the pilot to correct the errors between the predictive motion trajectory and the intended motion trajectory of the pilot. Illustrative simulations and experimental results are presented to demonstrate the efficiency of the proposed strategy. Additionally, the comparisons with traditional model-based control algorithm are also presented to demonstrate the efficiency and superiority of the proposed control strategy for lowering dependency on dynamic models.																	0921-0296	1573-0409				NOV	2020	100	2					389	400		10.1007/s10846-020-01200-5		APR 2020											
J								Dynamic Path Planning of the UAV Avoiding Static and Moving Obstacles	JOURNAL OF INTELLIGENT & ROBOTIC SYSTEMS										Dynamic path planning; Local path planning; Obstacle avoidance; Cubic spline; Cost function	WINDOW APPROACH; OPTIMIZATION; SIMULATION	This paper introduces a dynamic path planning method for the UAV that can avoid both static and moving obstacles. The condition with sudden threats can better reflect the real situation of the UAV in the real environment. First of all, the A* algorithm is adopted to generate an optimal path in a known environment in this method. Then, in the situation of static sudden threats, a series of candidate paths are generated by the principle of cubic spline second-order continuity. In order to make the static sudden threat at the center of a cluster of candidate paths, they need to be adjusted. After that, this path cluster completely surrounds the sudden threat and has symmetry about the sudden threat. When encountering a sudden threat of movement, factors such as the speed, acceleration and certain parameters of the movement obstacle or the UAV are considered, and a correlation model of the dynamic sudden threat is established. Finally, the total cost function is established to select the optimal obstacle avoidance path, and the total cost function contains four sub-cost functions, they are static security cost function, smoothness cost function, consistency cost function and dynamic security cost function. The simulation results demonstrate the effectiveness of the proposed method.																	0921-0296	1573-0409				SEP	2020	99	3-4			SI		909	931		10.1007/s10846-020-01151-x		APR 2020											
J								Tell me something my friends do not know: diversity maximization in social networks	KNOWLEDGE AND INFORMATION SYSTEMS										Diversity maximization; Filter bubble; Quadratic knapsack; Combinatorial optimization; Greedy algorithms		Social media have a great potential to improve information dissemination in our society, yet they have been held accountable for a number of undesirable effects, such as polarization and filter bubbles. It is thus important to understand these negative phenomena and develop methods to combat them. In this paper, we propose a novel approach to address the problem of breaking filter bubbles in social media. We do so by aiming to maximize the diversity of the information exposed to connected social-media users. We formulate the problem of maximizing the diversity of exposure as a quadratic-knapsack problem. We show that the proposed diversity-maximization problem is inapproximable, and thus, we resort to polynomial nonapproximable algorithms, inspired by solutions developed for the quadratic-knapsack problem, as well as scalable greedy heuristics. We complement our algorithms with instance-specific upper bounds, which are used to provide empirical approximation guarantees for the given problem instances. Our experimental evaluation shows that a proposed greedy algorithm followed by randomized local search is the algorithm of choice given its quality-vs.-efficiency trade-off.																	0219-1377	0219-3116				SEP	2020	62	9					3697	3726		10.1007/s10115-020-01456-1		APR 2020											
J								Single-image super-resolution with multilevel residual attention network	NEURAL COMPUTING & APPLICATIONS										Image super-resolution; Deep convolutional neural network; Attention mechanism; Residual learning	NEURAL-NETWORK	Recently, a great variety of image super-resolution (SR) algorithms based on convolutional neural network (CNN) have been proposed and achieved significant improvement. But how to restore more high-frequency details such as edges and textures is still an unsolved issue. The low-frequency information is similar in a pair of low-resolution and high-resolution images. So the SR model is supposed to pay more attention to the high-frequency features to restore more realistic images. But most CNN-based methods don't consider the different types of features and think the features in different channels and regions contribute equally to the reconstruction performance, which limits the representation capacity of the model. In the meantime, most of these deep networks only simply stack blocks like residual block, which only capture the local features. In this paper, we propose a deep multilevel residual attention network (MRAN) for image SR to focus on the high-frequency features and improve the flow of information. Specially, we propose a channel-wise attention module and a spatial attention module to rescale the channel-wise and spatial weights adaptively, which makes our MRAN focus more on the high-frequency information. Meanwhile, to improve the flow of information and ease the training process, the multilevel residual learning is adopted. Extensive experimental results on five benchmark datasets demonstrate that our MRAN is superior to those state-of-the-art methods for both accuracy and visual comparisons.																	0941-0643	1433-3058				OCT	2020	32	19			SI		15615	15628		10.1007/s00521-020-04896-6		APR 2020											
J								Two hybrid metaheuristic approaches for the covering salesman problem	NEURAL COMPUTING & APPLICATIONS										Covering salesman problem; Traveling salesman problem; Heuristic; Genetic algorithm; Artificial bee colony algorithm	BEE COLONY ALGORITHM; TOUR; OPTIMIZATION	This paper addresses the covering salesman problem (CSP), which is an extension of the classical traveling salesman problem (TSP). Given a set of cities and a coverage radius associated with each one of them, the CSP seeks a Hamiltonian cycle over a subset of cities such that each city not in the subset is within the coverage radius of at least one city in the subset and that has minimum length among all Hamiltonian cycles over such subsets. To solve this problem, one has to deal with the aspects of subset selection and permutation. The CSP finds application in emergency and disaster management and rural healthcare. This paper presents two hybrid metaheuristic approaches for the CSP. The first approach is based on the artificial bee colony algorithm, whereas the latter approach is based on the genetic algorithm. Both the approaches make use of several new first improvement or best improvement based local search strategies defined over various neighborhood structures. Computational results on a wide range of benchmark instances demonstrate the effectiveness of the proposed approaches. We are able to improve the best known solution values on majority of the large instances.																	0941-0643	1433-3058				OCT	2020	32	19			SI		15643	15663		10.1007/s00521-020-04898-4		APR 2020											
J								The design of multiple feedback topology Chebyshev low-pass active filter with average differential evolution algorithm	NEURAL COMPUTING & APPLICATIONS										Tenth-order active filter design; Multiple feedback topology; Chebyshev low-pass active filter; Average differential evolution algorithm; Metaheuristics	COMPONENT VALUE SELECTION; BAND; OPTIMIZATION	This study presents the design of a tenth-order multiple feedback Chebyshev low-pass filter (MF-C-LPF). Component selection and gain calculation of filters are generally achieved over long periods of time using traditional methods. For 1-dB and 3-dB gains, the component values of the filter were optimized for both continuous and discrete values using four different metaheuristic algorithms. In the first case where continuous values were used, component values were accepted as ideal and unlimited in order to minimize gains. In the second case, industrial E196 series component values were used to transform the design problem into a discrete optimization problem. In this case where the design problem became more complex, the performance of the metaheuristic algorithms was compared. The literature review shows that this study is the first attempt to design a 10th-order MF-C-LPF for E196 series values. The average differential evolution algorithm is proposed to determine the optimal component values of the tenth-order MF-C-LPF. The performance of the proposed method was compared with three commonly used algorithms (PSO, CSS and DE). The optimal filter component values and quality factors (Q) were presented for each stage. We believe that the quality factor values will be a reference for future studies.																	0941-0643	1433-3058				NOV	2020	32	22			SI		17097	17113		10.1007/s00521-020-04922-7		APR 2020											
J								Electronic word-of-mouth effects on studio performance leveraging attention-based model	NEURAL COMPUTING & APPLICATIONS										Electronic word-of-mouth; Audience review; Stock market; Deep learning; Attention mechanism	MEDIA; SENTIMENT; REVIEWS; HELPFULNESS; DYNAMICS; MARKETS; MOVIES; EWOM	While existing studies have established the relationship between electronic word-of-mouth (eWOM) and studio performance, limited research has been conducted to demonstrate how the attention-based model applies to the motion picture industry. In this study, examining a review corpus of seven Hollywood studios, we proved that deep learning with the attention mechanism has the best accuracy in both eWOM and stock price movement. We present both a hierarchical two-layer attention network and hierarchical convoluted attention network (HCAN), which quantify the importance of crucial eWOM features in capturing valuable information from audience members' reviews. Further, comparing the two case studies, we determined that the HCAN model is superior to both machine learning and attention-based models. Our work helps to highlight the business value of the attention-based model and has implications for studio business decisions.																	0941-0643	1433-3058															10.1007/s00521-020-04937-0		APR 2020											
J								Deep Learning Neural Network for Unconventional Images Classification	NEURAL PROCESSING LETTERS										Content filtering; Pornographic material recognition; Deep learning; Convolutional neural networks	INTERNET PORNOGRAPHY USE; VISUAL-ATTENTION MODEL; ITERATIVE FUSION; ENSEMBLE; RECOGNITION; DIVERSITY; CLUSTERS; QUALITY	The pornographic materials including videos and images are easily in reach for everyone, including under-age youths, allover Internet. It is also an aim for popular social network applications to contain no public pornographic materials. However, their frequent existence throughout all the Internet and huge amount of available images and videos there, make it impossible for manual monitoring to discriminate positive items (porn image or video) from benign images (non-porn image or video). Therefore, automatic detection techniques can be very useful here. But, the traditional machine learning models face many challenges. For example, they need to tune their many parameters, to select the suitable feature set, to select a suitable model. Therefore, this paper proposes an intelligent filtering system model based on a recent convolutional neural networks where it bypasses the aforementioned challenges. We show that the proposed model outperforms the recent machine learning based models. It also outperforms the state of the art deep learning based models.																	1370-4621	1573-773X				AUG	2020	52	1			SI		169	185		10.1007/s11063-020-10238-3		APR 2020											
J								Unsupervised visual domain adaptation via discriminative dictionary evolution	PATTERN ANALYSIS AND APPLICATIONS										Cross-domain visual classification; Domain adaptation; Discriminative dictionary evolution; Feature representation learning; Transfer learning	ALIGNMENT; KERNEL	This work focuses on unsupervised visual domain adaptation which is still challenging in visual recognition. Most of the attention has been dedicated to seeking the domain-invariant features of cross-domain data, but they ignores the valuable discriminative information in the source domain. In this paper, we propose a Discriminative Dictionary Evolution (DDE) approach to seek discriminative features robust to domain shift. Specifically, DDE gradually adapts a discriminative dictionary learned from the source domain to the target domain through a dictionary evolving procedure, in which self-selected atoms of the dictionary are updated with l(2,1)-norm-based regularization. DDE produces domain-invariant representations for cross-domain visual recognition meanwhile promotes the discriminativeness of the dictionary. Empirical results on real-world data sets demonstrate the advantages of the proposed approach over existing competitive methods.																	1433-7541	1433-755X				NOV	2020	23	4					1665	1675		10.1007/s10044-020-00881-w		APR 2020											
J								Temporal convolutional neural (TCN) network for an effective weather forecasting using time-series data from the local weather station	SOFT COMPUTING										Localized weather forecasting; Time-series data analysis; Temporal convolution networks (TCN); Long short-term memory (LSTM); Precision farming	PREDICTION; PARAMETERS	Non-predictive or inaccurate weather forecasting can severely impact the community of users such as farmers. Numerical weather prediction models run in major weather forecasting centers with several supercomputers to solve simultaneous complex nonlinear mathematical equations. Such models provide the medium-range weather forecasts, i.e., every 6 h up to 18 h with grid length of 10-20 km. However, farmers often depend on more detailed short-to medium-range forecasts with higher-resolution regional forecasting models. Therefore, this research aims to address this by developing and evaluating a lightweight and novel weather forecasting system, which consists of one or more local weather stations and state-of-the-art machine learning techniques for weather forecasting using time-series data from these weather stations. To this end, the system explores the state-of-the-art temporal convolutional network (TCN) and long short-term memory (LSTM) networks. Our experimental results show that the proposed model using TCN produces better forecasting compared to the LSTM and other classic machine learning approaches. The proposed model can be used as an efficient localized weather forecasting tool for the community of users, and it could be run on a stand-alone personal computer.																	1432-7643	1433-7479				NOV	2020	24	21					16453	16482		10.1007/s00500-020-04954-0		APR 2020											
J								Intelligent fuzzy rule-based approach with outlier detection for secured routing in WSN	SOFT COMPUTING										Fuzzy rules; Trust score; Energy efficiency; Secure routing and cluster-based routing; Temporal reasoning; Wireless sensor networks	WIRELESS SENSOR NETWORKS; ENERGY-EFFICIENT; PROTOCOL; ALGORITHM; CLUSTER; KNOWLEDGE	In wireless sensor networks (WSNs), energy optimization and the provision of security are the major design challenges. Since the wireless sensor devices are energy constrained, the issue of high energy consumption by the malicious nodes must be addressed well in order to enhance the network performance by making increased network lifetime, reduced energy consumption and delay. In the past, many researchers worked in the provision of new techniques for providing improved security to WSN in order to enhance the reliability in the routing process. However, most of the existing routing techniques are not able to achieve the required security through the use of intelligent techniques for safeguarding the sensor nodes from malicious attacks. In order to address these problems, a new fuzzy temporal clustering-based secured communication model with trust analysis and outlier detection has been developed in this research work. For this purpose, a new fuzzy temporal rule-based cluster-based routing algorithm with trust modelling and outlier detection for monitoring the nodes participating in the communication has been proposed. In addition, a fuzzy temporal rule- and distance-based outlier detection algorithm is also proposed in this paper for distinguishing the malicious nodes from other nodes within each cluster of the network and has been used in the secured routing algorithm. The proposed secure routing algorithm uses the temporal reasoning tasks of explanation-based learning and prediction as well as spatial constraints for making efficient routing decisions through the application of trust and key management techniques for performing effective authentication of nodes and thereby isolating the malicious nodes from communication through outlier detection. By applying these two proposed algorithms for communication in the proposed work, it is proved through experiments that the proposed secure routing algorithm and the outlier detection algorithm are able to perform secured and reliable routing through genuine cluster head nodes more effectively. Moreover, these two algorithms provide improved quality of service with respect to the reliability of communication, packet delivery ratio, reduction in end-to-end delay and reduced energy consumption.																	1432-7643	1433-7479				NOV	2020	24	21					16483	16497		10.1007/s00500-020-04955-z		APR 2020											
J								Engineering problems in machine learning systems	MACHINE LEARNING										Machine learning; Software engineering; Systems engineering; Safety critical systems; Automated driving; Quality models		Fatal accidents are a major issue hindering the wide acceptance of safety-critical systems that employ machine learning and deep learning models, such as automated driving vehicles. In order to use machine learning in a safety-critical system, it is necessary to demonstrate the safety and security of the system through engineering processes. However, thus far, no such widely accepted engineering concepts or frameworks have been established for these systems. The key to using a machine learning model in a deductively engineered system is decomposing the data-driven training of machine learning models into requirement, design, and verification, particularly for machine learning models used in safety-critical systems. Simultaneously, open problems and relevant technical fields are not organized in a manner that enables researchers to select a theme and work on it. In this study, we identify, classify, and explore the open problems in engineering (safety-critical) machine learning systems-that is, in terms of requirement, design, and verification of machine learning models and systems-as well as discuss related works and research directions, using automated driving vehicles as an example. Our results show that machine learning models are characterized by a lack of requirements specification, lack of design specification, lack of interpretability, and lack of robustness. We also perform a gap analysis on a conventional system quality standard SQuaRE with the characteristics of machine learning models to study quality models for machine learning systems. We find that a lack of requirements specification and lack of robustness have the greatest impact on conventional quality models.																	0885-6125	1573-0565				MAY	2020	109	5					1103	1126		10.1007/s10994-020-05872-w		APR 2020											
J								Implementation of an optimized binary classification byGMDH-typeneural network algorithm for predicting the blast produced ground vibration	EXPERT SYSTEMS										blasting; GMDH; ground vibration; optimized binary classification	NEURAL-NETWORKS; INDUCED FLYROCK; PERFORMANCE; ANN	Ground vibration is one of the most important undesired phenomena resulting from blasting operations imposing damages to facilities and buildings on the one hand, and creating environmental problems in open pit mining on the other. Therefore, the present study aims to provide an optimized classification binary model to identify the blasting patterns with an acceptable ground vibration intensity to reduce the damages resulting from this artificial phenomenon. This study uses a binary method to provide an optimized classification model for predicting and evaluating the blasting patterns with the minimum ground vibration. Group Method of Data Handling-Type Neural Network is used as one of the most practical optimization algorithms to solve complicated and uncertain problems in this modelling. In this study, by collecting the data of 52 different blasting patterns from Soungun copper mine, some of the most important geometric properties and the amount of ammonium nitrate fuel oil consumed in each blasting pattern are recorded. In addition, based on expertise and experience of experts, the degree of ground vibration produced by each blasting is qualitatively classified into four different ranges of very high, high, normal and low in the form of unacceptable (very high and High) and acceptable (normal and low) clusters. Based on the results obtained from the analyses, the developed model has a high flexibility and ability in the binary prediction of blasting patterns with an acceptable vibration magnitude.																	0266-4720	1468-0394				OCT	2020	37	5			SI				e12563	10.1111/exsy.12563		APR 2020											
J								Machine learning explainability via microaggregation and shallow decision trees	KNOWLEDGE-BASED SYSTEMS										Explainability; Machine learning; Data protection; Microaggregation; Privacy		Artificial intelligence (AI) is being deployed in missions that are increasingly critical for human life. To build trust in AI and avoid an algorithm-based authoritarian society, automated decisions should be explainable. This is not only a right of citizens, enshrined for example in the European General Data Protection Regulation, but a desirable goal for engineers, who want to know whether the decision algorithms are capturing the relevant features. For explainability to be scalable, it should be possible to derive explanations in a systematic way. A common approach is to use simpler, more intuitive decision algorithms to build a surrogate model of the black-box model (for example a deep learning algorithm) used to make a decision. Yet, there is a risk that the surrogate model is too large for it to be really comprehensible to humans. We focus on explaining black-box models by using decision trees of limited depth as a surrogate model. Specifically, we propose an approach based on microaggregation to achieve a trade-off between the comprehensibility and the representativeness of the surrogate model on the one side and the privacy of the subjects used for training the black-box model on the other side. (C) 2020 Elsevier B.V. All rights reserved.																	0950-7051	1872-7409				APR 22	2020	194								105532	10.1016/j.knosys.2020.105532													
