PT	AU	BA	BE	GP	AF	BF	CA	TI	SO	SE	BS	LA	DT	CT	CY	CL	SP	HO	DE	ID	AB	C1	RP	EM	RI	OI	FU	FX	CR	NR	TC	Z9	U1	U2	PU	PI	PA	SN	EI	BN	J9	JI	PD	PY	VL	IS	PN	SU	SI	MA	BP	EP	AR	DI	D2	EA	PG	WC	SC	GA	UT	PM	OA	HC	HP	DA
J								Neuromodulated attention and goal-driven perception in uncertain domains	NEURAL NETWORKS										Neuromodulation; Goal-driven perception; Uncertainty; Top-down attention; Contrastive excitation backprop	BASAL FOREBRAIN; TOP-DOWN; MODULATION; MECHANISMS; RECEPTORS; BRAIN	In uncertain domains, the goals are often unknown and need to be predicted by the organism or system. In this paper, contrastive Excitation Backprop (c-EB) was used in two goal-driven perception tasks - one with pairs of noisy MNIST digits and the other with a robot in an action-based attention scenario. The first task included attending to even, odd, low, and high digits, whereas the second task included action goals, such as "eat", "work-on-computer", "read", and "say-hi" that led to attention to objects associated with those actions. The system needed to increase attention to target items and decrease attention to distractor items and background noise. Because the valid goal was unknown, an online learning model based on the cholinergic and noradrenergic neuromodulatory systems was used to predict a noisy goal (expected uncertainty) and re-adapt when the goal changed (unexpected uncertainty). This neurobiologically plausible model demonstrates how neuromodulatory systems can predict goals in uncertain domains and how attentional mechanisms can enhance the perception for that goal. (c) 2020 Elsevier Ltd. All rights reserved.																	0893-6080	1879-2782				MAY	2020	125						56	69		10.1016/j.neunet.2020.01.031													
J								Training high-performance and large-scale deep neural networks with full 8-bit integers	NEURAL NETWORKS										Neural network quantization; 8-bit training; Full quantization; Online learning device	PRECISION	Deep neural network (DNN) quantization converting floating-point (FP) data in the network to integers (INT) is an effective way to shrink the model size for memory saving and simplify the operations for compute acceleration. Recently, researches on DNN quantization develop from inference to training, laying a foundation for the online training on accelerators. However, existing schemes leaving batch normalization (BN) untouched during training are mostly incomplete quantization that still adopts high precision FP in some parts of the data paths. Currently, there is no solution that can use only low bit-width INT data during the whole training process of large-scale DNNs with acceptable accuracy. In this work, through decomposing all the computation steps in DNNs and fusing three special quantization functions to satisfy the different precision requirements, we propose a unified complete quantization framework termed as "WAGEUBN" to quantize DNNs involving all data paths including W (Weights), A (Activation), G (Gradient), E (Error), U (Update), and BN. Moreover, the Momentum optimizer is also quantized to realize a completely quantized framework. Experiments on ResNet18/34/50 models demonstrate that WAGEUBN can achieve competitive accuracy on the ImageNet dataset. For the first time, the study of quantization in large-scale DNNs is advanced to the full 8-bit INT level. In this way, all the operations in the training and inference can be bit-wise operations, pushing towards faster processing speed, decreased memory cost, and higher energy efficiency. Our throughout quantization framework has great potential for future efficient portable devices with online learning ability. (c) 2020 Elsevier Ltd. All rights reserved.																	0893-6080	1879-2782				MAY	2020	125						70	82		10.1016/j.neunet.2019.12.027													
J								PET image super-resolution using generative adversarial networks	NEURAL NETWORKS										Super-resolution; Self-supervised; CNN; GAN; PET; Multimodality imaging	BRAIN PET	The intrinsically low spatial resolution of positron emission tomography (PET) leads to image quality degradation and inaccurate image-based quantitation. Recently developed supervised super-resolution (SR) approaches are of great relevance to PET but require paired low- and high-resolution images for training, which are usually unavailable for clinical datasets. In this paper, we present a self-supervised SR (SSSR) technique for PET based on dual generative adversarial networks (GANs), which precludes the need for paired training data, ensuring wider applicability and adoptability. The SSSR network receives as inputs a low-resolution PET image, a high-resolution anatomical magnetic resonance (MR) image, spatial information (axial and radial coordinates), and a high-dimensional feature set extracted from an auxiliary CNN which is separately-trained in a supervised manner using paired simulation datasets. The network is trained using a loss function which includes two adversarial loss terms, a cycle consistency term, and a total variation penalty on the SR image. We validate the SSSR technique using a clinical neuroimaging dataset. We demonstrate that SSSR is promising in terms of image quality, peak signal-to-noise ratio, structural similarity index, contrast-to-noise ratio, and an additional no-reference metric developed specifically for SR image quality assessment. Comparisons with other SSSR variants suggest that its high performance is largely attributable to simulation guidance. (c) 2020 Elsevier Ltd. All rights reserved.																	0893-6080	1879-2782				MAY	2020	125						83	91		10.1016/j.neunet.2020.01.029													
J								Mu-net: Multi-scale U-net for two-photon microscopy image denoising and restoration	NEURAL NETWORKS										Image denoising; Two-photon microscopy image; Deep learning; U-net; GAN		Advances in two two-photon microscopy (2PM) have made three-dimensional (3D) neural imaging of deep cortical regions possible. However, 2PM often suffers from poor image quality because of various noise factors, including blur, white noise, and photo bleaching. In addition, the effectiveness of the existing image processing methods is limited because of the special features of 2PM images such as deeper tissue penetration but higher image noises owing to rapid laser scanning. To address the denoising problems in 2PM 3D images, we present a new algorithm based on deep convolutional neural networks (CNNs). The proposed model consists of multiple U-nets in which an individual U-net removes noises at different scales and then yields a performance improvement based on a coarse-to-fine strategy. Moreover, the constituent CNNs employ fully 3D convolution operations. Such an architecture enables the proposed model to facilitate end-to-end learning without any pre/post processing. Based on the experiments on 2PM image denoising, we observed that our new algorithm demonstrates substantial performance improvements over other baseline methods. (c) 2020 Elsevier Ltd. All rights reserved.																	0893-6080	1879-2782				MAY	2020	125						92	103		10.1016/j.neunet.2020.01.026													
J								Weighted discriminative collaborative competitive representation for robust image classification	NEURAL NETWORKS										Collaborative representation-based classification; Collaborative representation; Representation-based classification; Image classification; Pattern recognition	FACE RECOGNITION; SPARSE REPRESENTATION; DICTIONARY; LOCALITY; ALGORITHMS	Collaborative representation-based classification (CRC) is a famous representation-based classification method in pattern recognition. Recently, many variants of CRC have been designed for many classification tasks with the good classification performance. However, most of them ignore the inter-class pattern discrimination among the class-specific representations, which is very critical for strengthening the pattern discrimination of collaborative representation (CR). In this article, we propose a novel CR approach for image classification, called weighted discriminative collaborative competitive representation (WDCCR). The proposed WDCCR designs the discriminative and competitive collaborative representation among all the classes by fully considering the class information. On the one hand, we incorporate two discriminative constraints into the unified WDCCR model. Both constraints are the competitive class-specific representation residuals and the pairs of class-specific representations for each query sample. On the other hand, the constraint of the weighted categorical representation coefficients is introduced into the proposed model for further enhancing the power of discriminative and competitive representation. In the weighted constraint, we assume that the different classes of each query sample should have less contribution to the representation with the small representation coefficients, and then two types of weight factors are designed to constrain the representation coefficients. Furthermore, the robust WDCCR (R-WDCCR) is proposed with l(1)-norm representation fidelity for recognizing noisy images. Extensive experiments on six image data sets demonstrate the effective and robust superiorities of the proposed WDCCR and R-WDCCR over the related state-of-the-art representation-based classification methods. (c) 2020 Elsevier Ltd. All rights reserved.																	0893-6080	1879-2782				MAY	2020	125						104	120		10.1016/j.neunet.2020.01.020													
J								On the localness modeling for the self-attention based end-to-end speech synthesis	NEURAL NETWORKS										Speech synthesis; Self attention; Localness modeling; Relative-position-aware; Gaussian bias		Attention based end-to-end speech synthesis achieves better performance in both prosody and quality compared to the conventional "front-end"-"back-end" structure. But training such end-to-end framework is usually time-consuming because of the use of recurrent neural networks. To enable parallel calculation and long-range dependency modeling, a solely self-attention based framework named Transformer is proposed recently in the end-to-end family. However, it lacks position information in sequential modeling, so that the extra position representation is crucial to achieve good performance. Besides, the weighted sum form of self-attention is conducted over the whole input sequence when computing latent representation, which may disperse the attention to the whole input sequence other than focusing on the more important neighboring input states, resulting in generation errors. In this paper, we introduce two localness modeling methods to enhance the self-attention based representation for speech synthesis, which maintain the abilities of parallel computation and global-range dependency modeling in self-attention while improving the generation stability. We systematically analyze the solely self-attention based end-to-end speech synthesis framework, and unveil the importance of local context. Then we add the proposed relative-position-aware method to enhance local edges and experiment with different architectures to examine the effectiveness of localness modeling. In order to achieve query-specific window and discard the hyper-parameter of the relative-position-aware approach, we further conduct Gaussian-based bias to enhance localness. Experimental results indicate that the two proposed localness enhanced methods can both improve the performance of the self-attention model, especially when applied to the encoder part. And the query-specific window of Gaussian bias approach is more robust compared with the fixed relative edges. (c) 2020 Elsevier Ltd. All rights reserved.																	0893-6080	1879-2782				MAY	2020	125						121	130		10.1016/j.neunet.2020.01.034													
J								Preserving differential privacy in deep neural networks with relevance-based adaptive noise imposition	NEURAL NETWORKS										Deep neural networks; Differential privacy; Relevance analysis	REGRESSION-ANALYSIS; RECOGNITION	In recent years, deep learning achieves remarkable results in the field of artificial intelligence. However, the training process of deep neural networks may cause the leakage of individual privacy. Given the model and some background information of the target individual, the adversary can maliciously infer the sensitive feature of the target individual. Therefore, it is imperative to preserve the sensitive information in the training data. Differential privacy is a state-of-the-art paradigm for providing the privacy guarantee of datasets, which protects the private and sensitive information from the attack of adversaries significantly. However, the existing privacy-preserving models based on differential privacy are less than satisfactory since traditional approaches always inject the same amount of noise into parameters to preserve the sensitive information, which may impact the trade-off between the model utility and the privacy guarantee of training data. In this paper, we present a general differentially private deep neural networks learning framework based on relevance analysis, which aims to bridge the gap between private and non-private models while providing an effective privacy guarantee of sensitive information. The proposed model perturbs gradients according to the relevance between neurons in different layers and the model output. Specifically, during the process of backward propagation, more noise is added to gradients of neurons that have less relevance to the model output, and vice-versa. Experiments on five real datasets demonstrate that our mechanism not only bridges the gap between private and non-private models, but also prevents the disclosure of sensitive information effectively. (c) 2020 Elsevier Ltd. All rights reserved.																	0893-6080	1879-2782				MAY	2020	125						131	141		10.1016/j.neunet.2020.02.001													
J								Fast discrete cross-modal hashing with semantic consistency	NEURAL NETWORKS										Cross-modal retrieval; Semantic consistency; Discrete optimization; Hashing	CODES	Supervised cross-modal hashing has attracted widespread concentrations for large-scale retrieval task due to its promising retrieval performance. However, most existing works suffer from some of following issues. Firstly, most of them only leverage the pair-wise similarity matrix to learn hash codes, which may result in class information loss. Secondly, the pair-wise similarity matrix generally lead to high computing complexity and memory cost. Thirdly, most of them relax the discrete constraints during optimization, which generally results in large cumulative quantization error and consequent inferior hash codes. To address above problems, we present a Fast Discrete Cross-modal Hashing method in this paper, FDCH for short. Specifically, it firstly leverages both class labels and the pair-wise similarity matrix to learn a sharing Hamming space where the semantic consistency can be better preserved. Then we propose an asymmetric hash codes learning model to avoid the challenging issue of symmetric matrix factorization. Finally, an effective and efficient discrete optimal scheme is designed to generate discrete hash codes directly, and the computing complexity and memory cost caused by the pair-wise similarity matrix are reduced from O(n(2)) to O(n), where n denotes the size of training set. Extensive experiments conducted on three real world datasets highlight the superiority of FDCH compared with several cross-modal hashing methods and demonstrate its effectiveness and efficiency. (c) 2020 Elsevier Ltd. All rights reserved.																	0893-6080	1879-2782				MAY	2020	125						142	152		10.1016/j.neunet.2020.01.035													
J								Robust min-max optimal control design for systems with uncertain models: A neural dynamic programming approach	NEURAL NETWORKS										Approximate dynamic-programming; Artificial neural networks; Hamilton-Jacobi-Bellman equation; Bellman function; Sub-optimal controller	JACOBI-BELLMAN EQUATIONS; NONLINEAR-SYSTEMS; TRACKING CONTROL; NETWORK; APPROXIMATION	The design of an artificial neural network (ANN) based sub-optimal controller to solve the finite-horizon optimization problem for a class of systems with uncertainties is the main outcome of this study. The optimization problem considers a convex performance index in the Bolza form. The dynamic uncertain restriction is considered as a linear system affected by modeling uncertainties, as well as by external bounded perturbations. The proposed controller implements a min-max approach based on the dynamic neural programming approximate solution. An ANN approximates the Value function to get the estimate of the Hamilton-Jacobi-Bellman (HJB) equation solution. The explicit adaptive law for the weights in the ANN is obtained from the approximation of the HJB solution. The stability analysis based on the Lyapunov theory yields to confirm that the approximate Value function serves as a Lyapunov function candidate and to conclude the practical stability of the equilibrium point. A simulation example illustrates the characteristics of the sub-optimal controller. The comparison of the performance indexes obtained with the application of different controllers evaluates the effect of perturbations and the sub-optimal solution. (c) 2020 Elsevier Ltd. All rights reserved.																	0893-6080	1879-2782				MAY	2020	125						153	164		10.1016/j.neunet.2020.01.016													
J								Reachable set bounding for neural networks with mixed delays: Reciprocally convex approach	NEURAL NETWORKS										Reachable set; Maximal Lyapunov functional; Mixed delays systems; Polytopic uncertainties; Reciprocally convex	FINITE-TIME CONSENSUS; LINEAR-SYSTEMS; MULTIAGENT SYSTEMS; STABILITY; DISCRETE	This paper discusses the reachable set estimation problem of neural networks with mixed delays. Firstly, by means of the maximal Lyapunov-Krasovskii functional, we obtain a non-ellipsoid form of the reachable set. Further more, when calculating the derivative of the maximum Lyapunov functional, the lower bound lemma and reciprocally convex approach method are used to solve the reciprocally convex combination term, which reduce the related decision variables. Secondly, we extend the results to polytopic uncertainties neural networks and consider the case of uncertain differentiable parameters. Finally, two numerical examples and one application example are listed to show the validity of our methods. (c) 2020 Elsevier Ltd. All rights reserved.																	0893-6080	1879-2782				MAY	2020	125						165	173		10.1016/j.neunet.2020.02.005													
J								Chaos in fractional-order discrete neural networks with application to image encryption	NEURAL NETWORKS										Fractional-order discrete systems; Neural networks; Synchronization; Image encryption	MITTAG-LEFFLER STABILITY; PROJECTIVE SYNCHRONIZATION; ALGORITHM; TIME	In this paper, a three-dimensional fractional-order (FO) discrete Hopfield neural network (FODHNN) in the left Caputo discrete delta's sense is proposed, the dynamic behavior and synchronization of FODHNN are studied, and the system is applied to image encryption. First, FODHNN is shown to exhibit rich nonlinear dynamics behaviors. Phase portraits, bifurcation diagrams and Lyapunov exponents are carried out to verify chaotic dynamics in this system. Moreover, by using stability theorem of FO discrete linear systems, a suitable control scheme is designed to achieve synchronization of the FODHNN. Finally, image encryption system based on the chaotic FODHNN is presented. Some security analysis and tests are given to show the effective of the encryption system. (c) 2020 Elsevier Ltd. All rights reserved.																	0893-6080	1879-2782				MAY	2020	125						174	184		10.1016/j.neunet.2020.02.008													
J								Causal importance of low-level feature selectivity for generalization in image recognition	NEURAL NETWORKS										Neural network; Orientation selectivity; Causality	DEEP NEURAL-NETWORKS; ORIENTATION SELECTIVITY; VISUAL-CORTEX; NEURONS; REPRESENTATIONS; SENSITIVITY; CELLS	Although our brain and deep neural networks (DNNs) can perform high-level sensory-perception tasks, such as image or speech recognition, the inner mechanism of these hierarchical information-processing systems is poorly understood in both neuroscience and machine learning. Recently, Morcos et al. (2018) examined the effect of class-selective units in DNNs, i.e., units with high-level selectivity, on network generalization, concluding that hidden units that are selectively activated by specific input patterns may harm the network's performance. In this study, we revisited their hypothesis, considering units with selectivity for lower-level features, and argue that selective units are not always harmful to the network performance. Specifically, by using DNNs trained for image classification, we analyzed the orientation selectivity of individual units, a low-level selectivity widely studied in visual neuroscience. We found that orientation-selective units exist in both lower and higher layers of these DNNs, as in our brain. In particular, units in lower layers became more orientation-selective as the generalization performance improved during the course of training. Consistently, networks that generalized better were more orientation-selective in the lower layers. We finally revealed that ablating these selective units in the lower layers substantially degraded the generalization performance of the networks, at least by disrupting the shift-invariance of the higher layers. These results suggest that orientation selectivity can play a causally important role in object recognition, and that, contrary to the triviality of units with high-level selectivity, lower-layer units with selectivity for low-level features may be indispensable for generalization, at least for the several network architectures. (c) 2020 The Author(s). Published by Elsevier Ltd. This is an open access article under the CC BY-NC-ND license (http://creativecommons.org/licenses/by- nc-nd/4.0/).																	0893-6080	1879-2782				MAY	2020	125						185	193		10.1016/j.neunet.2020.02.009													
J								Resilient fault-tolerant anti-synchronization for stochastic delayed reaction-diffusion neural networks with semi-Markov jump parameters	NEURAL NETWORKS										Anti-synchronization; Semi-Markov process; Fault-tolerant control; Resilient control; Neural networks	H-INFINITY CONTROL; EXPONENTIAL STABILITY; SYSTEMS; STABILIZATION; CRITERIA	This paper deals with the anti-synchronization issue for stochastic delayed reaction-diffusion neural networks subject to semi-Markov jump parameters. A resilient fault-tolerant controller is utilized to ensure the anti-synchronization in the presence of actuator failures as well as gain perturbations, simultaneously. Firstly, by means of the Lyapunov functional and stochastic analysis methods, a mean-square exponential stability criterion is derived for the resulting error system. It is shown the obtained criterion improves a previously reported result. Then, based on the present analysis result and using several decoupling techniques, a strategy for designing the desired resilient fault-tolerant controller is proposed. At last, two numerical examples are given to illustrate the superiority of the present stability analysis method and the applicability of the proposed resilient fault-tolerant anti-synchronization control strategy, respectively. (c) 2020 Elsevier Ltd. All rights reserved.																	0893-6080	1879-2782				MAY	2020	125						194	204		10.1016/j.neunet.2020.02.015													
J								Collaborative learning with corrupted labels	NEURAL NETWORKS										Deep neural networks; Corrupted labels; Robustness	NEURAL-NETWORKS	Deep neural networks (DNNs) have been very successful for supervised learning. However, their high generalization performance often comes with the high cost of annotating data manually. Collecting low-quality labeled dataset is relatively cheap, e.g., using web search engines, while DNNs tend to overfit to corrupted labels easily. In this paper, we propose a collaborative learning (co-learning) approach to improve the robustness and generalization performance of DNNs on datasets with corrupted labels. This is achieved by designing a deep network with two separate branches, coupled with a relabeling mechanism. Co-learning could safely recover the true labels of most mislabeled samples, not only preventing the model from overfitting the noise, but also exploiting useful information from all the samples. Although being very simple, the proposed algorithm is able to achieve high generalization performance even a large portion of the labels are corrupted. Experiments show that co-learning consistently outperforms existing state-of-the-art methods on three widely used benchmark datasets. (c) 2020 Elsevier Ltd. All rights reserved.																	0893-6080	1879-2782				MAY	2020	125						205	213		10.1016/j.neunet.2020.02.010													
