PT	AU	BA	BE	GP	AF	BF	CA	TI	SO	SE	BS	LA	DT	CT	CY	CL	SP	HO	DE	ID	AB	C1	RP	EM	RI	OI	FU	FX	CR	NR	TC	Z9	U1	U2	PU	PI	PA	SN	EI	BN	J9	JI	PD	PY	VL	IS	PN	SU	SI	MA	BP	EP	AR	DI	D2	EA	PG	WC	SC	GA	UT	PM	OA	HC	HP	DA
J								Active Learning of Bayesian Linear Models with High-Dimensional Binary Features by Parameter Confidence-Region Estimation	NEURAL COMPUTATION											WORKING SET SELECTION	In this letter, we study an active learning problem for maximizing an unknown linear function with high-dimensional binary features. This problem is notoriously complex but arises in many important contexts. When the sampling budget, that is, the number of possible function evaluations, is smaller than the number of dimensions, it tends to be impossible to identify all of the optimal binary features. Therefore, in practice, only a small number of such features are considered, with the majority kept fixed at certain default values, which we call theworking set heuristic. The main contribution of this letter is to formally study the working set heuristic and present a suite of theoretically robust algorithms for more efficient use of the sampling budget. Technically, we introduce a novel method for estimating the confidence regions of model parameters that is tailored to active learning with high-dimensional binary features. We provide a rigorous theoretical analysis of these algorithms and prove that a commonly used working set heuristic can identify optimal binary features with favorable sample complexity. We explore the performance of the proposed approach through numerical simulations and an application to a functional protein design problem.																	0899-7667	1530-888X				OCT	2020	32	10					1998	2031		10.1162/neco_a_01310													
J								Active Learning for Enumerating Local Minima Based on Gaussian Process Derivatives	NEURAL COMPUTATION											OPTIMIZATION; SEARCH	We study active learning (AL) based on gaussian processes (GPs) for efficiently enumerating all of the local minimum solutions of a black-box function. This problem is challenging because local solutions are characterized by their zero gradient and positive-definite Hessian properties, but those derivatives cannot be directly observed. We propose a new AL method in which the input points are sequentially selected such that the confidence intervals of the GP derivatives are effectively updated for enumerating local minimum solutions. We theoretically analyze the proposed method and demonstrate its usefulness through numerical experiments.																	0899-7667	1530-888X				OCT	2020	32	10					2032	2068		10.1162/neco_a_01307													
J								A two-stage machine learning framework to predict heart transplantation survival probabilities over time with a monotonic probability constraint	DECISION SUPPORT SYSTEMS										Data mining; Heart transplant; Isotonic regression; Medical informatics; Multi-period forecasting; United network for organ sharing	ISOTONIC REGRESSION; ANALYTICS	The overarching goal of this paper is to develop a modeling framework that can be used to obtain personalized, data-driven and monotonically constrained probability curves. This research is motivated by the important problem of improving the predictions for organ transplantation outcomes, which can inform updates made to organ allocation protocols, post-transplantation care pathways, and clinical resource utilization. In pursuit of our overarching goal and motivating problem, we propose a novel two-stage machine learning-based framework for obtaining monotonic probabilities over time. The first stage uses the standard approach of using independent machine learning models to predict transplantation outcomes for each time-period of interest. In the second stage, we calibrate the survival probabilities over time using isotonic regression. To show the utility of our framework, we applied it on a national registry of U.S. heart transplants from 1987 to 2016. The first stage produces an area under the receiver operating curve (AUC) between 0.60 and 0.71 for years 1-10. While the 1-year prediction AUC result is comparable to the reported results in the literature, our 10-year AUC of 0.70 is higher than the current state-of-the-art results. More importantly, we show that the application of isotonic regression to calibrate the survival probabilities for each patient over the 10-year period guarantees monotonicity, while capitalizing on the data-driven and individualized nature of machine learning models. To promote future research, our code and analysis are publicly available on GitHub. Furthermore, we created a web app titled "H-TOP: Heart Transplantation Outcome Predictor" to encourage practical applications.																	0167-9236	1873-5797				OCT	2020	137								113363	10.1016/j.dss.2020.113363													
J								A data-driven methodology for the automated configuration of online algorithms	DECISION SUPPORT SYSTEMS										Automated decision making; Data-driven optimization; Automated algorithm configuration; Online optimization; Simulated annealing; Lean decision making	BIN-PACKING; COMBINATORIAL OPTIMIZATION; FIXED START; METAHEURISTICS; HEURISTICS; SYSTEMS; JOBS	With the goal of devising algorithms for decision support in operational tasks, we introduce a new methodology for the automated configuration of algorithms for combinatorial online optimization problems. The procedure draws upon available instance data and is capable of recognizing data patterns which prove beneficial to the overall outcome. Since online optimization requires repetitive decision making without complete future information, no online algorithm can be optimal for every instance and it is reasonable to restrict attention to rule-based algorithms. We consider such algorithms in the form of procedures which derive their decisions using a threshold value. Threshold values are computed by evaluating a mathematical term (threshold value expression) composed of the available instance data elements. The goal then consists of determining the structure of the threshold value expression leading to the best algorithm performance. To this end, we employ a simulated annealing scheme returning the most favorable term composition given the available instance data. The resulting methodology can be implemented as part of data-driven decision support systems in order to facilitate knowledge-based decision making. Decision rules are generated in an automated fashion once historical input data is provided. The methodology is successfully instantiated in a series of computational experiments for three classes of combinatorial online optimization problems (scheduling, packing, lot sizing). Results show that automatically configured online algorithms are even capable of substantially outperforming well-known online algorithms in respective problem settings. We attribute this effect to the methodology's capability of integrating instance data into the process of algorithm configuration.																	0167-9236	1873-5797				OCT	2020	137								113343	10.1016/j.dss.2020.113343													
J								An integrated decision analysis methodology based on IF-DEMATEL and IF-ELECTRE for personnel selection	DECISION SUPPORT SYSTEMS										Business analytics; Group decision-making; IF-DEMATEL; IF-ELECTRE; Multicriteria decision-making (MCDM); Personnel selection	HYBRID MCDM APPROACH; FUZZY TOPSIS; OUTRANKING METHODS; MANAGER SELECTION; PROJECT MANAGERS; MAKING APPROACH; SUPPLY CHAIN; PERFORMANCE; SYSTEM; ANP	Due to its complex, time-demanding, and multifaceted structure, personnel selection is considered as a multi-criteria decision-making problem, the framework of which includes both qualitative and quantitative criteria. Although various techniques have been proposed to address this problem in various industries, a robust methodology that is capable of explicitly considering the presence of uncertainty/vagueness is still a necessity. Therefore, with this study, we propose an integrated methodology that leverages Decision Making Trial and Evaluation Laboratory (DEMATEL) and Elimination and Choice Expressing the Reality (ELECTRE) methods under Intuitionistic Fuzzy (IF) environment. Within the proposed methodology, firstly, the IF-DEMATEL method is employed to obtain the importance-weights of the elicited criteria, and then the IF-ELECTRE method is formulated and applied to rank the candidates based on cardinal and ordinal evaluations. To illustrate the viability of the proposed methodology, an application case is performed at an air-filter manufacturing company. Hence, this study aims to contribute to the theoretical and practical extent of the related literature by proposing and illustrating an integrated analytics methodology capable of addressing personnel selection decisions in complex and imprecise real-world scenarios.																	0167-9236	1873-5797				OCT	2020	137								113360	10.1016/j.dss.2020.113360													
J								Minimizing the data quality problem of information systems: A process-based method	DECISION SUPPORT SYSTEMS										Data quality; Information system; Petri net; Optimization model; Process model	SELECTION; IMPACT; RISK	The low quality of data in information systems poses enormous risks to business operations and decision making. In this paper, a single-period resource allocation problem for controlling the information system's data quality problem is considered. We develop a Data-Quality-Petri net to capture the process through which data quality problem generates, propagates, and accumulates in the information system. The net considers not only the factors leading to the production of the data quality problem by the data operation nodes and the data flow structure, but also the data transfer ratio of the nodes. Then, we propose a nonlinear programming optimization model with control resource constraints. The result of the model provides an optimal strategy to allocate resources for minimizing the expected data quality problem of an information system. Further, we examine the impact of the data flow structure on optimal resource allocation. The result shows that the optimal resource input level for a data operation node is proportional to its potential for downstream propagation. A warehouse management system of an e-commerce company is utilized to illustrate the model. Our study provides a method for data managers to control the information system's data quality problem by employing a process perspective.																	0167-9236	1873-5797				OCT	2020	137								113381	10.1016/j.dss.2020.113381													
J								Novice digital service designers' decision-making with decision aids - A comparison of taxonomy and tags	DECISION SUPPORT SYSTEMS										Cognitive effort; Decision aid; Decision style; Tags; Taxonomy	COGNITIVE EFFORT; INDIVIDUAL-DIFFERENCES; DATA QUALITY; E-COMMERCE; FIT; PATTERNS; STYLES; CHOICE; TASK; CLASSIFICATION	Digital services are a key driver of contemporary businesses. In order to scale the implementation of design-centric development processes, companies increasingly assign design work to design novices. As design novices have limited design knowledge and experience, they are challenged to select adequate design techniques throughout the entire lifecycle of digital services. Thus, providing decision aids to design novices is becoming increasingly important. In this research, we investigate taxonomy-based and tags-based decision aids. We draw on cognitive fit theory to construct a research model explaining the relationship between different decision aids and selection accuracy while considering the cognitive effort and the decision styles of novice designers. To test our hypotheses, we conducted a between-subject laboratory experiment with 195 subjects. Our experimental results provide extensive support to our hypotheses. Taxonomy-based decision aids outperform tags-based decision aids concerning selection accuracy mediated by cognitive effort. Furthermore, the results suggest rational decision style as a moderator in the relationship between taxonomy-based decision aids and selection accuracy. Our results have practical implications: First, taxonomy-based decision aids should be primarily leveraged on decision support platforms supporting design processes. Second, design novices' decision style and cognitive effort are influential factors when developing decision aids to support digital service design processes.																	0167-9236	1873-5797				OCT	2020	137								113367	10.1016/j.dss.2020.113367													
J								Is user-generated content always helpful? The effects of online forum browsing on consumers' travel purchase decisions	DECISION SUPPORT SYSTEMS											WORD-OF-MOUTH; INFORMATION OVERLOAD; SOCIAL COMMERCE; PARTICIPATION; BEHAVIOR; MEMBERS; IMPACT; EXPLORATION; COMMUNITY; DILUTION	This study examines how the unique information environment of online forums affects consumers' information acquisitions, and further impacts their purchase behavior. Based on the information foraging theory, we hypothesize that the relevant information patches in online forums facilitate consumers' information acquisition processes and increase purchase intention. However, the mixed information scents within online forums could also lead to fewer or no purchases because of distraction from unrelated information. To test the proposed hypotheses, we empirically analyze a unique data set of consumers' webpage browsing histories and purchase behavior from a major online travel agency in China. The findings of this study provide insights into how online forum browsing behavior affects consumers' purchase decisions. The findings also offer important implications for online forum design.																	0167-9236	1873-5797				OCT	2020	137								113368	10.1016/j.dss.2020.113368													
J								Decision support system for a heat-recovery section with equipment degradation	DECISION SUPPORT SYSTEMS										Mathematical modeling; Maintenance decisions; Heat recovery; Real-time optimization; Industrial DSS	DATA RECONCILIATION	In the framework of Industry 4.0, decision support systems (DSS) are an essential part in the process of converting information into managerial actions. This paper proposes a specific DSS to improve the daily operation of an industrial heat-recovery section (a network of heat exchangers) in a fiber-production factory. In this process, the aim is to optimize the resource utilization in real time while satisfying a set of production constraints. The operational decisions to be taken by the network operators is to set up the heat-source allocation to heat exchangers. Furthermore, the heat transfer decreases over time due to fouling in the exchangers, so an additional decision to take is which exchanger to clean and when. The proposed model-based DSS builds upon a rigorous mathematical representation of the network, integrating continuous operation with the discrete decisions on maintenance. Then, a mixed-integer nonlinear optimization, solved in real time, drives the analysis and choice phases to fulfill product specifications according to an economic criterion. In this way, the proposed DSS not only provides the user with a right allocation of heat sources to exchangers, but also suggests which of them are potentially beneficial to be cleaned.																	0167-9236	1873-5797				OCT	2020	137								113380	10.1016/j.dss.2020.113380													
J								Three-stage reject inference learning framework for credit scoring using unsupervised transfer learning and three-way decision theory	DECISION SUPPORT SYSTEMS										Reject inference; Unsupervised transfer learning; Three-way decision theory; Credit scoring	AUGMENTATION	There has been significant research into reject inference, with several statistical methods and machine learning techniques having been employed to infer the possible repayment behavior of rejected credit applicants. This study proposes a novel three-stage reject inference learning framework using unsupervised transfer learning and three-way decision theory that integrates: (1) the rejected credit sample selection using three-way decision theory, (2) higher-level representations to transfer learning from both accepted and selected rejected credit samples; and (3) credit scoring using the reconstructed accepted credit samples. This method was found to both perform well for reject inference and handle negative transfer learning problems. The numerical results were validated on Chinese credit data, the results from which demonstrated the superiority of the proposed reject inference method for credit risk management applications.																	0167-9236	1873-5797				OCT	2020	137								113366	10.1016/j.dss.2020.113366													
J								Facilitating Complex Product Choices on E-commerce Sites: An Unconscious Thought and Circadian Preference Perspective	DECISION SUPPORT SYSTEMS										Unconscious thought theory; Online shopping; Consumer choice; Circadian preference; Human-computer interaction	INDIVIDUAL-DIFFERENCES; DECISION-MAKING; USER ACCEPTANCE; INHIBITORY CONTROL; CONSCIOUS THOUGHT; AGE-DIFFERENCES; WORKING-MEMORY; TIME; ATTENTION; BENEFITS	E-commerce consumers often face complex product choices and have to make decisions at various times of the day. Extant research has primarily focused on providing decision aids and eliminating "distracting" features to help consumers' conscious thought when making complex decisions. Our research adopts a novel perspective that consumers' unconscious thought may have some advantages and be exploited to help consumers make complex purchase decisions, especially when one's circadian preference (optimal time of day for decision-making, e.g., morning vs. evening) is not met. Drawing on the Unconscious Thought Theory (UTT), we developed two hypotheses regarding the effects of consumers' unconscious thought and its interaction with consumer circadian preference on decision quality. A controlled experiment was conducted to test our hypotheses. The findings show that unconscious thought outperforms conscious thought for making complex product choices in general and such effects are amplified when there is an asynchrony between one's circadian preference and the time of decision. The new circadian synchrony perspective enriches our understanding of the effects of unconscious thought on decision-making, helps explain the somewhat mixed findings in prior work on UTT, and thus contributes back to the UTT literature. The findings have implications about how unconscious thought can be leveraged to facilitate online shopping, and underscores the importance of considering consumer's circadian preference and time of decision.																	0167-9236	1873-5797				OCT	2020	137								113365	10.1016/j.dss.2020.113365													
J								A novel probabilistic graphic model to detect product defects from social media data	DECISION SUPPORT SYSTEMS										Product defect detection; Social media data; Probabilistic graphic model; Text analysis	CUSTOMER SATISFACTION; SERVICE QUALITY; ONLINE; REVIEWS; INTELLIGENCE; PREDICTION; DISCOVERY; ANALYTICS	Product defects are a major concern for manufacturers and customers. Detecting product defects is vital for manufacturers to prevent enormous product failure costs. As the surge of social media is in vogue, social media data become an important information source for manufacturers to collect defect information. In this study, we propose a novel probabilistic graphic model to discover defects from social media data. We first use three filters, namely, sentiment filter, component-symptom filter and similarity filter, to select informative data. Second, we analyze the remaining data via the proposed probabilistic graphic model and identify defect-related data. Our method provides detailed defect information including defect types, defective components and defect symptoms which is omitted by previous research. A case study in the automobile industry validates the effectiveness and superior performance of our method compared to prior approaches.																	0167-9236	1873-5797				OCT	2020	137								113369	10.1016/j.dss.2020.113369													
J								Real-time iris segmentation and its implementation on FPGA	JOURNAL OF REAL-TIME IMAGE PROCESSING										Pupil segmentation; Pupil localization; Region properties	HOUGH TRANSFORM; LOCALIZATION; ARCHITECTURE; RECOGNITION; DESIGN	This paper presents a real-time iris segmentation technique that is well suited to a fast implementation on an FPGA. One major hurdle associated with iris segmentation techniques is the use of iterative processes that lead to expensive hardware implementations. To circumvent this, the proposed algorithm uses the sign image obtained from subtracting the background, along with morphological operators to localise the pupil. The outer boundary is located by first normalising a selected image region that contains the iris, and then using a first-order gradient operator. The proposed non-iterative algorithm is implemented on an FPGA. Four near infrared (NIR) iris public databases, namely: CASIA-IrisV3-Lamp, MMU v1.0, ND-IRIS-0405 and NIST ICE 2005, are used to test the proposed algorithm. The proposed method for iris segmentation and normalization gives much better accuracy than the existing state-of-the-art methods implemented on hardware. The proposed realisation requires about 45% fewer logic registers and 52% fewer logic elements than the existing state-of-the-art implementations.																	1861-8200	1861-8219				OCT	2020	17	5					1089	1102		10.1007/s11554-019-00859-w													
J								Real-time adaptive visible and infrared image registration based on morphological gradient and C_SIFT	JOURNAL OF REAL-TIME IMAGE PROCESSING										Visible image; Infrared image; Registration; Morphological gradient; SIFT; Real-time	MUTUAL-INFORMATION; MAXIMIZATION	Since the visible and infrared images have different imaging mechanisms, the difficulty of image registration has greatly increased. The grayscale difference between visible and infrared images is very disadvantageous for extracting feature points in homogenous region, but they both retain the obvious contour edge in the scene. After using the morphological gradient method, the grayscale edge of visible and infrared images can be obtained and their similarity is greatly improved, and their difference may be seen as the difference in brightness or grayscale. Therefore, we proposed a novel algorithm to realise real-time adaptive registration of visible and infrared images using morphological gradient and C_SIFT. Firstly, the morphological gradient method is used to extract the rough edges of visible and infrared images for aligning their visual features as a single similar type. Secondly, the C_SIFT feature detection operator is used to detect and extract feature points from the extracted edges. The C_SIFT uses the centroid method to describe the main direction of feature points, makes rotation invariance feasible. Finally, to verify the effectiveness of the proposed algorithm, we carried out a series of experiments in eight various scenarios. The experimental results show that the proposed algorithm has achieved good experimental results. The registration of visible and infrared images can be completed quickly by the proposed algorithm, and the registration accuracy is satisfactory.																	1861-8200	1861-8219				OCT	2020	17	5					1103	1115		10.1007/s11554-019-00858-x													
J								Scalable implementation of particle filter-based visual object tracking on network-on-chip (NoC)	JOURNAL OF REAL-TIME IMAGE PROCESSING										Particle filter; Object tracking; FPGA; Network-on-chip (NoC); Real-time image processing; Scalability; Low power; Smart camera		Particle filter algorithms have been successfully used in various visual object tracking applications. They handle non-linear model and non-Gaussian noise, but are computationally demanding. In this paper, we propose a scalable implementation of particle filter algorithm for visual object tracking, using scalable interconnect such as network-on-chip on an FPGA platform. Here, several processing elements execute parallelly to handle large number of particles. We propose two designs and implementations, with one optimized for speed and other optimized for area. These implementations can easily support different image sizes, object sizes, and number of particles, without modifying the complete architecture. Multi-target tracking is also demonstrated for four objects. We validated the particle filter-based visual tracking with video feed from a Petalinux-based system. With image size of320x240\ frame rates of 348 fps and 310 fps were achieved for single-object tracking of size17x17nd33x33pixels, respectively, with a reasonable low-power consumption of 1.7 mW/fps on Zynq XC7Z020 (Zedboard) with an operating frequency of 69 MHz. This makes our implementation a good candidate for low-power, visual object tracking using FPGA, especially in low-power, smart camera applications.																	1861-8200	1861-8219				OCT	2020	17	5					1117	1134		10.1007/s11554-018-0841-5													
