PT	AU	BA	BE	GP	AF	BF	CA	TI	SO	SE	BS	LA	DT	CT	CY	CL	SP	HO	DE	ID	AB	C1	RP	EM	RI	OI	FU	FX	CR	NR	TC	Z9	U1	U2	PU	PI	PA	SN	EI	BN	J9	JI	PD	PY	VL	IS	PN	SU	SI	MA	BP	EP	AR	DI	D2	EA	PG	WC	SC	GA	UT	PM	OA	HC	HP	DA
J								Specializing Context-Free Grammars With a (1+1)-EA	IEEE TRANSACTIONS ON EVOLUTIONARY COMPUTATION										Grammar; Computational modeling; Optimization; Production; Sociology; Statistics; Evolutionary computation; Grammar design; grammatical evolution; run time analysis	EVOLUTION; MODEL	Context-free grammars are useful tools for modeling the solution space of problems that can be solved by optimization algorithms. For a given solution space, there exists an infinite number of grammars defining that space, and there are clues that changing the grammar may impact the effectiveness of the optimization. In this article, we investigate theoretically and experimentally the possibility of specializing a grammar in a problem, that is, of systematically improving the quality of the grammar for the given problem. To this end, we define the quality of a grammar for a problem in terms of the average fitness of the candidate solutions generated using that grammar. Theoretically, we demonstrate the following findings: 1) that a simple mutation operator employed in a (1 + 1)-EA setting can be used to specialize a grammar in a problem without changing the solution space defined by the grammar and 2) that three grammars of equal quality for a grammar-based version of the ONEMAX problem greatly vary in how they can be specialized with that (1 + 1)-EA, as the expected time required to obtain the same improvement in quality can vary exponentially among grammars. Then, experimentally, we validate the theoretical findings and extend them to other problems, grammars, and a more general version of the mutation operator.																	1089-778X	1941-0026				OCT	2020	24	5					960	973		10.1109/TEVC.2020.2983664													
J								Multiobjective Evolution Strategy for Dynamic Multiobjective Optimization	IEEE TRANSACTIONS ON EVOLUTIONARY COMPUTATION										Sociology; Pareto optimization; Convergence; Heuristic algorithms; Magnetic particles; Dynamic multiobjective optimization problem (DMOP); evolution strategy (ES); multiobjective evolutionary algorithm (MOEA); multiobjective optimization problem (MOP)	PREDICTION STRATEGY; GENETIC ALGORITHMS; ENVIRONMENTS; IMMIGRANTS; DIVERSITY; SEARCH; OPTIMA; MODEL	This article presents a novel evolution strategy-based evolutionary algorithm, named DMOES, which can efficiently and effectively solve multiobjective optimization problems in dynamic environments. First, an efficient self-adaptive precision controllable mutation operator is designed for individuals to explore and exploit the decision space. Second, the simulated isotropic magnetic particles niching can guide the individuals to keep uniform distance and extent to approximate the entire Pareto front automatically. Third, the nondominated solutions (NDS) guided immigration can facilitate the population convergence with two different strategies for the NDSs and the dominated solutions, respectively. As a result, our algorithm can track the new approximate Pareto set and approximate Pareto front as quickly as possible when the environment changes. In addition, DMOES can obtain a well-converged and well-diversified Pareto front with much less population size and far lower computational cost. The larger the number of individuals, the sharper the contour of the resulted approximate Pareto front will be. Finally, the proposed algorithm is evaluated by the FDA, dMOP, UDF, and ZJZ test suites. The experimental results have been demonstrated to provide a competitive and oftentimes better performance when compared against some chosen state-of-the-art dynamic multiobjective evolutionary algorithms.																	1089-778X	1941-0026				OCT	2020	24	5					974	988		10.1109/TEVC.2020.2985323													
J								Binarized Neural Architecture Search for Efficient Object Recognition	INTERNATIONAL JOURNAL OF COMPUTER VISION										Neural architecture search (NAS); Binarized network; Object recognition; Edge computing	MULTIARMED BANDIT	Traditional neural architecture search (NAS) has a significant impact in computer vision by automatically designing network architectures for various tasks. In this paper, binarized neural architecture search (BNAS), with a search space of binarized convolutions, is introduced to produce extremely compressed models to reduce huge computational cost on embedded devices for edge computing. The BNAS calculation is more challenging than NAS due to the learning inefficiency caused by optimization requirements and the huge architecture space, and the performance loss when handling the wild data in various computing applications. To address these issues, we introduce operation space reduction and channel sampling into BNAS to significantly reduce the cost of searching. This is accomplished through a performance-based strategy that is robust to wild data, which is further used to abandon less potential operations. Furthermore, we introduce the upper confidence bound to solve 1-bit BNAS. Two optimization methods for binarized neural networks are used to validate the effectiveness of our BNAS. Extensive experiments demonstrate that the proposed BNAS achieves a comparable performance to NAS on both CIFAR and ImageNet databases. An accuracy of 96.53% vs. 97.22% is achieved on the CIFAR-10 dataset, but with a significantly compressed model, and a 40% faster search than the state-of-the-art PC-DARTS. On the wild face recognition task, our binarized models achieve a performance similar to their corresponding full-precision models.																	0920-5691	1573-1405															10.1007/s11263-020-01379-y		OCT 2020											
J								HihO: accelerating artificial intelligence interpretability for medical imaging in IoT applications using hierarchical occlusion Opening the black box	NEURAL COMPUTING & APPLICATIONS										Explainable AI; Artificial intelligence; Deep learning; Internet of Things; Occlusion sensitivity		In the medical imaging domain, nonlinear warping has enabled pixel-by-pixel mapping of one image dataset to a reference dataset. This co-registration of data allows for robust, pixel-wise, statistical maps to be developed in the domain, leading to new insights regarding disease mechanisms. Deep learning technologies have given way to some impressive discoveries. In some applications, deep learning algorithms have surpassed the abilities of human image readers to classify data. As long as endpoints are clearly defined, and the input data volume is large enough, deep learning networks can often converge and reach prediction, classification and segmentation with success rates as high or higher than human operators. However, machine learning and deep learning algorithms are complex. Interpretability is not always a product of the classifications performed. Visualization techniques have been developed to add a layer of interpretability. The work presented here builds on a framework for augmenting statistical findings in medical imaging workflows with machine learning results. Utilizing the framework, visualization techniques for the machine learning portion are compared in an application, and a novel, lightweight technique for machine learning visualization is proposed as a means of increasing the portability of machine learning interpretability to Internet of Things applications. The novel visualization, hierarchical occlusion, can improve time to visualization by three orders of magnitude over a traditional occlusion sensitivity algorithm.																	0941-0643	1433-3058															10.1007/s00521-020-05379-4		OCT 2020											
J								3D Model Retrieval Using Bipartite Graph Matching Based on Attention	NEURAL PROCESSING LETTERS										3D model retrieval; Bipartite graph matching; Attention mechanism	CONVOLUTIONAL NEURAL-NETWORKS; OBJECT RETRIEVAL	In this paper, we propose an attention-based bipartite graph 3D model retrieval algorithm, where many-to-many matching method, the weighted bipartite graph matching, is employed for comparison between two 3D models. Considering the panoramic views can donate the spatial and structural information, in this work, we use panoramic views to represent each 3D model. Attention mechanism is used to generate the weight of all views of each model. And then, we construct a weighted bipartite graph with the views of those models and the weight of each view. According to the bipartite graph, the matching result is used to measure the similarity between two 3D models. We experiment our method on ModelNet, NTU and ETH datasets, and the experimental results and comparison with other methods show the effectiveness of our method.																	1370-4621	1573-773X				OCT	2020	52	2			SI		1043	1055		10.1007/s11063-019-10155-0													
J								H-infinity State Estimation of Static Neural Networks with Mixed Delay	NEURAL PROCESSING LETTERS										Static neural networks; H-infinity state estimation; Leakage time-varying delay; Distributed delay; Linear matrix inequality	STABILITY ANALYSIS; LEAKAGE DELAY; SYNCHRONIZATION; SYSTEMS; STABILIZATION	This paper focuses on studying the H-infinity state estimation of static neural networks with mixed delay in which leakage time-varying delay and distributed delay are taken into account, simultaneously. By constructing several suitable Lyapunov-Krasovskii functionals and linear matrix inequality technique, the delay-independent and delay-dependent criteria are established in order that the error system is globally asymptotically stable with H-infinity performance, respectively. In addition, with the skills to construct Lyapunov-Krasovskii functionals, we obtain the results in which we constitutionally drop the differentiability requirement of transmission delays. Some numerical examples are given to show the effectiveness and advantages of the obtained results.																	1370-4621	1573-773X				OCT	2020	52	2			SI		1069	1087		10.1007/s11063-019-10171-0													
J								Improving Alzheimer's disease classification by performing data fusion with vascular dementia and stroke data	JOURNAL OF EXPERIMENTAL & THEORETICAL ARTIFICIAL INTELLIGENCE										Data fusion; machine learning; Alzheimer's disease; vascular dementia; stroke	MILD COGNITIVE IMPAIRMENT; FEATURE REPRESENTATION; EARLY-DIAGNOSIS; PREDICTION; STATE; BIOMARKERS; CRITERIA; RELIEFF	Improvement of prediction accuracy and early detection of the Alzheimer's disease is becoming increasingly important for managing its impact on lives of affected patients. Many machine learning approaches have been applied to support the diagnosis and prediction of this illness. In this paper we propose an approach for improving the Alzheimer's disease classification accuracy by using data fusion of several independent clinical datasets. Data fusion was performed twofold: 1) by enriching attributes of the base dataset with the attributes of the secondary dataset and 2) by enriching the examples set of the base dataset with the examples of the secondary dataset. In both cases the missing values (for newly added attributes and/or examples) were predicted by using linear regression for numeric and naive Bayes classifier for nominal attributes. We experimented on three data sources: on a dataset of Alzheimer's disease-impaired patients, on a dataset of patients with vascular dementia, and on a dataset of patients who have been affected by a stroke. We fused these datasets with different data fusion approaches and analysed the improvement in classification accuracy as well as the quality of the fused attributes. The experiments indicated that we obtained an increase of classification accuracy on the fused dataset compared with the accuracy obtained from individual dataset.																	0952-813X	1362-3079															10.1080/0952813X.2020.1818290		OCT 2020											
J								Exploiting Implicit Influence From Information Propagation for Social Recommendation	IEEE TRANSACTIONS ON CYBERNETICS										Recommender systems; Social networking (online); Matrix decomposition; Information technology; Australia; Cybernetics; Information systems; Computational intelligence; implicit user influence; information propagation; recommender systems; social networks	MATRIX FACTORIZATION; TRUST; NETWORK	Social recommender systems have attracted a lot of attention from academia and industry. On social media, users' ratings and reviews can be observed by all users, and have implicit influence on their future ratings. When these users make subsequent decisions about an item, they may be affected by existing ratings on the item. Thus, implicit influence propagates among the users who rated the same items, and it has significant impact on users' ratings. However, implicit influence propagation and its effect on recommendation rarely have been studied. In this article, we propose an information propagation-based social recommendation method (SoInp) and model the implicit user influence from the perspective of information propagation. The implicit influence is inferred from ratings on the same items. We investigate the concrete effect of implicit user influence in the propagation process and introduce it into recommender systems. Furthermore, we incorporate the implicit user influence and explicit trust information in the matrix factorization framework. To demonstrate the performance, we conduct comprehensive experiments on real-world datasets to compare the proposed method with the state-of-the-art models. The results indicate that SoInp makes notable improvements in rating prediction.																	2168-2267	2168-2275				OCT	2020	50	10					4186	4199		10.1109/TCYB.2019.2939390													
J								Quasi-Synchronization of Heterogeneous Networks With a Generalized Markovian Topology and Event-Triggered Communication	IEEE TRANSACTIONS ON CYBERNETICS										Switches; Synchronization; Heterogeneous networks; Network topology; Topology; Couplings; Stochastic processes; Event-triggered control; generalized Markovian topology; heterogeneous network; quasi-synchronization	DYNAMICAL NETWORKS; PINNING CONTROL; COMPLEX NETWORKS; BOUNDED SYNCHRONIZATION; OUTPUT SYNCHRONIZATION; MULTIAGENT SYSTEMS; NONIDENTICAL NODES; DIRECTED NETWORKS; NEURAL-NETWORKS; CONSENSUS	We consider the quasi-synchronization problem of a continuous time generalized Markovian switching heterogeneous network with time-varying connectivity, using pinned nodes that are event-triggered to reduce the frequency of controller updates and internode communications. We propose a pinning strategy algorithm to determine how many and which nodes should be pinned in the network. Based on the assumption that a network has limited control efficiency, we derive a criterion for stability, which relates the pinning feedback gains, the coupling strength, and the inner coupling matrix. By utilizing the stochastic Lyapunov stability analysis, we obtain sufficient conditions for exponential quasi-synchronization under our stochastic event-triggering mechanism, and a bound for the quasi-synchronization error. Numerical simulations are conducted to verify the effectiveness of the proposed control strategy.																	2168-2267	2168-2275				OCT	2020	50	10					4200	4213		10.1109/TCYB.2019.2891536													
J								Differentially Private Malicious Agent Avoidance in Multiagent Advising Learning	IEEE TRANSACTIONS ON CYBERNETICS										Privacy; Differential privacy; Base stations; Reinforcement learning; Multi-agent systems; Buildings; Routing; Agent advising; differential privacy; multiagent reinforcement learning (MARL)		Agent advising is one of the key approaches to improve agent learning performance by enabling agents to ask for advice between each other. Existing agent advising approaches have two limitations. The first limitation is that all the agents in a system are assumed to be friendly and cooperative. However, in the real world, malicious agents may exist and provide false advice to hinder the learning performance of other agents. The second limitation is that the analysis of communication overhead in these approaches is either overlooked or simplified. However, in communication-constrained environments, communication overhead has to be carefully considered. To overcome the two limitations, this paper proposes a novel differentially private agent advising approach. Our approach employs the Laplace mechanism to add noise on the rewards used by student agents to select teacher agents. By using the differential privacy technique, the proposed approach can reduce the impact of malicious agents without identifying them. Also, by adopting the privacy budget concept, the proposed approach can naturally control communication overhead. The experimental results demonstrate the effectiveness of the proposed approach.																	2168-2267	2168-2275				OCT	2020	50	10					4214	4227		10.1109/TCYB.2019.2906574													
J								A Bilevel Optimization Approach for Joint Offloading Decision and Resource Allocation in Cooperative Mobile Edge Computing	IEEE TRANSACTIONS ON CYBERNETICS										Task analysis; Servers; Resource management; Optimization; Delays; Mobile handsets; Interference; Ant colony system (ACS); bilevel optimization; computation resource allocation; mobile edge computing (MEC); offloading decision	ANT COLONY OPTIMIZATION; COMPUTATION	This paper studies a multiuser cooperative mobile edge computing offloading (called CoMECO) system in a multiuser interference environment, in which delay-sensitive tasks may be executed on local devices, cooperative devices, or the primary MEC server. In this system, we jointly optimize the offloading decision and computation resource allocation for minimizing the total energy consumption of all mobile users under the delay constraint. If this problem is solved directly, the offloading decision and computation resource allocation are generally generated separately at the same time. Note, however, that they are closely coupled. Therefore, under this condition, their dependency is not well considered, thus leading to poor performance. We transform this problem into a bilevel optimization problem, in which the offloading decision is generated in the upper level, and then the optimal allocation of computation resources is obtained in the lower level based on the given offloading decision. In this way, the dependency between the offloading decision and computation resource allocation can be fully taken into account. Subsequently, a bilevel optimization approach, called BiJOR, is proposed. In BiJOR, candidate modes are first pruned to reduce the number of infeasible offloading decisions. Afterward, the upper-level optimization problem is solved by ant colony system (ACS). Furthermore, a sorting strategy is incorporated into ACS to construct feasible offloading decisions with a higher probability and a local search operator is designed in ACS to accelerate the convergence. For the lower-level optimization problem, it is solved by the monotonic optimization method. In addition, BiJOR is extended to deal with a complex scenario with the channel selection. Extensive experiments are carried out to investigate the performance of BiJOR on two sets of instances with up to 400 mobile users. The experimental results demonstrate the effectiveness of BiJOR and the superiority of the CoMECO system.																	2168-2267	2168-2275				OCT	2020	50	10					4228	4241		10.1109/TCYB.2019.2916728													
J								Toward Flotation Process Operation-State Identification via Statistical Modeling of Biologically Inspired Gabor Filtering Responses	IEEE TRANSACTIONS ON CYBERNETICS										Biological system modeling; Transforms; Monitoring; Image segmentation; Image color analysis; Surface morphology; Biologically inspired Gabor wavelets (BIGWs); froth image; gamma distribution (Gamma D); Gaussian scale mixture model (GSMM); Laplace distribution (LD); local spline regression (LSR) classifier; operation-state monitoring	SPATIAL-FREQUENCY; IMAGE-ANALYSIS; CLASSIFICATION; RECOGNITION; LEVEL	This paper presents a froth image statistical modeling-based online flotation process operation-state identification method by introducing a biologically inspired Gabor wavelet transform in accordance with the physiological findings in the biological vision system. It derived the latent probabilistic density models of these biologically inspired Gabor filtering responses (GFRs) based on a versatile intermediate probability modeling frame, Gaussian scale mixture model. It has demonstrated that both the real and the imaginary representation of GFR obey a Laplace distribution. Accordingly, the amplitude representation of GFR obeys a Gamma distribution. Whereas the phase representation of GFR is an important yet frequently ignored aspect in Gabor-based signal analysis; it is demonstrated to be a periodic distribution and can be expressed by a von Mises-like distribution model. Successively, a local spline regression (LSR)-based classifier that the maps scattered statistical feature points of froth images directly to the operation-state labels smoothly is introduced for the operation-state recognition. Extensive confirmatory and comparative experiments on an industrial-scale bauxite flotation process demonstrate the effectiveness and superiority of the proposed method. Performance effects on different parameter settings, e.g., parameters of Gabor kernel and dimensionalities of multivariate statistical models, are further discussed.																	2168-2267	2168-2275				OCT	2020	50	10					4242	4255		10.1109/TCYB.2019.2909763													
J								Real-World ISAR Object Recognition Using Deep Multimodal Relation Learning	IEEE TRANSACTIONS ON CYBERNETICS										Convolution; Object recognition; Kernel; Image resolution; Feature extraction; Cybernetics; Convolutional neural networks; Attribute learning; deep learning; deformable; image matching; object recognition; radar; real-world environment; relation learning; statistic	NETWORKS	Real-world inverse synthetic aperture radar (ISAR) object recognition is a critical and challenging problem in computer vision tasks. In this article, an efficient real-world ISAR object recognition method is proposed, namely, real-world ISAR object recognition (RIOR), based on deep multimodal relation learning (DMRL). It cannot only handle the complex multimodal recognition problem efficiently but also exploit the relations among the features, attributes, labels, and classes with semantic knowledge: 1) an adaptive multimodal mechanism (AMM) is proposed in convolutional neural network (CNN) to substantially promote the CNN sampling and transformation capability and significantly raise the output feature map resolutions by keeping almost all of the information; 2) deep attribute relation graph learning (DARGL) is proposed to jointly estimate the large numbers of heterogeneous attributes and collaboratively explore the relations among the features, attributes, labels, and classes with common knowledge graphs; and 3) relational-regularized convolutional sparse learning (RCSL) is proposed to further achieve good translation invariance and improve the accuracy and speed of the entire system. Extensive qualitative and quantitative experiments are performed on two real-world ISAR datasets, demonstrating that RIOR outperforms the state-of-the-art methods while running quickly.																	2168-2267	2168-2275				OCT	2020	50	10					4256	4267		10.1109/TCYB.2019.2933224													
J								Bridging User Interest to Item Content for Recommender Systems: An Optimization Model	IEEE TRANSACTIONS ON CYBERNETICS										Feature extraction; Optimization; Sparse matrices; Motion pictures; Recommender systems; Estimation; Social networking (online); Content based; optimization; recommendation; relation learning; user preference		Recommender systems are currently utilized widely in e-commerce for product recommendations and within content delivery platforms. Previous studies usually use independent features to represent item content. As a result, the relationship hidden among the content features is overlooked. In fact, the reason that an item attracts a user may be attributed to only a few set of features. In addition, these features are often semantically coupled. In this paper, we present an optimization model for extracting the relationship hidden in content features by considering user preferences. The learned feature relationship matrix is then applied to address the cold-start recommendations and content-based recommendations. It could also easily be employed for the visualization of feature relation graphs. Our proposed method was examined on three public datasets: 1) hetrec-movielens-2k-v2; 2) book-crossing; and 3) Netflix. The experimental results demonstrated the effectiveness of our method in comparison to the state-of-the-art recommendation methods.																	2168-2267	2168-2275				OCT	2020	50	10					4268	4280		10.1109/TCYB.2019.2900159													
