PT	AU	BA	BE	GP	AF	BF	CA	TI	SO	SE	BS	LA	DT	CT	CY	CL	SP	HO	DE	ID	AB	C1	RP	EM	RI	OI	FU	FX	CR	NR	TC	Z9	U1	U2	PU	PI	PA	SN	EI	BN	J9	JI	PD	PY	VL	IS	PN	SU	SI	MA	BP	EP	AR	DI	D2	EA	PG	WC	SC	GA	UT	PM	OA	HC	HP	DA
J								Collective navigation of a multi-robot system in an unknown environment	ROBOTICS AND AUTONOMOUS SYSTEMS										Swarm intelligence; Cooperative control; Autonomous systems; Collective navigation	OBSTACLE AVOIDANCE; ALGORITHMS; FLOCKING	The navigation of autonomous, mobile multi-robot systems in changing environments is a challenging problem investigated over the past years. Cooperative, multiple robots are employed for many different tasks to increase the efficiency and success of a mission. However, many of the existing collective path planning approaches do not guarantee a reliable escape in environments with complex, non-convex obstacles without any prior knowledge. In this study, we developed a navigation framework for multi-robot systems in unknown areas that solely exploit the sensing information and shared data among the agents. The key contribution of this paper is the simultaneous, collision-free motion planning for fully autonomous robots in a collective manner. Furthermore, our communication architecture enables the robots to find an appropriate path to a desired, joint target position, despite the limited sensing and communication range. (C) 2020 Elsevier B.V. All rights reserved.																	0921-8890	1872-793X				OCT	2020	132								103604	10.1016/j.robot.2020.103604													
J								A novel path planning methodology for automated valet parking based on directional graph search and geometry curve	ROBOTICS AND AUTONOMOUS SYSTEMS										AVP; Path planning; Path coordination; Directional graph search; Geometry curve	CURVATURE	The paper presents a novel path planning methodology based on the directional graph search and the geometry curve for the Automated Valet Parking (AVP) system. The whole path planning methodology is divided into three parts including the global path planning, the path coordination strategy and the parking path planning. Firstly, the global path planning is triggered to find a path from the parking slot entrance to the rough location of the assigned parking spot. A novel directional Hybrid A* algorithm is proposed to generate the global path efficiently without redundant searches, such as the dead end. Afterwards, the path coordination strategy gives a transitional path to connect the end node of the global path to the parking planning start node. The transitional path is composed of geometry curves including arcs and line segments based on the optimal parking start node. Finally, the parking path planning generates a parking path to guide the vehicle from parking start node to the parking space. A modified C-type vertical parking path planning algorithm is utilized to generate the parking path, offering flexibility for choosing the parking start node. Simulation results based on Matlab and PreScan show that it takes less time for the proposed path planning algorithm to generate a feasible path for the AVP system compared with the general planning algorithm. The novel AVP path planning algorithm also has the potential for practical use. (C) 2020 Elsevier B.V. All rights reserved.																	0921-8890	1872-793X				OCT	2020	132								103606	10.1016/j.robot.2020.103606													
J								Estimation of body direction based on gait for service robot applications	ROBOTICS AND AUTONOMOUS SYSTEMS										Service robots; Human-robot interaction; Pedestrian tracking; Kalman filter; Laser range sensor	WALKING; TRACKING; HEAD	Recently, there have been several studies on the research and development of service robots, such as reception or waiter robots for facilities and companion robots for support of baggage transportation or guidance in public spaces. Several experimental results in real environments have been reported. To realize socially acceptable human-robot interaction for service robots, human recognition, including not only position but also body direction, around the robot is important. Using an RGB-D camera, it is possible to detect the posture of a person. However, because the viewing angle of the camera is narrow, it is difficult to recognize the environment around the robot with a single device. This study proposes the estimation of the body direction based on the gait, that is, not only the position and velocity, but also the state of the legs (stance or swing phase), using laser range sensors installed at shin height. We verify the effectiveness of the proposed method for several patterns of movement, which are seen when a person interacts with the service robot and evaluate measurement accuracy. (C) 2020 Elsevier B.V. All rights reserved.																	0921-8890	1872-793X				OCT	2020	132								103603	10.1016/j.robot.2020.103603													
J								A Robust Stereo Feature-aided Semi-direct SLAM System	ROBOTICS AND AUTONOMOUS SYSTEMS										Visual SLAM; Hybrid method; Image brightness rectification	VISUAL ODOMETRY	In autonomous driving, many intelligent perception technologies have been put in use. However, visual SLAM still has problems with robustness, which limits its application, although it has been developed for a long time. We propose a feature-aided semi-direct approach to combine the direct and indirect methods in visual SLAM to allow robust localization under various situations, including large-baseline motion, textureless environment, and great illumination changes. In our approach, we first calculate inter-frame pose estimation by feature matching. Then we use the direct alignment and a multi-scale pyramid, which employs the previous coarse estimation as a priori, to obtain a more precise result. To get more accurate photometric parameters, we combine the online photometric calibration method with visual odometry. Furthermore, we replace the Shi-Tomasi corner with the ORB feature, which is more robust to illumination. For extreme brightness change, we employ the dark channel prior to weaken the halation and maintain the consistency of the image. To evaluate our approach, we build a full stereo visual SLAM system. Experiments on the publicly available dataset and our mobile robot dataset indicate that our approach improves the accuracy and robustness of the SLAM system. (C) 2020 Elsevier B.V. All rights reserved.																	0921-8890	1872-793X				OCT	2020	132								103597	10.1016/j.robot.2020.103597													
J								A novel odor source localization system based on particle filtering and information entropy	ROBOTICS AND AUTONOMOUS SYSTEMS										Source localization; Particle filtering; Information entropy; Pseudo source filtering; Artificial potential field	SOURCE-TERM ESTIMATION; SOURCE DECLARATION; STRATEGY	So far, gas leakage caused by natural or human factors has led to serious consequences in terms of social security. Previous strategies for locating the odor sources appear to be either defective or incomplete. For enhancing the success rate and rapidity, this paper aims to present a novel and complete strategy in search of lurking gas sources. Particle filtering and information entropy are both employed to track the plume information. To improve the tracking efficiency in this process, a novel objective function is designed by considering the entropy gains of the suspected targets as well as the repeated exploration scores. Considering the pseudo sourced caused by obstacles, a statistics-based source determine algorithm is proposed to confirm the source's authenticity, while the artificial potential field method is subsequently applied to eliminate the distractions introduced by the pseudo sources. Simulations and on-site tests are both carried out while results showed that the proposed scheme is competent to complete sources localization task in the scene that contains randomly distributed obstacles and pseudo source. (C) 2020 Elsevier B.V. All rights reserved.																	0921-8890	1872-793X				OCT	2020	132								103619	10.1016/j.robot.2020.103619													
J								Optimization of Correlated and Conflicting Responses of ECM Process Using Flower Pollination Algorithm	INTERNATIONAL JOURNAL OF APPLIED METAHEURISTIC COMPUTING										Electrochemical Machining; Flower Pollination Algorithm; Metaheuristic Algorithm; Optimization	PROCESS PARAMETERS; MULTIOBJECTIVE OPTIMIZATION; MODELS	The electrochemical machining (ECM) process has been investigated in this article to achieve the desired process performances by optimizing the machining parameters using the flower pollination algorithm (FPA). Two major process performances namely: material removal rate (MRR) and surface roughness (Ra), which are correlated and conflicting in nature, are optimized with respect to the key process parameters. The regression equations developed by using experimental data are used as objective functions in the flower pollination algorithm. Objectives are set to find the optimal set of process parameters to fulfil a single objective as well as multiple objectives. The performance of the algorithm is checked in terms of accuracy, convergence speed, number of optimized populations, and computational time. The mean values of functional evaluations for MRR and Ra obtained are close to their respective optimal results, which ensures the quality of the convergence. It is further seen that FPA can predict the true overall parametric trends as it does not require keeping any parameter as constant during the analysis.																	1947-8283	1947-8291				OCT-DEC	2020	11	4					1	15		10.4018/IJAMC.2020100101													
J								An Overview of Mutation Strategies in Particle Swarm Optimization	INTERNATIONAL JOURNAL OF APPLIED METAHEURISTIC COMPUTING										Local Minima; Optimization; Premature Convergence	ALGORITHM; SEARCH	The Particle swarm optimization (PSO) algorithm is a population-based intelligent stochastic search technique encouraged from the intrinsic manner of bee swarm seeking for their food source. With flexibility for numerical experimentation, the PSO algorithm has been mostly used to resolve diverse kind of optimization problems. The PSO algorithm is frequently captured in local optima meanwhile handling the complex real-world problems. Many authors improved the standard PSO algorithm with different mutation strategies but an exhausted comprehensive overview about mutation strategies is still lacking. This article aims to furnish a concise and comprehensive study of problems and challenges that prevent the performance of the PSO algorithm. It has tried to provide guidelines for the researchers who are active in the area of the PSO algorithm and its mutation strategies. The objective of this study is divided into two sections: primarily to display the improvement of the PSO algorithm with mutation strategies that may enhance the performance of the standard PSO algorithm to great extent and secondly, to motivate researchers and developers to use the PSO algorithm to solve the complex real-world problems. This study presents a comprehensive survey of the various PSO algorithms based on mutation strategies. It is anticipated that this survey would be helpful to study the PSO algorithm in detail for researchers.																	1947-8283	1947-8291				OCT-DEC	2020	11	4					16	37		10.4018/IJAMC.2020100102													
J								Short Term Hydro-Thermal Scheduling Using Backtracking Search Algorithm	INTERNATIONAL JOURNAL OF APPLIED METAHEURISTIC COMPUTING										Backtracking Search Algorithm; Cascaded Reservoir; Evolutionary Programming; Hydrothermal Scheduling; Particle Swarm Optimization; Simulated Annealing; Valve Point Loading Effect	PARTICLE SWARM OPTIMIZATION; CODED GENETIC ALGORITHM; DIFFERENTIAL EVOLUTION; SYSTEMS	In this article, a new optimization technique, the backtracking search algorithm (BSA), is proposed to solve the hydrothermal scheduling problem. The BSA has mainly unique five steps: (i) Initialization; (ii) Selection - I; (iii) Mutation; (iv) Crossover; and (v) Selection - II; which have been applied to minimize fuel cost of the hydro-thermal scheduling problem. The BSA is very fast, robust, reliable optimization technique and gives an accurate, optimized result. Mutation and crossover are very effective steps of the BSA, which help to determine the better optimum value of the objective function. Here, four hydro and three thermal power generating units are considered. Performance of each committed generating units (hydro and thermal) are also analyzed using a new proposed algorithm, the BSA. A multi-reservoir cascaded hydroelectric with a nonlinear relationship between water discharge rate and power generation is considered. The valve point loading effect is also considered with a fuel cost function. The proposed optimum fuel cost obtained from the BSA shows the better result as compared to other techniques like particle swarm optimization (PSO), teaching learning-based optimization (TLBO), quasi-oppositional teaching learning-based optimization (QOTLBO), real-coded genetic algorithm (RCGA), mixed-integer linear programming (MILP) and krill herd algorithm (KHA), etc.																	1947-8283	1947-8291				OCT-DEC	2020	11	4					38	63		10.4018/IJAMC.2020100103													
J								Elephant Herding Optimization for Multi-Level Image Thresholding	INTERNATIONAL JOURNAL OF APPLIED METAHEURISTIC COMPUTING										Elephant Herding Optimization; Entropy; Image Segmentation; Multi-Level Thresholding; Nature Inspired Optimization	ALGORITHM; SEGMENTATION; ENTROPY	Multilevel thresholding plays a significant role in the arena of image segmentation. The main issue of multilevel image thresholding is to select the optimal combination of threshold value at different level. However, this problem has become challenging with the higher number of levels, because computational complexity is increased exponentially as the increase of number of threshold. To address this problem, this paper has proposed elephant herding optimization (EHO) based multilevel image thresholding technique for image segmentation. The EHO method has been inspired by the herding behaviour of elephant group in nature. Two well-known objective functions such as 'Kapur's entropy' and 'between-class variance method' have been used to determine the optimized threshold values for segmentation of different objects from an image. The performance of the proposed algorithm has been verified using a set of different test images taken from a well-known benchmark dataset named Berkeley Segmentation Dataset (BSDS). For comparative analysis, the results have been compared with three popular algorithms, e.g. cuckoo search (CS), artificial bee colony (ABC) and particle swarm optimization (PSO). It has been observed that the performance of the proposed EHO based image segmentation technique is efficient and promising with respect to the others in terms of the values of optimized thresholds, objective functions, peak signal-to-noise ratio (PSNR), structure similarity index (SSIM) and feature similarity index (FSIM). The algorithm also shows better convergence profile than the other methods discussed.																	1947-8283	1947-8291				OCT-DEC	2020	11	4					64	90		10.4018/IJAMC.2020100104													
J								A New Multi-Objective Firework Algorithm to Solve the Multimodal Planning Network Problem	INTERNATIONAL JOURNAL OF APPLIED METAHEURISTIC COMPUTING										Explosion Amplitude; Explosion Sparks; Firework Algorithm; Guiding Sparks; Multimodal Transport; Multi-Objective Optimization; Network Planning; Pareto-Dominance		This article introduces a new approach called multi-objective firework algorithm (MFWA). The proposed approach allows for solving the multimodal transportation network problem (MTNP). The main goal is to develop a decision system that optimizes and determines the planning network of the multimodal transportation (PNMT) problem. The optimization involves reaching the efficient transport mode and multimodal path, in order to move from one country to another while satisfying the set of objectives. Moreover, the firework algorithm has distinct advantages in solving complex optimization problems and in obtaining a solution by a distributed and oriented research system. This approach presents a search way, which is different from the swarm intelligence-based stochastic search technique. For each firework, the process starts by exploding a firework in the sky. The search space is filled with a shower of sparks to get diversity solutions. This new approach proves their efficacy in solving the multi-objective problem, which is shown by the experimental results.																	1947-8283	1947-8291				OCT-DEC	2020	11	4					91	113		10.4018/IJAMC.2020100105													
J								A Novel Multi-Objective Competitive Swarm Optimization Algorithm	INTERNATIONAL JOURNAL OF APPLIED METAHEURISTIC COMPUTING										Competitive Swarm Optimizer; Evolutionary Algorithms; Multi-Objective Optimization; Non-Dominating Sorting; Pareto Front; Particle Swarm Optimization; Particle Swarm Optimizer; Swarm Intelligence	EVOLUTIONARY ALGORITHMS	In this article, a new algorithm, namely the multi-objective competitive swarm optimizer (MOCSO), is introduced to handle multi-objective problems. The algorithm has been principally motivated from the competitive swarm optimizer (CSO) and the NSGA-II algorithm. In MOCSO, a pair wise competitive scenario is presented to achieve the dominance relationship between two particles in the population. In each pair wise competition, the particle that dominates the other particle is considered the winner and the other is consigned as the loser. The loser particles learn from the respective winner particles in each individual competition. The inspired CSO algorithm does not use any memory to remember the global best or personal best particles, hence, MOCSO does not need any external archive to store elite particles. The experimental results and statistical tests confirm the superiority of MOCSO over several state-of-the-art multi-objective algorithms in solving benchmark problems.																	1947-8283	1947-8291				OCT-DEC	2020	11	4					114	129		10.4018/IJAMC.2020100106													
J								Three-Step Metaheuristic for the Multiple Objective Multiple Traveling Salesmen Problem	INTERNATIONAL JOURNAL OF APPLIED METAHEURISTIC COMPUTING										Center of Mass; Metaheuristic; Multiple Objective; Multiple Salesmen; Neighborhood Search; TSP Solver	GENETIC ALGORITHM	In this article, the multiple objective multiple Traveling Salesman Problem is considered. m salesmen have to visit n cities to perform some tasks each taking a given processing time. Two objectives are considered: balance the working loads of different salesmen and minimize their total traveled distance. To solve this NP-hard problem, a 3-phase metaheuristic was developed. In the first 2 phases, the principle of center of mass and a neighborhood search technique are used to assign the n cities to the m salesmen. In the third phase, a TSP solver was used to generate an optimal tour to every salesman using its assigned cities in phase 2. The metaheuristic was tested using TSP benchmarks of different sizes. The obtained results showed almost optimal load balancing for all tested instances and optimal tours in term of total traveled distances. A conducted comparison study showed that the proposed metaheuristic outperforms a recently published clustering algorithm for the workload objective.																	1947-8283	1947-8291				OCT-DEC	2020	11	4					130	148		10.4018/IJAMC.2020100107													
J								Advanced Applications on Bilingual Document Analysis and Processing Systems	INTERNATIONAL JOURNAL OF APPLIED METAHEURISTIC COMPUTING										BDAPS; BE-HDCS; Bilingual Documents; Configuration Modes; Document Category; Document Classification; English-Hindi Pair; Image Analysis; Natural Language Processing	HINDI; HANDWRITTEN; RECOGNITION; MACHINE; BANGLA; FUZZY; IDENTIFICATION; ENGLISH; TEXTS; MODEL	Today, rapid digitization requires efficient bilingual non-image and image document classification systems. Although many bilingual NLP and image-based systems provide solutions for real-world problems, they primarily focus on text extraction, identification, and recognition tasks with limited document types. This article discusses a journey of these systems and provides an overview of their methods, feature extraction techniques, document sets, classifiers, and accuracy for English-Hindi and other language pairs. The gaps found lead toward the idea of a generic and integrated bilingual English-Hindi document classification system, which classifies heterogeneous documents using a dual class feeder and two character corpora. Its non-image and image modules include pre- and post-processing stages and pre-and post-segmentation stages to classify documents into predefined classes. This article discusses many real-life applications on societal and commercial issues. The analytical results show important findings of existing and proposed systems.C																	1947-8283	1947-8291				OCT-DEC	2020	11	4					149	193		10.4018/IJAMC.2020100108													
J								State Estimation of Power Using the Whale Optimization Algorithm	INTERNATIONAL JOURNAL OF APPLIED METAHEURISTIC COMPUTING										Biogeography-Based Optimization; Evolutionary Programming; State Estimation; Steady State Power; Weighted Least Squares State Estimation; Whale Optimization Algorithm	SYSTEM	In power systems, the process of attaining a better prediction from a set of variables from state variables is called state estimation (SE). These variables consist of magnitudes of bus voltage and the corresponding angles of all the buses. Because of the non-linearity and intricacy of ever-developing power systems, it has become important to apply upgraded techniques for the dissolution and supervision in practical environments. The discussed analysis evaluates the appositeness of a new metaheuristic technique called the whale optimization algorithm (WOA) which is a population-based algorithm, to reduce the measurement errors so as to gauge the optimal point of the power system when some susceptible values are inadequate. WOA displays admirable attainment in global optimization. It employs a bubble-net hunting approach and it mimics the social behaviour of humpback whales to get the best candidate solution. The approach is tested on IEEE-14, IEEE-30, and IEEE-57 bus test systems and the potency is validated by comparison with the biogeography based optimization algorithm (BBO).																	1947-8283	1947-8291				OCT-DEC	2020	11	4					194	213		10.4018/IJAMC.2020100109													
J								Hybrid Cuckoo Search Approach for Course Time-Table Generation Problem	INTERNATIONAL JOURNAL OF APPLIED METAHEURISTIC COMPUTING										ANOVA; Combinatorial Optimization; Constraint Satisfaction Problem; Course Timetable; Cuckoo Search; Global Search; Hill Climbing; Local Search	ALGORITHM	Course time-table generation (CTTG) is a combinatorial optimization problem which largely fits into the family of scheduling problems. It attempts to schedule a number of subjects to particular time slots in an order to satisfy multiple numbers of constraints. A solution of CTTG generates a weekly schedule for each course satisfying several constraints regarding the order of classes, preference of teachers, and other institutional constraints. Automated generation of the course timetable is a problem of optimization that requires satisfying maximum constraints and can be solved with a search-based optimization technique. This article proposes a novel hybrid Cuckoo search approach for solving the Course Time-Table Generation (CTTG) problem for high schools affiliated to the West Bengal Board of Secondary Education (WBBSE), India. The authors investigate the performance of local search Hill climbing against the population-based basic Cuckoo search algorithm on the problem. Thereafter they propose a hybrid Cuckoo search technique that improves the performance significantly showed by ANOVA.																	1947-8283	1947-8291				OCT-DEC	2020	11	4					214	230		10.4018/IJAMC.2020100110													
