PT	AU	BA	BE	GP	AF	BF	CA	TI	SO	SE	BS	LA	DT	CT	CY	CL	SP	HO	DE	ID	AB	C1	RP	EM	RI	OI	FU	FX	CR	NR	TC	Z9	U1	U2	PU	PI	PA	SN	EI	BN	J9	JI	PD	PY	VL	IS	PN	SU	SI	MA	BP	EP	AR	DI	D2	EA	PG	WC	SC	GA	UT	PM	OA	HC	HP	DA
J								A decision making model based on the leading principal submatrices of a reciprocal preference relation	APPLIED SOFT COMPUTING										Decision making; Leading principal submatrix (LPSM); Particle swarm optimization (PSO); Consistency; Analytic hierarchy process (AHP)	IMPROVING CONSISTENCY; COMPARISON MATRIX; PAIRWISE; CONSENSUS; INFORMATION; AHP; ALGORITHMS; ALLOCATION; JUDGMENTS; PSO	A completed comparison matrix is the basic tool in the analytic hierarchy process (AHP). In practice, the process of forming a comparison matrix is complex and it is worth being investigated carefully. In this study, by decomposing pairwise comparison process of alternatives, the leading principal submatrices (LPSMs) of a completed comparison matrix are used as the basis for decision analysis. Based on the particle swarm optimization (PSO), a novel method for improving consistency of inconsistent comparison matrices is proposed. The fitness function is constructed by considering the acceptable consistency of pairwise comparison matrices and the similarity degree between the initial and the adjusted decision-making information. A new algorithm is elaborated on for solving a decision making problem with multiplicative reciprocal matrices. Numerical results are reported to show the advantages of the proposed model by comparing with the other methods. The observations reveal that the proposed method and algorithm are effective when dealing with inconsistent comparison matrices and the corresponding decision making problems. (C) 2020 Elsevier B.V. All rights reserved.																	1568-4946	1872-9681				SEP	2020	94								106448	10.1016/j.asoc.2020.106448													
J								Retinal vessel segmentation using multifractal characterization	APPLIED SOFT COMPUTING										Multifractal; Holder exponent; Fundus; Retinal vessel segmentation; Gabor wavelet; Morphological reconstruction	NEURAL-NETWORKS; BLOOD-VESSELS; MATCHED-FILTER; IMAGES; MODEL; VASCULATURE; RETINOPATHY; ALGORITHM; LEVEL	This study presents a supervised classification method for the segmentation of retinal vessels using fundus images. This work proposes a novel retinal vasculature segmentation method based on multifractal characterization of the vessels to minimize the noise and enhance the vessels during segmentation. The Holder exponent, a multifractal measure is employed for the first time to segment the retinal vessels. The Holder exponent is used to quantify the local regularity of the vessels. The Holder exponents are computed from the Gabor wavelet responses for the effective segmentation of vessels, which is a novel feature of the method. The Gaussian mixture model (GMM) classifier is used for the classification of pixels. Different multifractal measures used to compute the Holder exponents are evaluated for the output quality. The effectiveness of the method is evaluated using three publicly available datasets for fundus images namely, DRIVE, STARE and CHASE_DB1. The proposed method provides robust segmentation of retinal vessels for both normal and abnormal images (i.e., images with pathologies) at a reasonable segmentation speed and the method is also simple to configure. It achieves an average accuracy and area under the receiver operating characteristic curve of 0.948 and 0.959 respectively on the DRIVE dataset; 0.9542 and 0.9711 respectively on the STARE dataset; 0.9459 and 0.9592 respectively on the CHASE_DB1 dataset; 0.9500 and 0.9623 respectively on the abnormal images. (C) 2020 Elsevier B.V. All rights reserved.																	1568-4946	1872-9681				SEP	2020	94								106439	10.1016/j.asoc.2020.106439													
J								An extended Pythagorean fuzzy complex proportional assessment approach with new entropy and score function: Application in pharmacological therapy selection for type 2 diabetes	APPLIED SOFT COMPUTING										Pythagorean Fuzzy Sets; Type 2 Diabetes; Entropy measure; Score function; Pharmacological therapy selection; COPRAS	GROUP DECISION-MAKING; AGGREGATION OPERATORS; SIMILARITY MEASURES; SUPPLIER SELECTION; EINSTEIN OPERATIONS; MEMBERSHIP GRADES; ACCURACY FUNCTION; DISTANCE MEASURE; EXPERT-SYSTEM; SETS	In the context of medical decision making, the Type 2 Diabetes (T2D) pharmacological therapy selection problem involves several medications that can be stipulated to manage the blood glucose level of patients. The extensive range of hyperglycemia lowering agents with varying outcomes and several side effects makes the decision quite complicated and uncertain. Pythagorean Fuzzy Sets (PFSs) are proven as one of the valuable tools to handle ambiguous and ill-defined problems. This paper introduces an innovative Complex Proportional Assessment (COPRAS) to solve the T2D medication selection problem under the Pythagorean fuzzy environment. In this methodology, a new formula based on entropy measure and score function is introduced to evaluate the unknown criteria weights. To doing so, the new entropy measure and score function are developed under the PFSs context. Further, an illustrative case study of the T2D pharmacological therapy selection problem is taken to express the feasibility and usefulness of the proposed method in real-world decision-making problems. Finally, the obtained result is compared with some existing methods, which confirms the strength and stability of the proposed COPRAS method. (C) 2020 Elsevier B.V. All rights reserved.																	1568-4946	1872-9681				SEP	2020	94								106441	10.1016/j.asoc.2020.106441													
J								A multi-objective artificial butterfly optimization approach for feature selection	APPLIED SOFT COMPUTING										Meta-heuristic algorithms; Machine learning; Pattern recognition; Many-objective optimization	CLASSIFICATION; ALGORITHM; DESIGN	Feature selection plays an essential role in machine learning since high dimensional real-world datasets are becoming more popular nowadays. The very basic idea consists in selecting a compact but representative set of features that reduce the computational cost and minimize the classification error. In this paper, the authors propose single, multi- and many-objective binary versions of the Artificial Butterfly Optimization (ABO) in the context of feature selection. The authors also propose two different approaches: (i) the first one (MO-I) aims at optimizing the classification accuracy of each class individually, while (ii) the second one (MO-II) considers the feature set minimization in the process either. The experiments were conducted over eight public datasets, and the proposed approaches are compared against the well-known Particle Swarm Optimization, Firefly Algorithm, Flower Pollination Algorithm, Brainstorm Optimization, and the Black Hole Algorithm. The results showed that the binary single-objective ABO performed better than the other meta-heuristic techniques, selecting fewer features and also figuring a lower computational burden. Concerning multi- and many-objective feature selection, both MO-I and MO-II approaches performed better than their single-objective meta-heuristic counterparts. (C) 2020 Elsevier B.V. All rights reserved.																	1568-4946	1872-9681				SEP	2020	94								106442	10.1016/j.asoc.2020.106442													
J								Identifying influential spreaders using multi-objective artificial bee colony optimization	APPLIED SOFT COMPUTING										Complex network; Influential nodes; Artificial bee colony; Spreading ability; Influence maximization	SOCIAL NETWORKS; INFLUENCE MAXIMIZATION; COMPLEX NETWORKS; NODE RANKING; IDENTIFICATION; CENTRALITY; USERS; ALGORITHM; INDEX	Advertisement over social networks is critical for many businesses, and selecting the initial set of influential nodes for which the advertising message is passed, is regarded as an important issue in this regard. Although various measures have been proposed for specifying the influentiality of a set, it is affected by different factors. In this paper, a multi-objective function is first defined as an influentiality measure, and finding such an initial is framed as an optimization problem. Then, using artificial bee colony optimization two approaches are proposed to solve the problem. In the first approach, influentiality of nodes is only taken into account, while in the second method a budget constraint is also considered. Different experiments on real networks are conducted to evaluate the proposed methods, where the obtained results show their outperformance over state-of-the-art influence maximization methods. (C) 2020 Elsevier B.V. All rights reserved.																	1568-4946	1872-9681				SEP	2020	94								106436	10.1016/j.asoc.2020.106436													
J								Autonomous Learning Multiple-Model zero-order classifier for heart sound classification	APPLIED SOFT COMPUTING										Autonomous Learning; Data clouds; Evolving fuzzy systems; Heart sound classification; Rule-based system	PERFORMANCE; BRAIN	This paper proposes a new extended zero-order Autonomous Learning Multiple-Model (ALMMo-0*) neuro-fuzzy approach in order to classify different heart disorders through sounds. ALMMo-0* is build upon the recently introduced ALMMo-0. In this paper ALMMo-0 is extended by adding a preprocessing structure which improves the performance of the proposed method. ALMMo-0* has as a learning engine composed of hierarchical a massively parallel set of 0-order fuzzy rules, which are able to self-adapt and provide transparent and human understandable IF ... THEN representation. The heart sound recordings considered in the analysis were sourced from several contributors around the world. Data were collected from both clinical and nonclinical environment, and from healthy and pathological patients. Differently from mainstream machine learning approaches, ALMMo-0* is able to learn from unseen data. The main goal of the proposed method is to provide highly accurate models with high transparency, interpretability, and explainability for heart disorder diagnosis. Experiments demonstrated that the proposed neuro-fuzzy-based modeling is an efficient framework for these challenging classification tasks surpassing its state-of-the-art competitors in terms of classification accuracy. Additionally, ALMMo-0* produced transparent AnYa type fuzzy rules, which are human interpretable, and may help specialists to provide more accurate diagnosis. Medical doctors can easily identify abnormal heart sounds by comparing a patient's sample with the identified prototypes from abnormal samples by ALMMo-0*. (C) 2020 Elsevier B.V. All rights reserved.																	1568-4946	1872-9681				SEP	2020	94								106449	10.1016/j.asoc.2020.106449													
J								A parallel compact cuckoo search algorithm for three-dimensional path planning	APPLIED SOFT COMPUTING										3D path planning; Cuckoo search algorithm; Parallel communication strategy; Compact strategy	OPTIMIZATION	The three-dimensional (3D) path planning of unmanned robots focuses on avoiding collisions with obstacles and finding an optimized path to the target location in a complex three-dimensional environment. An improved cuckoo search algorithm based on compact and parallel techniques for three-dimensional path planning problems is proposed. This paper implements the compact cuckoo search algorithm, and then, a new parallel communication strategy is proposed. The compact scheme can effectively save the memory of the unmanned robot. The parallel scheme can increase the accuracy and achieve faster convergence. The proposed algorithm is tested on several selected functions and three-dimensional path planning. Results compared with other methods show that the proposed algorithm can provide more competitive results and achieve more efficient execution. (C) 2020 Elsevier B.V. All rights reserved.																	1568-4946	1872-9681				SEP	2020	94								106443	10.1016/j.asoc.2020.106443													
J								New peer effect-based approach for service matching in Cloud Manufacturing under uncertain preferences	APPLIED SOFT COMPUTING										Cloud manufacturing; Two-sided matching; Uncertain preferences; Peer effect; Cloud model	DEMAND	Cloud manufacturing is a kind of sharing manufacturing, and the supply-demand matching between manufacturing services and customers has become one of the most important issues for a platform. Because of the increasing complexity of customer personalization, the cognitive information from both sides becomes uncertain and fuzzy. Linguistics is used to describe uncertain preferences, especially in platforms. Also, the cloud model is adopted to convert the linguistics to reflect the randomness and fuzziness. Meanwhile, as the rapid development of communication techniques has strengthened the connections between different agents, the final matching results are affected by connections. Hence, the peer effect, which describes the mutual influences among individuals, is introduced in our study. In addition, considering the different strengths of the connections, the peer effect is improved by integrating grey relations, which are used to evaluate the diverse connections. Finally, the workload is introduced in the form of adjustment parameters. Consequently, we establish a bi-objective model that aims to maximize satisfaction and minimize the differences among individuals. To solve the mathematical model, an improved cuckoo algorithm is proposed. Additionally, the design of an air outlet grille for new-energy vehicles is taken as an example, and the effectiveness of the proposed method is verified. (C) 2020 Elsevier B.V. All rights reserved.																	1568-4946	1872-9681				SEP	2020	94								106444	10.1016/j.asoc.2020.106444													
J								An inverse-distance weighting genetic algorithm for optimizing the wafer exposure pattern for enhancing OWE for smart manufacturing	APPLIED SOFT COMPUTING										Semiconductor industry; Yield enhancement; Inverse distance weighting estimation genetic algorithm (GA); Overall wafer effectiveness (OWE); Total Resource Management (TRM)	BIG DATA; SEMICONDUCTOR; YIELD; STRATEGY; SYSTEM	Wafer exposure pattern will determine the number of gross dies fabricated on the wafer and also affect the yield. Although a number of studies have addressed the wafer exposure pattern problem for maximizing the number of gross dies, little research has considered both the yield and gross dies simultaneously. To fill the gap, this study aims to develop an inverse distance weighting genetic algorithm (IDWGA) that simultaneously maximizes the total number of exposed gross dies and minimizes the deviation of die-estimated measurement from the target for yield enhancement and smart manufacturing. This study developed a novel approach for estimating the die yield from a few measurement points and a three-dimensional (3D) contour plot of die estimates for verifying the measurement pattern among the dies. The proposed IDWGA can detect the die yield pattern during the wafer exposure stage and thus optimize the exposure pattern to maximize the number of gross dies and minimize potential yield loss. On the basis of realistic data, experiments were designed to estimate the validity of the proposed approach. The results have shown practical viability of the proposed approach to optimize overall wafer effectiveness for total resource management. (C) 2020 Elsevier B.V. All rights reserved.																	1568-4946	1872-9681				SEP	2020	94								106430	10.1016/j.asoc.2020.106430													
J								Why Black-Scholes Equations Are Effective Beyond Their Usual Assumptions: Symmetry-Based Explanation	INTERNATIONAL JOURNAL OF UNCERTAINTY FUZZINESS AND KNOWLEDGE-BASED SYSTEMS										Financial options; Black-Scholes equations; decision making under uncertainty; scale invariance		Nobel-Prize-winning Black-Scholes equations are actively used to estimate the price of options and other financial instruments. In practice, they provide a good estimate for the price, but the problem is that their original derivation is based on many simplifying statistical assumptions which are, in general, not valid for financial time series. The fact that these equations are effective way beyond their usual assumptions leads to a natural conclusion that there must be an alternative derivation for these equations, a derivation that does not use the usual too-strong assumptions. In this paper, we provide such a derivation in which the only substantial assumption is a natural symmetry: namely, scale-invariance of the corresponding processes. Scale-invariance also allows us to describe possible generalizations of Black-Scholes equations, generalizations that we hope will lead to even more accurate estimates for the corresponding prices.																	0218-4885	1793-6411				SEP	2020	28			1	SI		1	10		10.1142/S0218488520400012													
J								Uncertainty in Information Market Games	INTERNATIONAL JOURNAL OF UNCERTAINTY FUZZINESS AND KNOWLEDGE-BASED SYSTEMS										Interval uncertainty; information market; game; interval core; interval T-value		A new product can be produced and sold in a market thanks to the entrance of a patent holder into the market. This market is divided into submarkets controlled by only some firms and the profit attainable in each submarket is uncertain. In this paper, this situation is studied by means of cooperative games under interval uncertainty. We consider different ways of allocating the interval profit among the firms. One of these is the interval T-value, which is defined for interval games satisfying some conditions. Efficient interval solutions in terms of the market data are provided.																	0218-4885	1793-6411				SEP	2020	28			1	SI		11	29		10.1142/S0218488520400024													
J								Beyond Deep Learning: An Econometric Example	INTERNATIONAL JOURNAL OF UNCERTAINTY FUZZINESS AND KNOWLEDGE-BASED SYSTEMS										Deep learning; econometrics; currency exchange rate	NETWORKS	In the past, in many areas, the best prediction models were linear and nonlinear parametric models. In the last decade, in many application areas, deep learning has shown to lead to more accurate predictions than the parametric models. Deep learning-based predictions are reasonably accurate, but not perfect. How can we achieve better accuracy? To achieve this objective, we propose to combine neural networks with parametric model: namely, to train neural networks not on the original data, but on the differences between the actual data and the predictions of the parametric model. On the example of predicting currency exchange rate, we show that this idea indeed leads to more accurate predictions.																	0218-4885	1793-6411				SEP	2020	28			1	SI		31	38		10.1142/S0218488520400036													
J								How to Take Both Non-Linearity and Asymmetry (Skewness) into Account in Binary Decision Making: Skew-Probit and Skew-Logit in Binary Kink Regression	INTERNATIONAL JOURNAL OF UNCERTAINTY FUZZINESS AND KNOWLEDGE-BASED SYSTEMS										binary decisions; binary regression; kink regression; logit; probit; skew-normal distribution; skew-logistic distribution	MODEL	In many practical situations, it is desirable to predict binary ("yes"-"no") decisions made by people. The traditional approach to this prediction assumes that the utility linearly depends on the corresponding parameters, and that the distribution of the difference between predicted and actual utility is symmetric - usually normal or logistic; the corresponding techniques are known as, correspondingly, probit and logit. In real life, utility often non-linearly depends on the parameters, and the corresponding distributions are asymmetric (skewed). There are techniques for dealing with non-linearity; the most widely used such technique - called kink regression - uses piece-wise linear approximations to the utility. There are also techniques that take into account the distribution's asymmetry; usually, they are based on using special asymmetric distributions: skew-normal and skew-logistic. In this paper, we show how these two techniques to be combined to take into account both non-linearity and asymmetry. On a real-life example, we show that the new technique indeed leads to a better description of human binary decision-making.																	0218-4885	1793-6411				SEP	2020	28			1	SI		39	49		10.1142/S0218488520400048													
J								Comparing Medical Care Costs using Bayesian Credible Intervals for the Ratio of Means of Delta-Lognormal Distributions	INTERNATIONAL JOURNAL OF UNCERTAINTY FUZZINESS AND KNOWLEDGE-BASED SYSTEMS										Bayesian credible interval; delta-lognormal distribution; medical care cost; uniform-beta prior; zero observation	CONFIDENCE-INTERVALS; VARIANCES	When considering the medical care costs data with a high proportion of zero items of two inpatient groups, comparing them can be estimated using confidence intervals for the ratio of the means of two delta-lognormal distributions. The Bayesian credible interval-based uniform-beta prior (BCIh-UB) is proposed and compared with the generalized confidence interval (GCI), fiducial GCI (FGCI), the method of variance estimates recovery (MOVER), BCIh based on Jeffreys' rule prior (BCIh-JR), and BCIh based on the normal-gamma prior (BCIh-NG). The coverage probability (CP), average length (AL), and lower and upper error rates were the performance measures applied for assessing the methods through a Monte Carlo simulation. A numerical evaluation showed that BCIh-UB had much better CP and AL than the others even with a large difference between the variances and with a high proportion of zero. Finally, to illustrate the efficacy of BCIh-UB, the methods were applied to two sets of medical care costs data.																	0218-4885	1793-6411				SEP	2020	28			1	SI		51	68		10.1142/S021848852040005X													
J								Ruin Probabilities of Continuous-Time Risk Model with Dependent Claim Sizes and Interarrival Times	INTERNATIONAL JOURNAL OF UNCERTAINTY FUZZINESS AND KNOWLEDGE-BASED SYSTEMS										Cramer-Lundberg model; risk model with continuous time; m-dependent random variables; ruin probabilities		In this paper we investigate an insurance continuous-time risk model when the claim sizes and inter-arrival times are m-dependent random variables. We provide an upper exponential bound for the ruin probability.																	0218-4885	1793-6411				SEP	2020	28			1	SI		69	80		10.1142/S0218488520400061													
J								Why the Use of Convex Combinations Works Well for Interval Data: A Theoretical Explanation	INTERNATIONAL JOURNAL OF UNCERTAINTY FUZZINESS AND KNOWLEDGE-BASED SYSTEMS										Interval-valued data; artificial neural network; convex combination method	REGRESSION	One of the main objectives of econometrics is to predict future values of important economics-related quantities, such as unemployment level, stock prices, currency exchange rates, etc. - and especially to predict how different possible economy-boosting measures will affect these quantities. To perform this prediction, we design a model of such effect and train it on the available data. Usually, the daily (or weekly) data are used for this training. However, economics-related quantities fluctuate all the time. So, for each moment of time (e.g., for each day) instead of a single value of the corresponding quantity, we have smallest and largest daily values - i.e., the interval range of daily values. At first glance, it may seem that using both endpoints of this interval for training will lead to more accurate predictions, but in reality, predictions become less accurate. Predictions become more accurate if we only use midpoints of the corresponding intervals. Several recent papers showed that even more accurate predictions are possible if we allow general convex combinations of the intervals' endpoints - and select the corresponding coefficients so as to best fit the data. In this paper, we provide a theoretical explanation for these results.																	0218-4885	1793-6411				SEP	2020	28			1	SI		81	85		10.1142/S0218488520400073													
J								On Statistics of Random Sets for Partial Identification of Econometric Structures	INTERNATIONAL JOURNAL OF UNCERTAINTY FUZZINESS AND KNOWLEDGE-BASED SYSTEMS										Coarse data; copulas; econometric structures; identification; partial identification; random sets; random set statistics; set parameters		In this paper, we emphasize and elaborate on two important and relatively new aspects in uncertainty analysis in order to increase the credibility of empirical results in statistics in general, and in econometrics in particular, namely, the problem of partial identification, and the use of random set statistics. We elaborate on the current interests in partially identified models, exemplified by econometric structures involving copulas. We spell out the rationale and the statistical methods based upon random set theory for analyzing partial identification problem towards credible econometrics.																	0218-4885	1793-6411				SEP	2020	28			1	SI		87	98		10.1142/S0218488520400085													
