PT	AU	BA	BE	GP	AF	BF	CA	TI	SO	SE	BS	LA	DT	CT	CY	CL	SP	HO	DE	ID	AB	C1	RP	EM	RI	OI	FU	FX	CR	NR	TC	Z9	U1	U2	PU	PI	PA	SN	EI	BN	J9	JI	PD	PY	VL	IS	PN	SU	SI	MA	BP	EP	AR	DI	D2	EA	PG	WC	SC	GA	UT	PM	OA	HC	HP	DA
J								Interestingness Improvement of Face Images by Learning Visual Saliency	JOURNAL OF ADVANCED COMPUTATIONAL INTELLIGENCE AND INTELLIGENT INFORMATICS										computer vision; visual attention; face image; personal characteristics; interestingness	MEMORABILITY; ATTENTION	Connecting features of face images with the interestingness of a face may assist in a range of applications such as intelligent visual human-machine communication. To enable the connection, we use interestingness and image features in combination with machine learning techniques. In this paper, we use visual saliency of face images as learning features to classify the interestingness of the images. Applying multiple saliency detection techniques specifically to objects in the images allows us to create a database of saliency-based features. Consistent estimation of facial interestingness and using multiple saliency methods contribute to estimate, and exclusively, to modify the interestingness of the image. To investigate interestingness - one of the personal characteristics in a face image, a large benchmark face database is tested using our method. Taken together, the method may advance prospects for further research incorporating other personal characteristics and visual attention related to face images.																	1343-0130	1883-8014				SEP	2020	24	5					630	637															
J								Projection with Gaussian Kernel for Person Re-Identification	JOURNAL OF ADVANCED COMPUTATIONAL INTELLIGENCE AND INTELLIGENT INFORMATICS										person re-identification; manifold; Gaussian kernel		Person re-identification (ReID), the task of associating the detected images of a person as he/she moves in a non-overlapping camera network, is faced with different challenges including variations in the illumination, view-point and occlusion. To ensure good performance for person ReID, the state-of-the-art methods have leveraged different characteristics for person representation. As a result, a high-dimensional feature vector is extracted and used in the person matching step. However, each feature plays a specific role for distinguishing one person from the others. This paper proposes a method for person ReID wherein the correspondences between descriptors in high-dimensional space can be achieved via explicit feature selection and appropriate projection with a Gaussian kernel. The advantage of the proposed method is that it allows simultaneous matching of the descriptors while preserving the local geometry of the manifolds. Different experiments were conducted on both single-shot and multi-shot person ReID datasets. The experimental results demonstrates that the proposed method outperforms the state-of-the-art methods.																	1343-0130	1883-8014				SEP	2020	24	5					638	647															
J								Feature Analysis for Imbalanced Learning	JOURNAL OF ADVANCED COMPUTATIONAL INTELLIGENCE AND INTELLIGENT INFORMATICS										feature analysis; class imbalance; Bayesian inference	SMOTE	Based on the results of artificial samples generated in the minority class and through the label regulation of the neighbor samples of the majority class, the precision of the classification prediction for imbalanced learning has clearly been enhanced. This article presents a unified solution combining learning factors to improve the learning performance. The proposed method solves this imbalance through a feature selection incorporating the generation of artificial samples and label regulation. A probabilistic representation is used for all aspects of learning: class, sample, and feature. A Bayesian inference is applied to the learning model to interpret the imbalance occurring in the training data and to describe solutions for recovering the balance. We show that the generation of artificial samples is sample based approach and label regulation is class based approach. We discovered that feature selection achieves surprisingly good results when combined with a sample- or class-based solution.																	1343-0130	1883-8014				SEP	2020	24	5					648	655															
J								Building a Fuzzy System for Pulse Based Disease Diagnosis and Acupuncture Therapy	JOURNAL OF ADVANCED COMPUTATIONAL INTELLIGENCE AND INTELLIGENT INFORMATICS										pulse-based diagnosis; expert systems; acupuncture therapy; fuzzy logic; traditional medicine	LOGIC	Pulse-based disease diagnosis and acupuncture therapy are the key components of traditional Oriental medicine. This study aims to model the thinking of medical doctors with regard to their use of pulse-based diagnosis and acupuncture therapy. This paper focuses on a fuzzy inference and knowledge base, which are the main components of the system for pulse based disease diagnosis and acupuncture therapy. The input of the system is the pulse symptoms of the patient with fuzzy degrees, whereas the output is the disease diagnosis and acupuncture therapy prescription. In this system, the knowledge base consists of nearly 1,200 rules for diagnosis and treatment. An evaluation of a group of traditional medical doctors indicates that the results of the newly proposed system are in good accordance with those of doctors practicing traditional medicine. This approach leads to better results than previous approaches because it uses fuzzy logic, which is an appropriate tool here because most entities in traditional medicine are fuzzy in nature. The system of pulse-based disease diagnosis and acupuncture therapy can mimic the thinking of traditional practitioners, and it can be a "good teacher" for medical students who want to learn traditional Vietnamese medicine.																	1343-0130	1883-8014				SEP	2020	24	5					656	661															
J								Mixed Duopoly Stochastic Sales Model with Advertising and Experience Gains for the Public and Foreign Competitors	JOURNAL OF ADVANCED COMPUTATIONAL INTELLIGENCE AND INTELLIGENT INFORMATICS										mixed duopoly; stochastic control model; experience gaining; advertising	RESEARCH-AND-DEVELOPMENT; PRIVATIZATION; SPILLOVERS; PERFORMANCE	In this research, we propose a stochastic model with the finite horizon of time for sales competition between the state-owned company and private (foreign) competitor. We assume that the foreign company objective function is to maximize revenues and the state-owned agent is concerned about welfare maximization. There are many stochastic models for sales, but what is new in our case is that we assume mixed oligopoly and have different types of firms: private and state owned. They have somewhat different objective functions. As a control variable, we take the advertisement expenses of the private firm. Sale bursts rate depends and the advertisement expenditure and experience stock gained. For the public firm, we assume that advertising efforts are fixed. It means that the optimal control is to maximize private firm revenues taking into account possible uncertainties of stochastic profit flow using Bellman's optimality condition. We can find out that the Advertisement-Experience (AE) efforts of the private firm are increasing if sales are increasing. Next, the AE might decrease if the experience level of the private firm increases and we have a sales burst. To optimize the governmental policies, we check for optimal AE effort of the public firm so the social welfare achieves the maximum value.																	1343-0130	1883-8014				SEP	2020	24	5					662	667															
J								Adaptive Personalized Multiple Machine Learning Architecture for Estimating Human Emotional States	JOURNAL OF ADVANCED COMPUTATIONAL INTELLIGENCE AND INTELLIGENT INFORMATICS										affective computing; human robot interaction; non-verbal; multi-modal learning; personal modeling		Robots have the potential to facilitate the future education of all generations, particularly children. However, existing robots are limited in their ability to automatically perceive and respond to a human emotional states. We hypothesize that these sophisticated models suffer from individual differences in human personality. Therefore, we proposed a multi-characteristic model architecture that combines personalized machine learning models and utilizes the prediction score of each model. This architecture is formed with reference to an ensemble machine learning architecture. In this study, we presented a method for calculating the weighted average in a multi-characteristic architecture by using the similarities between a new sample and the trained characteristics. We estimated the degree of confidence during a communication as a human internal state. Empirical results demonstrate that using the multi-model training of each person's information to account for individual differences provides improvements over a traditional machine learning system and insight into dealing with various individual differences.																	1343-0130	1883-8014				SEP	2020	24	5					668	675															
J								Visualization Method Corresponding to Regression Problems and Its Application to Deep Learning-Based Gaze Estimation Model	JOURNAL OF ADVANCED COMPUTATIONAL INTELLIGENCE AND INTELLIGENT INFORMATICS										CNN; eye tracking; Grad-CAM; regression problem		The human gaze contains substantial personal information and can be extensively employed in several applications if its relevant factors can be accurately measured. Further, several fields could be substantially innovated if the gaze could be analyzed using popular and familiar smart devices. Deep learning-based methods are robust, making them crucial for gaze estimation on smart devices. However, because internal functions in deep learning are black boxes, deep learning systems often make estimations for unclear reasons. In this paper, we propose a visualization method corresponding to a regression problem to solve the black box problem of the deep learning-based gaze estimation model. The proposed visualization method can clarify which region of an image contributes to deep learning-based gaze estimation. We visualized the gaze estimationmodel proposed by a research group at the Massachusetts Institute of Technology. The accuracy of the estimation was low, even when the facial features important for gaze estimation were recognized correctly. The effectiveness of the proposed method was further determined through quantitative evaluation using the area over the MoRF perturbation curve (AOPC).																	1343-0130	1883-8014				SEP	2020	24	5					676	684															
J								Smartphone Naive Bayes Human Activity Recognition Using Personalized Datasets	JOURNAL OF ADVANCED COMPUTATIONAL INTELLIGENCE AND INTELLIGENT INFORMATICS										tilt angles; signal magnitude vector; real-time; Gaussian distribution function; personalized dataset	PHYSICAL-ACTIVITY; STROKE; WOMEN	Recognizing human activity in real time with a limited dataset is possible on a resource-constrained device. However, most classification algorithms such as Support Vector Machines, C4.5, and K Nearest Neighbor require a large dataset to accurately predict human activities. In this paper, we present a novel real-time human activity recognition model based on Gaussian Naive Bayes (GNB) algorithm using a personalized JavaScript object notation dataset extracted from the publicly available Physical Activity Monitoring for Aging People dataset and University of Southern California Human Activity dataset. With the proposed method, the personalized JSON training dataset is extracted and compressed into a 12 x 8 multi dimensional array of the time-domain features extracted using a signal magnitude vector and tilt angles from tri-axial accelerometer sensor data. The algorithm is implemented on the Android platform using the Cordova cross-platform framework with HTML5 and JavaScript. Leave-one-activity-out cross validation is implemented as a testTrainer() function, the results of which are presented using a confusion matrix. The testTrainer() function leaves category K as the testing subset and the remaining K-1 as the training dataset to validate the proposed GNB algorithm. The proposed model is inexpensive in terms of memory and computational power owing to the use of a compressed small training dataset. Each K category was repeated five times and the algorithm consistently produced the same result for each test. The result of the simulation using the tilted angle features shows overall precision, recall, F-measure, and accuracy rates of 90%, 99.6%, 94.18%, and 89.51% respectively, in comparison to rates of 36.9%, 75%, 42%, and 36.9% when the signal magnitude vector features were used. The results of the simulations confirmed and proved that when using the tilt angle dataset, the GNB algorithm is superior to Support Vector Machines, C4.5, and K Nearest Neighbor algorithms.																	1343-0130	1883-8014				SEP	2020	24	5					685	702															
J								Artificial Intelligence Research Community and Associations in Poland	FOUNDATIONS OF COMPUTING AND DECISION SCIENCES												In last years Artificial Intelligence presented a tremendous progress by offering a variety of novel methods, tools and their spectacular applications. Besides showing scientific breakthroughs it attracted interest both of the general public and industry. It also opened heated debates on the impact of Artificial Intelligence on changing the economy and society. Having in mind this international landscape, in this short paper we discuss the Polish AI research community, some of its main achievements, opportunities and limitations. We put this discussion in the context of the current developments in the international AI community. Moreover, we refer to activities of Polish scientific associations and their initiative of founding Polish Alliance for the Development of Artificial Intelligence (PP-RAI). Finally two last editions of PP-RAI joint conferences are summarized.																	0867-6356	2300-3405				SEP	2020	45	3					159	177		10.2478/fcds-2020-0009													
J								Transfer Learning Methods as a New Approach in Computer Vision Tasks with Small Datasets	FOUNDATIONS OF COMPUTING AND DECISION SCIENCES										Deep neural networks; Transfer learning; Signal processing; Image analysis; Anomaly detection		Deep learning methods, used in machine vision challenges, often face the problem of the amount and quality of data. To address this issue, we investigate the transfer learning method. In this study, we briefly describe the idea and introduce two main strategies of transfer learning. We also present the widely-used neural network models, that in recent years performed best in ImageNet classification challenges. Furthermore, we shortly describe three different experiments from computer vision field, that confirm the developed algorithms ability to classify images with overall accuracy 87.2-95%. Achieved numbers are state-of-the-art results in melanoma thickness prediction, anomaly detection and Clostridium difficile cytotoxicity classification problems.																	0867-6356	2300-3405				SEP	2020	45	3					179	193		10.2478/fcds-2020-0010													
J								Mining Cardinality Restrictions in OWL	FOUNDATIONS OF COMPUTING AND DECISION SCIENCES										Semantic Web; ontology learning; frequency estimation; kernel density estimation; cardinality restrictions	FRAMEWORK; ONTOLOGY	We present an approach to mine cardinality restriction axioms from an existing knowledge graph, in order to extend an ontology describing the graph. We compare frequency estimation with kernel density estimation as approaches to obtain the cardinalities in restrictions. We also propose numerous strategies for filtering obtained axioms in order to make them more available for the ontology engineer. We report the results of experimental evaluation on DBpedia 2016-10 and show that using kernel density estimation to compute the cardinalities in cardinality restrictions yields more robust results that using frequency estimation. We also show that while filtering is of limited usability for minimum cardinality restrictions, it is much more important for maximum cardinality restrictions. The presented findings can be used to extend existing ontology engineering tools in order to support ontology construction and enable more efficient creation of knowledge-intensive artificial intelligence systems.																	0867-6356	2300-3405				SEP	2020	45	3					195	216		10.2478/fcds-2020-0011													
J								Application of Machine Learning Algorithms for Traffic Forecasting in Dynamic Optical Networks with Service Function Chains	FOUNDATIONS OF COMPUTING AND DECISION SCIENCES										Dynamic Optical Networks; Traffic Prediction; Service Function Chaining; Machine Learning		Knowledge about future optical network traffic can be beneficial for network operators in terms of decreasing an operational cost due to efficient resource management. Machine Learning (ML) algorithms can be employed for forecasting traffic with high accuracy. In this paper we describe a methodology for predicting traffic in a dynamic optical network with service function chains (SFC). We assume that SFC is based on the Network Function Virtualization (NFV) paradigm. Moreover, other type of traffic, i.e. regular traffic, can also occur in the network. As a proof of effectiveness of our methodology we present and discuss numerical results of experiments run on three benchmark networks. We examine six ML classifiers. Our research shows that it is possible to predict a future traffic in an optical network, where SFC can be distinguished. However, there is no one universal classifier that can be used for each network. Choice of an ML algorithm should be done based on a network traffic characteristics analysis.																	0867-6356	2300-3405				SEP	2020	45	3					217	232		10.2478/fcds-2020-0012													
J								Analysis of statistical model-based optimization enhancements in Generalized Self-Adapting Particle Swarm Optimization framework	FOUNDATIONS OF COMPUTING AND DECISION SCIENCES										Particle Swarm Optimization; global optimization; metaheuristic	EVOLUTION	This paper presents characteristics of model-based optimization methods utilized within the Generalized Self-Adapting Particle Swarm Optimization (GA-PSO) - a hybrid global optimization framework proposed by the authors. GAPSO has been designed as a generalization of a Particle Swarm Optimization (PSO) algorithm on the foundations of a large degree of independence of individual particles. GAPSO serves as a platform for studying optimization algorithms in the context of the following research hypothesis: (1) it is possible to improve the performance of an optimization algorithm through utilization of more function samples than standard PSO sample-based memory, (2) combining specialized sampling methods (i.e. PSO, Differential Evolution, model-based optimization) will result in a better algorithm performance than using each of them separately. The inclusion of model-based enhancements resulted in the necessity of extending the GAPSO framework by means of an external samples memory - this enhanced model is referred to as M-GAPSO in the paper. We investigate the features of two model-based optimizers: one utilizing a quadratic function and the other one utilizing a polynomial function. We analyze the conditions under which those model-based approaches provide an effective sampling strategy. Proposed model-based optimizers are evaluated on the functions from the COCO BBOB benchmark set.																	0867-6356	2300-3405				SEP	2020	45	3					233	254		10.2478/fcds-2020-0013													
J								Improving coordination in small-scale multi-agent deep reinforcement learning through memory-driven communication	MACHINE LEARNING										Reinforcement learning; Multi-agent systems; Artificial neural networks	EMERGENCE; WORLD	Deep reinforcement learning algorithms have recently been used to train multiple interacting agents in a centralised manner whilst keeping their execution decentralised. When the agents can only acquire partial observations and are faced with tasks requiring coordination and synchronisation skills, inter-agent communication plays an essential role. In this work, we propose a framework for multi-agent training using deep deterministic policy gradients that enables concurrent, end-to-end learning of an explicit communication protocol through a memory device. During training, the agents learn to perform read and write operations enabling them to infer a shared representation of the world. We empirically demonstrate that concurrent learning of the communication device and individual policies can improve inter-agent coordination and performance in small-scale systems. Our experimental results show that the proposed method achieves superior performance in scenarios with up to six agents. We illustrate how different communication patterns can emerge on six different tasks of increasing complexity. Furthermore, we study the effects of corrupting the communication channel, provide a visualisation of the time-varying memory content as the underlying task is being solved and validate the building blocks of the proposed memory device through ablation studies.																	0885-6125	1573-0565				SEP	2020	109	9-10			SI		1727	1747		10.1007/s10994-019-05864-5													
J								Detection outliers on internet of things using big data technology	EGYPTIAN INFORMATICS JOURNAL										Internet of things; IoT; Big data; Data quality; Outliers Detection; DBSCAN; RDDs	CLUSTERING-ALGORITHM; MR	Internet of Things (IoT) is a fundamental concept of a new technology that will be promising and significant in various fields. IoT is a vision that allows things or objects equipped with sensors, actuators, and processors to talk and communicate with each other over the internet to achieve a meaningful goal. Unfortunately, one of the major challenges that affect IoT is data quality and uncertainty, as data volume increases noise, inconsistency and redundancy increases within data and causes paramount issues for IoT technologies. And since IoT is considered to be a massive quantity of heterogeneous networked embedded devices that generate big data, then it is very complex to compute and analyze such massive data. So this paper introduces a new model named NRDD-DBSCAN based on DBSCAN algorithm and using resilient distributed datasets (RDDs) to detect outliers that affect the data quality of IoT technologies. NRDD-DBSCAN has been applied on three different datasets of N-dimensions (2-D, 3-D, and 25-D) and the results were promising. Finally, comparisons have been made between NRDD-DBSCAN and previous models such as RDD-DBSCAN model and DBSCAN algorithm, and these comparisons proved that NRDD-DBSCAN solved the low dimensionality issue of RDD-DBSCAN model and also solved the fact that DBSCAN algorithm cannot handle IoT data. So the conclusion is that NRDD-DBSCAN proposed model can detect the outliers that exist in the datasets of N-dimensions by using resilient distributed datasets (RDDs), and NRDD-DBSCAN can enhance the quality of data exists in IoT applications and technologies. (C) 2019 Production and hosting by Elsevier B.V. on behalf of Faculty of Computers and Artificial Intelligence, Cairo University.																	1110-8665	2090-4754				SEP	2020	21	3					131	138		10.1016/j.eij.2019.12.001													
J								The impacts of social media on University students in Iraq	EGYPTIAN INFORMATICS JOURNAL										Social media; University students; Education; Business; Political		The rapid increase in the era of the technological revolution and the Internet, especially the social media, have created a new reality in the daily life of the societies in general and of the university students in particular, so this new reality without any doubt imposes on us the general effects of this increasing use of social media has affected all areas and societies The effects are positive and negative. These social means have become a vast space for exchanging ideas, making new friends, proposals, sources of information, business and e-shopping. In this study, we have decided to shed light on the academic, political and economic effects of the study by comparing them to the general effects of social media by looking at the demographic variables of Iraqi university students. Three universities (Kerbela University in the Middle Euphrates, UOITC University in the capital Baghdad and Tikrit University in western Iraq) where we considered spatial, cultural and social differences. Data collected through a survey consisting of four categories, General Influences, Academic Influences, Political Influences and Influences Business (distributed over 40 questions) We tried to cover most of the students' common uses of social media and their impact on them. The questionnaire was distributed through 100 questionnaires to each university. The total number of participants was (201) distributed on (77) participants from Karbala University, (50) participants from Tikrit University and (74) participants from the University of Information and Communication Technology (UOITC). (C) 2020 Production and hosting by Elsevier B.V. on behalf of Faculty of Computers and Artificial Intelligence, Cairo University.																	1110-8665	2090-4754				SEP	2020	21	3					139	144		10.1016/j.eij.2019.12.003													
