PT	AU	BA	BE	GP	AF	BF	CA	TI	SO	SE	BS	LA	DT	CT	CY	CL	SP	HO	DE	ID	AB	C1	RP	EM	RI	OI	FU	FX	CR	NR	TC	Z9	U1	U2	PU	PI	PA	SN	EI	BN	J9	JI	PD	PY	VL	IS	PN	SU	SI	MA	BP	EP	AR	DI	D2	EA	PG	WC	SC	GA	UT	PM	OA	HC	HP	DA
J								The two-echelon multi-objective location routing problem inspired by realistic waste collection applications: The composable model and a metaheuristic algorithm	APPLIED SOFT COMPUTING										Location routing problem; Multi-objective optimization; Multi-echelon; Genetic algorithm	MATHEMATICAL-MODEL; TABU SEARCH; DELIVERY; DESIGN; MOEA/D	Waste collection has always been a major research area in waste management. It plays an important role in social development and environmental sustainability. However, the past research often makes great efforts to formulate dedicated models to some specific waste collection applications, and relatively speaking, fewer efforts have been devoted to relevant method development. Inspired by these issues, in this work, we first develop a more general two-echelon multi-objective location routing problem model (2E-MOLRP) in consideration of the inherent similarities of many realistic waste collection applications. In the model, various commonly-seen and potential costs are classified in a straightforward way and different objectives can hence be flexibly defined to satisfy different requirements. Furthermore, to solve the model, an improved non-dominated sorting genetic algorithm with directed local search (INSGA-dLS) is proposed. In order to validate its effectiveness, experiments are conducted in comparison with existing representative metaheuristics and the results show that our proposed algorithm can achieve better performance even without using local search. Also, we prove that the specially-designed directed locate search is able to further improve our algorithm's performance significantly in experiments. (C) 2020 Elsevier B.V. All rights reserved.																	1568-4946	1872-9681				SEP	2020	94								106477	10.1016/j.asoc.2020.106477													
J								How does thinking relate to tool making?	ADAPTIVE BEHAVIOR										Cognitive archaeology; stone tool making; Material Engagement Theory; cognitive boundaries	HANDAXE REDUCTION; COGNITION; ARCHAEOLOGY; SKILL; METAPLASTICITY; DIFFICULTIES; TECHNOLOGY; TOOLMAKING; ARTIFACTS; GESTURES	How the boundaries of the mind should be drawn with respect to action and the material world is a core research question that cognitive archaeology shares with contemporary cognitive sciences. The study of hominin technical thinking, as in the case of stone tool making, is a good way to bring that question to the fore. This article argues that archaeologists who study lithic artefacts and their transformations over the course of human evolution are uniquely well positioned to contribute to the ongoing debate about the marks of the mental. Adopting the material engagement approach, I propose to replace the internalist vision of mentality, that is, the vision of a brain-bound mind that is using the body to execute and externalise preconceived mental plan through the stone, with an ecological-enactive vision of participatory mentality where bodily acts and materials act together to generate rather than merely execute thought processes. I argue that the latter participatory view changes the geography of the cognitive and offers a better description for the continuity of mind and matter that we see in the lithic record.																	1059-7123	1741-2633														1059712320950539	10.1177/1059712320950539		SEP 2020											
J								Universal Functions Originator	APPLIED SOFT COMPUTING										Universal functions originator; Regression analysis; Neural networks; Support vector machines; Artificial intelligence; Machine learning		Nowadays, couples of computing systems have been introduced to perform many applications, such as function approximation, pattern classification, categorization/clustering, forecasting/prediction, control, and optimization. Linear regression (LR) is commonly used for simple data where the relation between its coefficients is linear, while nonlinear regression (NLR) is used when that relation is nonlinear. Artificial neural networks (ANNs) and support vector machines (SVMs) are more efficient and they can be used for complex applications. However, each one of these approaches has its own strengths and weaknesses. This study introduces a new computing system called "universal functions originator (UFO)". This system is a new symbolic regression (SR) technique that can generate mathematical models universally through two independent optimization algorithms. Different arithmetic operators can be entered into the search pool. Also, any analytic function can be dragged into that pool. UFO has been mathematically designed and practically tested with function approximation problems. However, UFO can also be used for the applications listed above, including anomaly detection, function complication, function simplification, dimension expansion, dimension reduction, and highdimensional function visualization. This novel computing system shows an impressive performance with many promising uses and distinct capabilities. This study reveals the mechanism of UFO and solves some numerical problems via an advanced graphical user interface (GUI) designed just to validate the process of this computing system. (C) 2020 Elsevier B.V. All rights reserved.																	1568-4946	1872-9681				SEP	2020	94								106417	10.1016/j.asoc.2020.106417													
J								A hybrid genetic and Lagrangian relaxation algorithm for resource-constrained project scheduling under nonrenewable resources	APPLIED SOFT COMPUTING										Project scheduling; Nonrenewable resources; Pre-scheduled procurement; Genetic algorithm; Lagrangian Relaxation	RCPSP; MANAGEMENT	Scheduling under nonrenewable resources is one of the challenging issues in project scheduling problems. There are many cases where the projects are subject to some nonrenewable resources. In most of the literature, nonrenewable resources are assumed to be available in full amount at the beginning of the project. However, in practice, it is prevalent that these resources are procured along the project horizon. This paper studies the generalized resource-constrained project scheduling problem (RCPSP) where, in addition to renewable resources, nonrenewable resources are considered, such as budget or consuming materials by the project activities. As the problem is NP-hard, some sub-algorithm elements are developed, which can be used in the structure of inexact approaches for solving the problem. These elements include constraint propagation, priority rules, schedule generation schemes, and local search improvement procedures. Also, a lower bounding algorithm is developed based on the Lagrangian Relaxation (LR) approach, and the problem is optimized by the Genetic Algorithm (GA). The hybrid GA-LR algorithm produces a result reasonably near to optimum solutions. Comprehensive computational experiments based on standard project scheduling problems are performed to evaluate these developments. The experiments showed the performance and robustness of the proposed algorithm. (C) 2020 Elsevier B.V. All rights reserved.																	1568-4946	1872-9681				SEP	2020	94								106482	10.1016/j.asoc.2020.106482													
J								A fuzzy collaborative forecasting approach considering experts' unequal levels of authority	APPLIED SOFT COMPUTING										Fuzzy collaborative forecasting; Dynamic random access memory; Fuzzy weighted intersection	GROUP DECISION-MAKING; LINEAR-REGRESSION; INTELLIGENCE APPROACH; TIME; AGGREGATION	Experts typically have unequal authority levels in collaborative forecasting tasks. Most current fuzzy collaborative forecasting methods address this problem by applying a (fuzzy) weighted average to aggregate experts' fuzzy forecasts. However, the aggregation result may be unreasonable, hence fuzzy weighted intersection operators have been proposed for fuzzy collaborative forecasting. This paper proposes that unequal expert authority levels are considered when deriving the membership function rather than the aggregation value. Therefore, the membership of a value in the aggregation result cannot exceed those in experts' fuzzy forecasts. The proposed approach was applied to forecast the yield of a dynamic random access memory product to validate its effectiveness. Experimental results showed that the proposed methodology outperformed all current best-practice methods considered in every aspect, and in particular achieving 65% mean root mean square error reduction. Thus, a high expert authority level increased the likelihood for the forecast, which could not be satisfactorily addressed by simply applying a higher weight to the forecast. (C) 2020 Elsevier B.V. All rights reserved.																	1568-4946	1872-9681				SEP	2020	94								106455	10.1016/j.asoc.2020.106455													
J								A rough-fuzzy approach integrating best-worst method and data envelopment analysis to multi-criteria selection of smart product service module	APPLIED SOFT COMPUTING										Smart product service system; Smart product service module selection; Intrapersonal and interpersonal uncertainty; Rough-fuzzy best-worst method; Rough-fuzzy data envelopment analysis	CUSTOMER SATISFACTION; SUPPLIER SELECTION; SUSTAINABILITY; SYSTEMS; DESIGN; MODEL; TECHNOLOGIES; EFFICIENCY; FRAMEWORK; INTERNET	The revolutionary development and implementation of smart technologies have triggered the manufacturers' servitization trend towards smart product service system (PSS). Accurate selection of smart product service (SPS) module is critical to successful planning and development of smart PSS concept. This study constructs a list of criteria for SPS module selection from the perspectives of service implementation, value symbiosis and smart capability. The selection can be deemed as a multi-criteria decision-making process including two parts: weight determination of criteria and module ranking, in which the intrapersonal linguistic ambiguousness and interpersonal preference randomness are involved. The best-worst method (BWM) is widely acknowledged as an efficient method for weight determination due to its superiority in quickly finding optimal weight with scant decision data. The data envelopment analysis (DEA) method is proven feasible to prioritize alternatives with cost-based and benefit-based criteria. However, these two methods cannot handle the uncertainties involved in the selection process which may lead to imprecise results. Moreover, the previous research rarely studies simultaneous handling of these two types of uncertainty in the realm of BWM and DEA. Therefore, the current study proposes a novel rough-fuzzy BWM-DEA approach to SPS module selection, with fully capturing both the intrapersonal and interpersonal uncertainties. The application of the proposed approach in the smart vehicle service module selection and the comparisons with other methods demonstrate the validity and effectiveness of the proposed approach. (C) 2020 Elsevier B.V. All rights reserved.																	1568-4946	1872-9681				SEP	2020	94								106479	10.1016/j.asoc.2020.106479													
J								Z-number integrated weighted VIKOR technique for hazard prioritization and its application in virtual prototype based EOT crane operations	APPLIED SOFT COMPUTING										EOT crane; Hazard identification; Virtual reality; Zadeh's Z-number; VIKOR; Shannon entropy principle	MODIFIED FAILURE MODE; RISK-EVALUATION; FUZZY; SAFETY	Hazard identification and its ranking is one of the foundation steps of safety management. Nowadays, failure mode and effect analysis (FMEA), a reliability analysis tool, is widely used to identify, assess, and rank hazards/failure events related to products, processes, and services because of its simplistic nature. Traditional FMEA focuses on computing the risk priority number (RPN) to rank the identified hazards based on three risk factors, occurrence (O), severity (S), and detectability (D) of a failure mode (FM). However, the traditional RPN method has been criticized because of its limitations in the assessment of hazards/failure events, weighting of the risk factors, and prioritization of the FMs. Furthermore, experts usually provide rating on the risk factors based on their expertise, which introduces impreciseness, uncertainty, and vagueness in the subsequent assessments. In this study, Z-number is used to capture the uncertainty and unreliability associated with experts' evaluation. Also, the concept of objectivity is deployed along with subjectivity in the weight calculation of the risk factors in the information assessment process. Classic VIKOR (ViseKriterijum-ska Optimizacija I Kompromisno Resenje) method is also extended in Z-environment to rank the identified hazards by incorporating the concepts of maximum group utility and minimum regret. For the illustration purpose, we have applied our proposed method in virtual prototyping based EOT crane operations. Sensitivity analysis and comparative evaluation with the existing methods are also presented to validate our proposed method. (C) 2020 Elsevier B.V. All rights reserved.																	1568-4946	1872-9681				SEP	2020	94								106419	10.1016/j.asoc.2020.106419													
J								A nature-inspired feature selection approach based on hypercomplex information	APPLIED SOFT COMPUTING										Meta-heuristic optimization; Hypercomplex spaces; Feature selection	FIREFLY ALGORITHM; OPTIMIZATION; MODEL	Feature selection for a given model can be transformed into an optimization task. The essential idea behind it is to find the most suitable subset of features according to some criterion. Nature-inspired optimization can mitigate this problem by producing compelling yet straightforward solutions when dealing with complicated fitness functions. Additionally, new mathematical representations, such as quaternions and octonions, are being used to handle higher-dimensional spaces. In this context, we are introducing a meta-heuristic optimization framework in a hypercomplex-based feature selection, where hypercomplex numbers are mapped to real-valued solutions and then transferred onto a boolean hypercube by a sigmoid function. The intended hypercomplex feature selection is tested for several meta-heuristic algorithms and hypercomplex representations, achieving results comparable to some state-of-the-art approaches. The good results achieved by the proposed approach make it a promising tool amongst feature selection research. (C) 2020 Elsevier B.V. All rights reserved.																	1568-4946	1872-9681				SEP	2020	94								106453	10.1016/j.asoc.2020.106453													
J								Kriging-assisted Discrete Global Optimization (KDGO) for black-box problems with costly objective and constraints	APPLIED SOFT COMPUTING										Kriging; Computationally expensive; Discrete; Constrained; Global optimization	MULTIDISCIPLINARY DESIGN OPTIMIZATION; VARIABLE NEIGHBORHOOD SEARCH; SURROGATE MODEL ALGORITHM; ADAPTIVE DIRECT SEARCH; INSPIRED ALGORITHM; PARTICLE SWARM	In this paper, a Kriging-assisted discrete global optimization method is presented for computationally expensive black-box problems. KDGO employs Kriging to approximate the landscape of a black-box model, and utilizes a novel infilling strategy to capture the promising discrete samples. In the infilling strategy, a multi-start knowledge mining approach is introduced, including Optimization, Projection, Sampling and Selection. Firstly, a multi-start optimization is used to capture the promising solutions in the continuous design range. Secondly, all these potential solutions are projected to a predefined matrix and a grid sampling method suitable for low and high-dimensional space is proposed to get the promising discrete samples. Thereafter, the k-nearest neighbors (KNN) search strategy and expected improvement (EI) criterion are jointly used to select the candidate samples. The algorithm keeps running to update Kriging and find the most promising samples until the satisfactory solution is obtained. KDGO is primarily developed to solve time-consuming black-box problems with various discrete cases including binary, integer, non-integer, uni/multimodal and box/inequality-constrained types. After the comparison tests on 20 representative benchmark cases, KDGO proves that it can build a reasonable balance between exploitation and exploration. Besides, compared with the existing 6 methods, KDGO has significant advantages on computational efficiency and robustness. Finally, KDGO is used for structure optimization of a blended-wing-body underwater glider, and gets the satisfactory design. (C) 2020 Elsevier B.V. All rights reserved.																	1568-4946	1872-9681				SEP	2020	94								106429	10.1016/j.asoc.2020.106429													
J								Green vehicle routing and scheduling problem with heterogeneous fleet including reverse logistics in the form of collecting returned goods	APPLIED SOFT COMPUTING										Green vehicle routing and scheduling; Heterogeneous fleet; Reverse logistics; Time-dependent traffic patterns; CO2 emissions	NEIGHBORHOOD SEARCH; GENETIC ALGORITHM; OPTIMIZATION	Vehicle routing problem (VRP) is about finding optimal routes for a fixed fleet of vehicles in order that they can meet the demands for a set of given customers by traveling through those paths. This problem and its numerous expansions are one of the most important and most applicable transportation and logistics problems. In this study, the green vehicle routing and scheduling problem with heterogeneous fleet including reverse logistics in the form of collecting returned goods along with weighted earliness and tardiness costs is studied to establish a trade-off between operational and environmental costs and to minimize both simultaneously. In this regard, a mixed integer non-linear programming (MINLP) model is proposed. Since the problem is categorized as NP-hard, two meta-heuristics, a simulated annealing (SA) and a genetic algorithm (GA) are suggested in order to find near-optimal solutions for large instances in a reasonable computational time. The performances of the proposed algorithms are evaluated in comparison with the mathematical model for small-sized problems and with each other for problems of all size using a set of defined test problems. Analysis of the results considering two criteria: solutions quality and computational times, indicates the satisfactory performance of the presented algorithms in a proper computational time. Meanwhile, a statistical hypothesis testing (T test) is conducted. It can generally be observed that SA achieves relatively better results in terms of solution quality, while GA spends less computational time for all-sized test problems. Eventually, sensitivity analysis is conducted to investigate the effect of collecting returned goods on the cost of total CO2 emissions, variable costs of the fleet and the objective function value. (C) 2020 Elsevier B.V. All rights reserved.																	1568-4946	1872-9681				SEP	2020	94								106462	10.1016/j.asoc.2020.106462													
J								Multi-frame decision fusion based on evidential association rule mining for target identification	APPLIED SOFT COMPUTING										Multi-sensor target identification; Data-driven decision-making; Evidential support and confidence; Association rule mining; Belief function theory	FREQUENT ITEMSETS; INFORMATION; ALGORITHM; MODEL	In the multi-sensor target identification problem involving multiple frames, it is important to fuse the potential information characterizing inherent relations among frames with uncertain decision inputs for enhancing the decision-making process. However, due to the influence of environments or other interference factors, the priori knowledge that accurately represents these relations is usually hard to obtain. To overcome this difficulty, we propose a rule mining-based multi-frame decision fusion (abbreviated as RMDF) method, in which the unknown relations can be discovered from a series of historical sensor reports in the framework of belief functions. First, to accommodate data uncertainty, new measures of evidential support and confidence are defined for a constructed multi-frame evidential database, which are generalizations of the support and confidence measures in binary and probabilistic databases. Then, with these measures, an evidential association rule mining algorithm is developed to discover the relations among frames from a series of historical reports. Finally, how these mined rules are properly combined with uncertain decision information using belief function theory is explored. The key benefit of the RMDF method is that it enables modeling the uncertain relations among frames for deriving more accurate decision results. To demonstrate the feasibility and effectiveness of our proposal, an airborne target identification problem is studied under different conditions and the numerical results show that the identification performance of our method is significantly better than the traditional expert knowledge-based method where the available knowledge is inevitably incomplete or inaccurate. (C) 2020 Elsevier B.V. All rights reserved.																	1568-4946	1872-9681				SEP	2020	94								106460	10.1016/j.asoc.2020.106460													
J								Strengthen EEG-based emotion recognition using firefly integrated optimization algorithm	APPLIED SOFT COMPUTING										Emotion recognition; Feature selection; Firefly algorithm; EEG; Classification	FEATURE-SELECTION; TENSOR DECOMPOSITION; SIGNALS; CLASSIFICATION; PSO	Emotion recognition is helpful for human to enhance self-awareness and respond appropriately towards the happenings around them. Due to the complexity and diversity of emotions, EEG-based emotion recognition is still a challenging task in pattern recognition. In order to recognize diverse emotions, we propose a novel firefly integrated optimization algorithm (FIOA) in this paper. It can simultaneously accomplish multiple tasks, i.e. the optimal feature selection, parameter setting and classifier selection according to different EEG-based emotion datasets. The FIOA utilizes a ranking probability objection function to guarantee the high accuracy recognition with less features. Moreover, the hybrid encoding expression and the dual updating strategy are developed in the FIOA so as to realize the optimal selection of feature subset and classifier without stagnating in the local optimum. In addition to the public DEAP datasets, we also conducted an EEG-based music emotion experiment involving 20 subjects for the validation of the proposed FIOA. After filtering and segmentation, three categories of features were extracted from every EEG signal. Then FIOA was applied to every subject dataset for two pattern recognition of emotions. The results show that the FIOA can automatically find the optimal features, parameter and classifier for different emotion datasets, which greatly reduces the artificial selection workload. Furthermore, comparing with the binary particle swarm optimization (PSObinary) and the binary firefly (FAbinary), the FIOA can achieve the higher accuracy with less features in the emotion recognition. (C) 2020 Elsevier B.V. All rights reserved.																	1568-4946	1872-9681				SEP	2020	94								106426	10.1016/j.asoc.2020.106426													
J								A multi-stage multi-criteria hierarchical decision-making approach for sustainable supplier selection	APPLIED SOFT COMPUTING										Fuzzy best-worst method; Sustainable supplier selection; Supply chain management; Fuzzy logic	BEST-WORST METHOD; FUZZY TOPSIS; NETWORK; MANAGEMENT; MODEL; PERFORMANCE; ENVIRONMENT; EXTENSION; FRAMEWORK; RISK	Sustainable supplier selection is known as a crucial objective in supply chains due to its impact on profitability, adorability, flexibility, and agility of the system. This study proposes a new multi-stage hierarchical fuzzy index-based approach with which decision-makers are empowered to select the most sustainable supplier based on sustainability triple bottom line criteria. Besides, a new fuzzy extension for the best-worst method is proposed considering trapezoidal fuzzy membership functions that can cover uncertainty under imprecise environments. This study makes a contribution to the literature of sustainable supply chains in the sense that it facilitates the computational complexity of previous decision-making approaches by collecting the most relevant criteria and a straightforward fuzzy process. Besides, the graded mean integration representation method has been adopted for prioritizing the supplier based on their performance of sustainable development, which enhances the accuracy of selection compared with previous ranking methods. The proposed study can be utilized as a benchmark for sustainability evaluations between suppliers. A real-world case study is resolved to illustrate the superiority and broad application of the proposed model. (C) 2020 Elsevier B.V. All rights reserved.																	1568-4946	1872-9681				SEP	2020	94								106456	10.1016/j.asoc.2020.106456													
