PT	AU	BA	BE	GP	AF	BF	CA	TI	SO	SE	BS	LA	DT	CT	CY	CL	SP	HO	DE	ID	AB	C1	RP	EM	RI	OI	FU	FX	CR	NR	TC	Z9	U1	U2	PU	PI	PA	SN	EI	BN	J9	JI	PD	PY	VL	IS	PN	SU	SI	MA	BP	EP	AR	DI	D2	EA	PG	WC	SC	GA	UT	PM	OA	HC	HP	DA
J								Scoring and assessment in medical VR training simulators with dynamic time series classification	ENGINEERING APPLICATIONS OF ARTIFICIAL INTELLIGENCE										Virtual reality; Simulation; Medical training; Skill assessment; Classification; Time series	SURGICAL SKILL; PERFORMANCE; RETRIEVAL; ALGORITHM; NETWORKS	This research proposes and evaluates scoring and assessment methods for Virtual Reality (VR) training simulators. VR simulators capture detailed n-dimensional human motion data which is useful for performance analysis. Custom made medical haptic VR training simulators were developed and used to record data from 271 trainees of multiple clinical experience levels. DTW Multivariate Prototyping (DTW-MP) is proposed. VR data was classified as Novice, Intermediate or Expert. Accuracy of algorithms applied for time-series classification were: dynamic time warping 1-nearest neighbor (DTW-1NN) 60%, nearest centroid SoftDTW classification 77.5%, Deep Learning: ResNet 85%, FCN 75%, CNN 72.5% and MCDCNN 28.5%. Expert VR data recordings can be used for guidance of novices. Assessment feedback can help trainees to improve skills and consistency. Motion analysis can identify different techniques used by individuals. Mistakes can be detected dynamically in real-time, raising alarms to prevent injuries.																	0952-1976	1873-6769				SEP	2020	94								103760	10.1016/j.engappai.2020.103760													
J								An engine-fault-diagnosis system based on sound intensity analysis and wavelet packet pre-processing neural network	ENGINEERING APPLICATIONS OF ARTIFICIAL INTELLIGENCE										Engine fault diagnosis; Sound intensity analysis; Noise-based fault recognition; Wavelet package analysis (WPA); Artificial neural network (ANN)	COMBUSTION ENGINES	Based on the techniques of sound intensity analysis, incomplete wavelet packet analysis (WPA) and artificial neural network (ANN), a WPA pre-processing method for noise-based engine fault diagnosis (EFD), so-called WPA-ANN model, is presented in this paper. The noises of an EFI gasoline engine under normal and fault states are measured and their contours of sound intensity level (SIL) are calculated by interpolation approach to initially investigate the possibility of a SIL-based EFD. Furthermore, an incomplete WPA model, which consists of a five-level discrete wavelet transform (DWT) and a four-level WPA, is developed and applied to the measured noise signals for extracting fault features of the engine, as is a multi-layered ANN model for engine failure classification by using the extracted features of the noises. To verify the proposed approach, the WPA-ANN model is extended to recognize other noise-related faults of the engine. The results suggest that the noise-based WPA-ANN models are effective for engine fault diagnosis. Due to its time-frequency characteristics and pattern recognition capacity, the WPA-ANN can be used to process both the stationary and nonstationary signals. In view of the applications, the proposed WPA-ANN model can be directly used in vehicle EFDs, and may be extended to other sound-related fields for failure diagnosis in engineering.																	0952-1976	1873-6769				SEP	2020	94								103765	10.1016/j.engappai.2020.103765													
J								Cross-scale generative adversarial network for crowd density estimation from images	ENGINEERING APPLICATIONS OF ARTIFICIAL INTELLIGENCE										Generative adversarial network; Crowd density estimation; Deconvolution convolutions; Loss function	SIMULATION; EVACUATION; MULTIPLE; HUMANS; RISK; BEHAVIORS; TRACKING; STATIONS; MODEL	This research develops a cross-scale convolutional spatial generative adversarial network (CSGAN), in order to estimate the crowd density from images accurately. It consists of two similar generators, one for the whole feature extraction, and the other for patch scale feature extraction. An encoder-decoder structure is employed to generate density maps from input images or patches. Additionally, a new objective function for crowd counting called cross-scale consistency pursuit containing an adversarial loss, L2 loss, perceptual loss, and consistency loss, is developed to make the generated density maps more realistic and closer to the ground truth. The effectiveness of the proposed CSGAN is verified in two public datasets. Results indicate that the new objective function is able to reach the most satisfying value of evaluation metrics in both the low-density and high-density crowd scenes when it is compared with other state-of-the-art methods on the test datasets. Moreover, the proposed CSGAN is more practical and flexible due to the smaller computational complexity. Its estimation capability will be significantly improved even in a small size of training data. Overall, this research contributes to the development of a novel computer vision approach together with a new objective function to generate density maps from cross-scale crowd images, enabling the counting process more accurately and efficiently.																	0952-1976	1873-6769				SEP	2020	94								103777	10.1016/j.engappai.2020.103777													
J								Optimized task distribution based on task requirements and time delay in edge computing environments	ENGINEERING APPLICATIONS OF ARTIFICIAL INTELLIGENCE										Edge computing; Node selection; Bloom filter; Task distribution	FOG; CLOUD; MINIMIZATION; PLACEMENT; SECURITY; INTERNET; SYSTEMS; MODEL	Edge computing is a new technology for completing real-time and complex tasks with low latency. However, due to limited storage, computing and communication capabilities of edge nodes, it is often necessary for multiple edge nodes to share a task's related work load to decrease its overall execution time. To solve the problem, this paper proposes a task distribution method based on the analysis of task requirements and time delay in an edge computing environment. First, the related data is received by a proxy server to obtain the running states of edge nodes. Then, a task-based edge node selection algorithm is designed to select appropriate target edge nodes. It can meet task requirements by using a Bloom filter to filter malicious nodes. Finally, based on the above selected nodes, optimized target edge nodes are selected to achieve the minimum time delay. Based on the selected optimized target edge nodes, this paper proposes an algorithm to optimize task distribution for meeting task requirements and achieve the minimum delay in an edge computing environment. Because the method considers both task requirements and time delay, it can distribute tasks to target nodes at low cost. The experimental results show that the method is feasible and effective and outperforms two commonly-used methods																	0952-1976	1873-6769				SEP	2020	94								103774	10.1016/j.engappai.2020.103774													
J								Designing energy-efficient high-precision multi-pass turning processes via robust optimization and artificial intelligence	JOURNAL OF INTELLIGENT MANUFACTURING										Multi-pass machining; Turning process; Robust optimization; Energy efficiency; Multi-objective optimization; Evolutionary computation	MULTIOBJECTIVE OPTIMIZATION; PROGRAMMING APPROACH; CUTTING PARAMETERS; NETWORK DESIGN; CONSUMPTION; OPERATIONS; ALGORITHMS; PREDICTION	This paper suggests a novel robust formulation designed for optimizing the parameters of the turning process in an uncertain environment for the first time. The aim is to achieve the lowest energy consumption and highest precision. With this aim, the current paper considers uncertain parameters, objective functions, and constraints in the offered mathematical model. We proposed several uncertain models and validated the results in real-world case studies. In addition, several artificial intelligence-based solution techniques are designed to solve the complex nonlinear problem. We determined the most efficient solution approach by solving various test problems. Then, simulated several scenarios to demonstrate the robustness of our results. The results showed that the solutions provided by the offered model significantly reduce energy consumption in different setups. To ensure the reliability of the results, we carried out worst-case sensitivity analyses and found the most critical parameters. The results of the worst-case analyses indicated that the offered robust model is efficient and saves a significant amount of energy comparing to traditional models. It is shown that the provided solution by the presented robust formulation is reliable in all situations and results in the lowest energy and the best machining precision.																	0956-5515	1572-8145															10.1007/s10845-020-01648-0		SEP 2020											
J								Knowledge based approach to ground refuelling optimization of commercial airplanes	EXPERT SYSTEMS										aircraft; expert system; genetic algorithm; knowledge engineering; refuelling	MASS ESTIMATION; AIRCRAFT	This work aims to establish a general and optimized procedure for the initial refuelling of commercial airplanes, as this loading process is strongly related to safety and energy saving issues. The on-ground refuelling is addressed as an optimization problem whose cost function involves expert knowledge about constraints and factors that influence the aircraft stability and performance. Several heterogeneous criteria (fuelling time, structural load, flow transfers, etc.) have been considered and weighted accordance to its importance in terms of stability. This allows us to adapt the strategy to any type and planned trip of the airplane. The priority is the positioning of the centre of mass of the civil aircraft within safety and manoeuvrability margins, and near the optimal position. Evolutive algorithms are applied, keeping feasible solutions by modifying genetic operators. As a case of study, the initial refuelling of a long range type commercial aircraft, the Airbus A330-200, is analysed. Simulation results have proved this methodology to be efficient and optimal. Even more, this heuristic and general approach improves the traditional solution that follows a set of pre-defined rules that are specific for each type of aircraft.																	0266-4720	1468-0394														e12631	10.1111/exsy.12631		SEP 2020											
J								Fingerprint enhancement using multi-scale classification dictionaries with reduced dimensionality	IET BIOMETRICS										image enhancement; principal component analysis; learning (artificial intelligence); image representation; fingerprint identification; reduced dimensionality; fingerprint enhancement method; sparse representation; learned multiscale classification dictionaries; multiscale dictionary; enhancement quality; quality grading scheme; multiscale composite windows; high-quality spectra diffuse; low-quality fingerprint patches; spectra quality	GABOR FILTER; SPARSE REPRESENTATION; DIFFUSION; ALGORITHM; SCHEME; DESIGN	In order to improve the quality of fingerprint with a large noise, this study proposes a fingerprint enhancement method by using a sparse representation of learned multi-scale classification dictionaries with reduced dimensionality. The multi-scale dictionary is used to balance the contradiction between the accuracy and the anti-noise ability, which is an ideal solution to reconcile the demands of enhancement quality and computational performance. The principal component analysis is applied in the authors' technique for dimension reduction of multi-scale classification dictionaries. Under the quality grading scheme and multi-scale composite windows, the fingerprint patches are enhanced by using a sparse representation of learned multi-scale classification dictionaries with reduced dimensionality according to their priorities. In addition, the multi-scale composite windows help the more high-quality spectra diffuse into the low-quality fingerprint patches and this can greatly improve the spectra quality of them. Experimental results and comparisons on FVC 2000 and FVC 2004 databases are reported. And it shows that the proposed method yields better results in terms of the robustness of fingerprint enhancement as compared with the latest techniques. Moreover, the results show that the proposed algorithm can obtain better identification performance.																	2047-4938	2047-4946				SEP	2020	9	5					194	204		10.1049/iet-bmt.2019.0121													
J								Two-tiered face verification with low-memory footprint for mobile devices	IET BIOMETRICS										smart phones; feature extraction; mobile computing; face recognition; convolution; biometrics (access control); neural nets; facial verification method; mobile environment; two-tiered procedure; hand-crafted features; convolutional neural network; CNN; device owner; verification task; hybrid-image input; face images; art face verification methods; recent smartphone models; existing face verification CNNs; low-memory footprint; mobile devices; personal data; knowledge-based procedures; recently biometric traits; secure authentication; effortless authentication	RECOGNITION	Mobile devices have their popularity and affordability greatly increased in recent years. As a consequence of their ubiquity, these devices now carry all sorts of personal data that should be accessed only by their owner. Even though knowledge-based procedures are still the main methods to secure the owner's identity, recently biometric traits have been employed for more secure and effortless authentication. In this work, the authors propose a facial verification method optimised to the mobile environment. It consists of a two-tiered procedure that combines hand-crafted features and a convolutional neural network (CNN) to verify if the person depicted in a photograph corresponds to the device owner. To train a CNN for the verification task, the authors propose a hybrid-image input, which allows the network to process encoded information of a pair of face images. The proposed experiments show that the solution outperforms state of the art face verification methods, providing a 4x speedup when processing an image in recent smartphone models. Additionally, the authors show that the two-tiered procedure can be coupled with existing face verification CNNs improving their accuracy and efficiency. They also present a new data set of selfie pictures - RECOD Selfie data set - that hopefully will support future research in this scenario.																	2047-4938	2047-4946				SEP	2020	9	5					205	215		10.1049/iet-bmt.2020.0031													
J								Constant-Q magnitude-phase coefficients extraction for synthetic speech detection	IET BIOMETRICS										speech synthesis; principal component analysis; feature extraction; discrete cosine transforms; magnitude-phase coefficients extraction; synthetic speech detection; useful discriminative information; magnitude-phase spectrum; phase-spectra information; CMPC; uniform resampling; long-term window; short-term window; feature dimensions; constant-Q magnitude-phase coefficients extraction; CQT; MPS	SPEAKER VERIFICATION	Previous works in synthetic speech detection have focused on features based on magnitude or phase spectrum. In this study, to extract useful discriminative information for synthetic speech detection, the authors propose a feature based on magnitude-phase spectrum (MPS), combining magnitude- and phase-spectra information. The proposed feature is termed as constant-Q magnitude-phase coefficient (CMPC), which is obtained by combining constant-Q transform (CQT), MPS, uniform resampling, and discrete cosine transform. The CQT used in this study is a long-term window transform, which can provide the basis for CMPC to capture important artefacts of synthetic speech. Such artefacts are obtained using a unit selection algorithm, which have difficulties when based on the short-term window transform. Uniform resampling aims to convert MPS from the octave domain into the linear domain. The discrete cosine transform is used when extracting principal components to remove correlations among the feature dimensions. The experimental results on AVspoof and ASVspoof 2015 corpora show that CMPC performs better than some commonly used features based on magnitude or phase spectrum alone. Their system based on CMPC outperforms many known systems.																	2047-4938	2047-4946				SEP	2020	9	5					216	221		10.1049/iet-bmt.2018.5100													
J								Undergraduate teaching audit and evaluation using an extended MABAC method underq-rung orthopair fuzzy environment	INTERNATIONAL JOURNAL OF INTELLIGENT SYSTEMS										ITARA method; MABAC method; q-rung orthopair fuzzy set; teaching audit and evaluation; teaching quality evaluation	GROUP DECISION-MAKING; INTERVAL TYPE-2; LOGIC SYSTEMS; QUALITY; SELECTION; AGGREGATION; FRAMEWORK; MODEL; AHP	Undergraduate teaching audit and evaluation (UTAE) is a new type of evaluation pattern, which is extremely important for a university to improve its quality assurance system and enhance teaching quality. Selecting an optimal university for benchmarking through UTAE to promote the quality of teaching can be regarded as a complex multicriteria decision making (MCDM) problem. Furthermore, in the process of UTAE, experts' evaluations over the teaching quality of universities are often imprecise and fuzzy due to the subjective nature of human thinking. In this paper, we propose a new UTAE approach based onq-rung orthopair fuzzy sets and the multiattribute border approximation area comparison (MABAC) method for evaluating and selecting the best university for benchmarking. The introduced method deals with the linguistic assessments given by experts by usingq-ROFSs, assigns the weights of audit elements based on the indifference threshold-based attribute ratio analysis method, and acquires the ranking of universities with an extended MABAC method. The feasibility and effectiveness of the proposedq-rung orthopair fuzzy MABAC method is demonstrated through a realistic UTAE example. Results show that the UTAE method being proposed is valid and practical for UTAE.																	0884-8173	1098-111X				DEC	2020	35	12					1912	1933		10.1002/int.22278		SEP 2020											
J								Optimal mixed block withholding attacks based on reinforcement learning	INTERNATIONAL JOURNAL OF INTELLIGENT SYSTEMS										block withholding attacks; Markov chain; reinforcement learning; strategic behaviors	GAME	The vulnerabilities in cryptographic currencies facilitate the adversarial attacks. Therefore, the attackers have incentives to increase their rewards by strategic behaviors. Block withholding attacks (BWH) are such behaviors that attackers withhold blocks in the target pools to subvert the blockchain ecosystem. Furthermore, BWH attacks may dwarf the countermeasures by combining with selfish mining attacks or other strategic behaviors, for example, fork after withholding (FAW) attacks and power adaptive withholding (PAW) attacks. That is, the attackers may be intelligent enough such that they can dynamically gear their behaviors to optimal attacking strategies. In this paper, we propose mixed-BWH attacks with respect to intelligent attackers, who leverage reinforcement learning to pin down optimal strategic behaviors to maximize their rewards. More specifically, the intelligent attackers strategically toggle among BWH, FAW, and PAW attacks. Their main target is to fine-tune the optimal behaviors, which incur maximal rewards. The attackers pinpoint the optimal attacking actions with reinforcement learning, which is formalized into a Markov decision process. The simulation results show that the rewards of the mixed strategy are much higher than that of honest strategy for the attackers. Therefore, the attackers have enough incentives to adopt the mixed strategy.																	0884-8173	1098-111X				DEC	2020	35	12					2032	2048		10.1002/int.22282		SEP 2020											
J								Automation for the artisanal economy: enhancing the economic and environmental sustainability of crafting professions with human-machine collaboration	AI & SOCIETY										Human-machine collaboration; Artisanal economy; Generative justice; Industrial symbiosis; Ethnocomputing	JOB DECISION LATITUDE; DESIGN; CONSUMPTION; DEMANDS; HEALTH	Artificial intelligence (AI) is poised to eliminate millions of jobs, from finance to truck driving. But artisanal products (e.g., handmade textiles) are valued precisely because of their human origins, and thus have some inherent "immunity" from AI job loss. At the same time, artisanal labor, combined with technology, could potentially help to democratize the economy, allowing independent, small-scale businesses to flourish. Could AI, robotics and related automation technologies enhance the economic viability and environmental sustainability of these beloved crafting professions, perhaps even expanding their niche to replace some job loss in other sectors? In this paper, we compare the problems created by the current mass production economy and potential solutions from an artisanal economy. In doing so, the paper details the possibilities of utilizing AI to support hybrid forms of human-machine production at the microscale; localized and sustainable value chains at the mesoscale; and networks of these localized and sustainable producers at the macroscale. In short, a wide range of automation technologies are potentially available for facilitating and empowering an artisanal economy. Ultimately, it is our hope that this paper will facilitate a discussion on a future vision for more "generative" economic forms in which labor value, ecological value and social value can circulate without extraction or alienation.																	0951-5666	1435-5655				SEP	2020	35	3					595	609		10.1007/s00146-019-00915-w													
J								Indowordnet's help in Indian language machine translation	AI & SOCIETY										Machine translation; Statistical machine translation; Lexical resources; Indowordnet; Indian-Indian language machine translation; English-Indian language machine translation		Languages with insufficient digitally available resources, such as, Indian-Indian and English-Indian language Machine Translation (MT) system developments, faces the difficulty to translate various lexical phenomena. In this paper, we present our work on a comparative study of 440 phrase-based statistical trained models for 110 language pairs across 11 Indian languages. We have developed 110 baseline statistical machine translation systems. Then, we have augmented the training corpus with Indowordnet synset word entries of lexical database and further trained 110 models on top of the baseline system. We have done a detailed performance comparison using various evaluation metrics such as BLEU score, METEOR, and TER. We observed significant improvement in evaluations of translation quality across all the 440 models after using the Indowordnet. These experiments give a detailed insight in two ways: (1) usage of lexical database with synset mapping for resource poor languages and (2) efficient usage of Indowordnet synset mapping. Moreover, synset mapped lexical entries helped the SMT system to handle the ambiguity to a great extent during the translation.																	0951-5666	1435-5655				SEP	2020	35	3					689	698		10.1007/s00146-019-00907-w													
J								Anthropomorphizing AlphaGo: a content analysis of the framing of Google DeepMind's AlphaGo in the Chinese and American press	AI & SOCIETY										AlphaGo; AI; Weiqi; Framing; Media coverage	POLITICS; SCIENCE; ROBOTS; AI	This article conducts a mixed-method content analysis of Chinese and American news media coverage of Google DeepMind's Go playing computer program, AlphaGo. Drawing on humanistic approaches to artificial intelligence, combined with an empirically rigorous content analysis, it examines the differences and overlap in coverage by the Chinese and American press in their accounts of AlphaGo, and its historic match with Korea's Lee Sedol in March, 2016. The event was not only followed intensely in China, but also made the front page ofThe New York Times.This article finds that the Chinese press was more likely than the American press to frame AlphaGo as non-threatening, which the authors attribute to cultural differences and the two countries' different understandings of Go. In addition to quantitatively identifying similarities and differences in the framing of AlphaGo, this paper also investigates the underlying and evolving contestations over what constitutes the "human" and the "machine." It concludes by discussing the implications of the study's findings as well as outlining avenues for further research.																	0951-5666	1435-5655				SEP	2020	35	3					727	735		10.1007/s00146-019-00908-9													
J								The new AI spring: a deflationary view	AI & SOCIETY																													0951-5666	1435-5655				SEP	2020	35	3					747	750		10.1007/s00146-019-00912-z													
J								A possibility of inappropriate use of gender studies in human-robot Interaction	AI & SOCIETY											NEGATIVE ATTITUDES; PERSONALITY																		0951-5666	1435-5655				SEP	2020	35	3					751	754		10.1007/s00146-019-00913-y													
